text,label,source
@user y és una lastima porque tiene muy buenas ideas de diseño y al no pasar por Java rinden guay...pero MicroSoft y sus cosas,negative,intertass_2017
@user Denada y muy op lo del 6.16,neutral,intertass_2017
"Las eresiones mas comunes de un país, muestran su cultura, en Costa Rica es ""Pura Vida"" nada que pueda agregar",positive,intertass_2017
Hoy nos tocó de últimos en el Festival Navideño de PZ y lloviendo. Adivinen cómo quedé.,negative,intertass_2017
No me llamo Laura pero te casarias conmigo?  #ElRaboDe8cho @user,neutral,intertass_2017
PPK hizo una mención especial a todos los jóvenes que marcharon anoche. La lucha no fue en vano. #MensajeALaNación #LaEducaciónSeRespeta,positive,intertass_2017
Lo que se enojó cuando le dije que me iva a ir a pachanga :v jajajajajaja lindo amiguito resultó ser,negative,intertass_2017
@user ya no puedo tomar - cero alcohol- ayer estuve internada en la clínica como 6 horas.,neutral,intertass_2017
"@user querida, veo tu tuit ahora!!! No nos vimos, pero fluimos en un mismo sentir",positive,intertass_2017
"Ya es oficia nos quedamos sin Konoplyanka en @user   Eso sí, será una alternativa barata a Reus en la Bundes http",negative,intertass_2017
@user @user Muy pero que muy bueno. Lo dejaron solo al pobre chaval en una batalla contra Afganistán,neutral,intertass_2017
Bienvenida a los juegos mentales,positive,intertass_2017
Siempre las mejores personas son las que más sufren  #GetWellSoonSelenaFromSpain,negative,intertass_2017
Extraño tener a mis padres juntos,neutral,intertass_2017
"@user ya  Si algún día soy rica te llevo conmigo a verlo a donde sea, promesita 👉👈",positive,intertass_2017
"@user ingrato, solo porque usted sí",negative,intertass_2017
Sólo piensa q diste todo... y duermes tranquila,neutral,intertass_2017
Que bueno que le gustara @user @user,positive,intertass_2017
Yo hasta ahora veo el vídeo del pingüino no lo puedo creer. ¿Es normal que esté tan triste? Díganme que ustedes también lloraron.,negative,intertass_2017
"@user mira el hilo, que está explicado  es el primer planeta (b) de la estrella Próxima Centaur Próxima Centauri b",neutral,intertass_2017
"@user que va tía, muchos son viejos de mi madre, otros del chino. Los que me encantan y me estoy comprando son los del Kiko",positive,intertass_2017
"Mi mejor amigo me quiere revender un cupón para un fds en un Hotel en Chincha. Qué, voy sola o qué? te pasaste de pendejo @user",negative,intertass_2017
"Al principio él no te gusta , pero te acaba gustando y cuando te deja lo extrañas",neutral,intertass_2017
Una semana siendo vegetariano. Es un pequeño gran logro para mí,positive,intertass_2017
Luego la rara soy yo,negative,intertass_2017
@user perdida ya no tomo coca.,neutral,intertass_2017
@user Muchas gracias  Muy feliz y dulce finde,positive,intertass_2017
Tú que he ido a cenar a mar de cristal y me he inflado y me duele la barriga,negative,intertass_2017
@user hace una semana que se sabe  yo ya espero la edicion completa del juego,neutral,intertass_2017
@user Tienes un buen KI. Para luchar contra los malos en Chicago PD.,positive,intertass_2017
Estaba el autobús Benidorm-Madrid al lado con las puertas abiertas y me ha tentado subirme y volver.,negative,intertass_2017
hace mucho no e tenido que ver mi nombre en otras cuentas por que sera? a cierto yo le dije que no lo hiciera Gracias por hacer caso,neutral,intertass_2017
"@user Pues sí, es precioso como bien puedes ver en el vídeo",positive,intertass_2017
"@user Hay que hacer algo contra los Incendios Forestales, ya basta, estamos jodidos.",negative,intertass_2017
necesito hacerme una sesión de fotos de estas en plan bonitas,neutral,intertass_2017
"@user Jejeje te has explicado muy bien, tranqui, y si prefieres hablar por otro sitio, lo hacemos  Pues Sue la ""reservaron"" +",positive,intertass_2017
sabes que tu vida es muy puta cuando empiezas las clases en menos de una semana,negative,intertass_2017
Pero solo cojo 5 días porque me cambio de curro y,neutral,intertass_2017
"Mi palabra preferida para este 2016, fue gratitud. Todo funciona mejor agradeciendo.",positive,intertass_2017
"@user A mi tampoco me va, bueno, te queda cerrar los ojos sin dormir o joderte y sufrir",negative,intertass_2017
@user si algún día quieres echar una ojeada al plan de transportes de Madrid de 1988 ya sabes,neutral,intertass_2017
"Hoy hice el gol de mi vida, perdimos 8-1 pero hice el gol de mi vida",positive,intertass_2017
#LaPoderosaKeiko solo puede tener poder en el 4to país más ignorante del mundo: Perú,negative,intertass_2017
"@user Monsefuana, tienes que configurar eso. Jajajaja. No se puede vivir en paz con el carrete lleno de memes. Te daré los tips.",neutral,intertass_2017
"Uno tiene que abrir burbuja #feliz sábado tuiteros..disfrutar del coctel maravilloso que sigue, la felicidad.",positive,intertass_2017
"@user gracias, yo también estoy triste porque no te vi",negative,intertass_2017
cual es su mejor recuerdo juntos? #BntResponde,neutral,intertass_2017
"Se pone interesante la cosa, ganas de evolucionar para tener pokemon fuertes en casi todos los tipos",positive,intertass_2017
Mae yo soy tan idiota que tome jarabe por que tenía mucha tos y ahora estoy como si estuviera borracha y no puedo estudiar,negative,intertass_2017
clrealy no es una indirecta,neutral,intertass_2017
"Me esta encantando la animacion encerio :,) Cuando veo el final me da un poco ganas de llorar :,) Bueno solo me falta background y texto",positive,intertass_2017
@user ah mae que duro eso en este día,negative,intertass_2017
"@user @user Brutal... Y al parecer los que hacen de periodistas, también siguen con su grupo de wassap un año después",neutral,intertass_2017
@user bonito día para hacer un tweet con esta foto,positive,intertass_2017
Ptmr hoy se presenta trébol clan y recuerdo que en gotica se presentó y fue la última vez que lo vi y hice mi cagada claro,negative,intertass_2017
"¿Mañana stream?  ! Espero que mi internet no se vuelva loco como antes, aunque estos dias funciona bien!",neutral,intertass_2017
"@user muchas gracias niñuca, tú tienes una gran sensibilidad por eso valoro mucho tu opinión. Feliz noche",positive,intertass_2017
"@user y con ""las conozco"", me refiero a Maria y Krisbell . Mandale mis saluditos, somos ingratas todas",negative,intertass_2017
"Bueno, Yixing tuvo pocas líneas como siempre, pero no voy a andar de pesada. Al menos no esta vez",neutral,intertass_2017
"Este año la quiniela perfecta de los mundiales da como premio las 3 skins definitivas, interesante...",positive,intertass_2017
al final me ha dejado llorando y pues bien  yo que estaba hoy pensando saltos de los feliz que estaba. Al pelo todo,negative,intertass_2017
Vamos a pasar año nuevo a la playa No? Bueno,neutral,intertass_2017
Mi papá emocionado hasta las lágrimas con los tenores... hay conciertos que se quedan en el alma para siempre.,positive,intertass_2017
@user @user te lleguen a entender y a respetar. Muy malos tienen que ser para obligarte a comer algo a la fuerza,negative,intertass_2017
"Voy asi: Silvio Rodríguez, Ismael Serrano, Cristian Castro (homenaje a José José) y el Buki... el asunto es serio",neutral,intertass_2017
@user Agradecidos. Nos miras con buenos ojos  @user,positive,intertass_2017
me mantengo optimista pero se me hace difícil a veces de verdad,negative,intertass_2017
"Regresé de la playa hoy y literal todo el día he dormido, y aún sigo con sueño",neutral,intertass_2017
@user have fun Antu! Los mejores deseos,positive,intertass_2017
@user Pos sí que eras tú limitada en encontrar formas de no aburrirse en clase,negative,intertass_2017
"Pablo continúa su hilo, imprescindible.  Luego haremos crowfunding entre todos para hacerle un ""Medium""  http",neutral,intertass_2017
Sin duda ha sido la semana más larga del mundo a su vez ha sido una de las más bellas,positive,intertass_2017
@user la próxima vez que vaya a Madrid no estarás en mis planes. Maldita,negative,intertass_2017
¿Conoces la pubalgia relacionado con la lesión de Messi? El doctor Quesada lo explica en el video siguiente  http,neutral,intertass_2017
"@user hombreee, poco a poco, los 5 primeros minutos que montes en bici te sabrán a gloria  así que ánimo que todo llega",positive,intertass_2017
Aún no estoy listo para una nueva mamá,negative,intertass_2017
Para mi mamá toda la ropa que escojo es fea hasta que me la ve puesta,neutral,intertass_2017
"Voy con demasiados sueños locos. Y demasiados, siempre son pocos  #Yolo #mondaymotivation",positive,intertass_2017
La operación de Carmen me tiene muy triste,negative,intertass_2017
@user @user @user se conserva la misma cuenta. Pero el programa será distinto,neutral,intertass_2017
@user  Buenos dias y feliz domingo  abrazo♡,positive,intertass_2017
@user @user Conmigo no los tiene abiertos porque me bloqueó,negative,intertass_2017
"Entre lo positivo, está el hecho de que no tendré esas responsabilidades extra que adquiría sí yo quedaba electo. Pero mae yo quería",neutral,intertass_2017
"@user oye, 7/8 no está nada mal",positive,intertass_2017
"@user estaba en momento ""odio eterno"" necesitaba compartirlo  además yo hace poco que tengo canal y no me siento NADA identificada",negative,intertass_2017
"Como te elicas algo que no viste venir, ¿Cómo?",neutral,intertass_2017
"@user un placer guapa!! @user es un sol!! bueno, los dos los sois",positive,intertass_2017
Qué triste ver que el odio por una mujer esté por encima de la razón,negative,intertass_2017
"@user @user @user yo solo quiero saber si tienen mi libreta y los llaveros de llamas que les di son 2, blanca y negra",neutral,intertass_2017
"@user Yo, he probado con pisco, y buenazo tmb, ah.",positive,intertass_2017
"Que tristes son los velorios y entierros, mi Papá está llorando peor que un bebito recien nacido",negative,intertass_2017
Nominada por @user   Aquí van nuestras pelis y nuestros taggeados.  http,neutral,intertass_2017
"Cosas q debemos usar para simplificar nuestra vida: el cerebro, sentido común, una sonrisa y eliminar a quién no nos interesa. Simple",positive,intertass_2017
@user @user me parece que sueles reclamar demasiados sobrentendidos,negative,intertass_2017
"@user jajajaja fácil,o derrepente ya nos lo cambiaron por uno nuevo",neutral,intertass_2017
@user tu ventilador me mira con cara seductora.,positive,intertass_2017
@user @user porque al final siempre llegan a lo mismo: es que ella debió asumir más su lado femenino,negative,intertass_2017
@user recién me conectooooo Juan está enfermo mañana te prometo que te recojo,neutral,intertass_2017
El sol echa el cierre a un día estupendo en  #VillardeOlalla #Cuenca Preparados para otra noche de fiesta  http,positive,intertass_2017
hoy me han traído a mi perra después de seis días sin verla y está to nerviosa y más delgada,negative,intertass_2017
"Ma, mira... - Qué? La Paca? Sí, cómo supiste? - Porque es lo único que haces.",neutral,intertass_2017
Creo k es la primera vez k estoy deseando k llegue septiembre de una vez,positive,intertass_2017
@user a mi me gustaba antes. Ahora todo es super cuadrado y feo,negative,intertass_2017
@user las tuyas y las nuestras  ajajajaj,neutral,intertass_2017
"@user gracias niñuca es preciosa, te prometo que me has alegrado la tarde con este detalle tan Bello y enternecedor. Mil besos",positive,intertass_2017
Que duro iniciar el día con noticias tristes,negative,intertass_2017
@user yo estaba todo feliz,neutral,intertass_2017
"@user sep, mi familia es MUY lectora y mi círculo de amistades también",positive,intertass_2017
@user yo nunca la he podido ver entera porque literalmente me duermo,negative,intertass_2017
@user La carta compuesta es un factor más. También está la #sinastría que ayuda a suavizar una compuesta difícil,neutral,intertass_2017
"@user No sé si saldrá algo relacionado con Escocia, pero los paisajes son increíbles",positive,intertass_2017
Creo que soy muy rencorosa,negative,intertass_2017
"@user Una vez mi prima me besó sin previo aviso. Ese fue mi primer beso, y nunca he vuelto a tener uno",neutral,intertass_2017
@user ojalá sigan juntos mucho tiempo,positive,intertass_2017
Quiero entrar en tantas clases pero soy pobre.,negative,intertass_2017
@user ay no mms ARELIIIII.A los añooooos sdfjksf te extraño we,neutral,intertass_2017
Ha vuelto @user con energías renovadas. Los lunes por la noche el Doctor Amor y su consulta te esperan en su #periscope,positive,intertass_2017
"@user Prohibirlo, no. Se pueden hacer campañas, pedagogía... y no aplaudir como están haciendo muchas pseudo-feministas  @user",negative,intertass_2017
"Mi último trabajo por obra y gracia de @user @user @user, un spot para el @user #megapanic  http",neutral,intertass_2017
"Nunca es tarde para hacer un sueño..con una mente soñadora, un puñado de ganas, fe y un corazón de amor, todo es posible.",positive,intertass_2017
No debí cogerme la cara con las manos suciaaaaas!!,negative,intertass_2017
"+ a VOSOTROS, y siempre intento daros bola y responder a vuestras cosas.  Pero bueno, se ve que no es suficiente",neutral,intertass_2017
Creo que lo mas jodido del 2016 ya me ha pasado y ya estoy lista para lo que venga! jodidamente bien,positive,intertass_2017
"@user "" En algún momento empecé a mirar más al suelo que al cielo "" "" Estoy harto de llorar, así que intento sonreír """,negative,intertass_2017
lo mejor es que son conversaciones normales y corrientes sin ningún ánimo de ligar pero  simplemente porque no se ligar,neutral,intertass_2017
@user por supuesto amigo mí que pases buen domingo,positive,intertass_2017
Que horrible sensación cuando se te atasca una pastilla en la garganta #Meduele.,negative,intertass_2017
"@user Mi ciudad bonitaa llena de nieve fijo  , gracias, es que pensaba que solo estaba en netflix",neutral,intertass_2017
Esas costillitas se ven demasiado buenas... Ya quiero cenar!,positive,intertass_2017
Creo que mi amor platónico de tw es gay y me acabo de poner tan triste,negative,intertass_2017
"@user @user @user @user @user a mí como a veces me piden ""la firma escaneada en el doc""...",neutral,intertass_2017
"@user ya yo voy de vuelta, pero le dejé la pampa lindísima",positive,intertass_2017
"Si es que llegáis aquí desde mi Favstar del cretácico y claro, luego no me duráis ni un suspiro. Que mis neuronas no son como antes, jopé",negative,intertass_2017
"@user justo vi en Ig que lo tenías y te quería preguntar. Cuando lo hagas, espero el review! Y sí, yo tb tengo varios pendientes",neutral,intertass_2017
"@user @user no importa con esa linea como sino juegas nada, seguirás siendo buenisimo ( con cariño jeje  )",positive,intertass_2017
@user LOL miguez tu eres guapo no le hagas ni caso no ves que es VASCA y alli NO SE FOLLA pero no es culpa tuya,negative,intertass_2017
Buenos días!!!! mi pensamiento esta mañana al despertar es que si o si tengo que ir a dar un paseo al parque y disfrutar de la naturaleza,neutral,intertass_2017
"@user bueno no es tan mala, tiene muuuchos elementos de las primeras dos películas (eso es lo mejor) y le agregan otros nuevos",positive,intertass_2017
"@user @user @user @user Pero son los periodistas de La Nación, ud dijo que eran los dueños de la verdad y vea.11 ideal",negative,intertass_2017
"Vale: MAE HOY CONOCI UN MAE SUPER GUAPO, SUAVE YA TE ENSEÑO UNA FOTO *5 min despues me lo enseña* Yo: Valeria ese es mi ex Jajajaj siaa.",neutral,intertass_2017
@user es que son super perfectas para la otra DIOS NECESITO QUE ALGUN DIA SE CONFIRME,positive,intertass_2017
"@user pero me jode no encontrar un pantalon pitillo que me quede PITILLO , y es horrible porque mi vida son los vaqueros",negative,intertass_2017
Dibujé a Chikorita (mi pokemon fav) y lo malogré con 'mi técnica de pintar con acuarelas'...tmr!,neutral,intertass_2017
"Haces que se vaya mi melancolía, me devuelves de nuevo a la vida",positive,intertass_2017
@user los ábacos si están permitidos. Sobre todo porque la mayoría no saben usarlo,negative,intertass_2017
@user Xinia de mi vida tenía toda la intención pero se me hizo imposible al final del día,neutral,intertass_2017
@user En lo relativo a la secesión mi estimado @user es un amante de las marcianadas. Pero debatir con él es entretenido,positive,intertass_2017
"Si, yo soy un cabron y no tengo orgullo",negative,intertass_2017
"@user Un poquito. Pero es normal porque es oscuro.   Anyways, sigue viéndosete un poquito pelirrojo. ^^ Reflejos o algo así.",neutral,intertass_2017
"@user pues todo muy bien   Eso sí, muchos cambios desde la ultima vez que hablamos 😁",positive,intertass_2017
@user voy a ir con un árbol de Navidad en la camisa a taller solo para arruinar su día,negative,intertass_2017
Gracias a todos por regalarme sus comentarios a mi columna de hoy. Invaluable obsequio para mí.,neutral,intertass_2017
Estoy emocionado por primera vez realice una llamada internacional a Chile.,positive,intertass_2017
"Con este día, cuatro y el tambor en la playa. Qué mala es la vuelta a la rutina para algunos...",negative,intertass_2017
@user buenas tardes! Se puede pasar?,neutral,intertass_2017
"Bueno, pues vamos a recuperar el tiempo perdido. Empezare por descargarme el Manchester City - West Ham, a ver que tal",positive,intertass_2017
@user lástima que la foto de la derecha eclipse un texto certero!,negative,intertass_2017
@user jajajaja tiene pinta más bien de que lo hicieron colombiano por el acento,neutral,intertass_2017
@user muchas gracias mariaa! Tenlo claro que te avisaré!  un beso!!,positive,intertass_2017
Shits happens! En el concilio de Nicea se debe haber fumado de todo o no me lo explico  http http,negative,intertass_2017
"@user @user estamos iniciando combate, en cuanto estés disponible avisa y te apuntamos para la siguiente ronda",neutral,intertass_2017
@user @user asi tiene que ser .. yo m alegro solo si el barca pierde en algo qe influya a madrid cmo la liga ayer tuani,positive,intertass_2017
"@user @user IA no llegó a ser social. Fue un espacio social de dinamización, muy útil, pero con fecha de caducidad. Y abrumador.",negative,intertass_2017
Y es jvsto en ese preciso instante en el cval le dices a tv papá Qve qvieres ser Dj y al final tome la decicion de mandarte a la mrd,neutral,intertass_2017
¡¡Entramos en el mes de septiembre con las pilas cargadas!! Bienvenidos de nuevo a vuestra clínica dental de confianza,positive,intertass_2017
Lamentable informan que murió Gabriel Badilla. #RIPGladiador,negative,intertass_2017
"@user Y Noel significa Navideño, pedo también lo asumimos. Pero alguien lo tuvo que poner por primera vez",neutral,intertass_2017
Dios guarda para mi lo mejor por que mi fe en el siempre perdurara por la eternidad. Quien busca encuentra y no se conforma con poco.,positive,intertass_2017
"Broder, que pinxe tráfico hay en Salaverry, por UPC. No jodas, voy a llegar tarde de nuevo",negative,intertass_2017
Imposible no subir de peso aquí ( Chiclayo y sus comidas ),neutral,intertass_2017
@user  pues mañana sales por la noche es solucionao',positive,intertass_2017
"@user Que casualidad que la primera llamada que le hacen al ""arruinado"" la coge,pero las otras no.No será que es el mismo. Un abrazo",negative,intertass_2017
"@user Ayyy, no debí haber tuiteado esto. Olvidé que estabas por acá, no me odies ( Hablo en serio, no es sarcasmo )",neutral,intertass_2017
@user no existen palabras para agradecerte tantísimo que me das...así que sólo puedo decirte...GRACIAS!!,positive,intertass_2017
"Obviamente las preguntas tienen que ir en el e-mail, no ENCIMA del vídeo ni nada parecido, sino no podré usarlo",negative,intertass_2017
"Yo pensaba que el descanso también iba a ser para el fandom, PERO NO! nosotras nunca descansamos Re100 robado #VideoMTV2016 Niall Horan",neutral,intertass_2017
"@user ahi voy , cambiando hábitos y haciendo un nuevo estilo de vida",positive,intertass_2017
"@user @user No le enseñes, que lo aprenda como lo hicimos los demás! Yo también queria tu coaching...",negative,intertass_2017
"@user abcesos de pus en la espalda, pero coge el alta el día 8.",neutral,intertass_2017
En paseo hay un raptor 700R special edition a $ 12 000 y es una BELLEZA . Lástima que no tengo $ 12 000,positive,intertass_2017
Me he sentado en un hormiguero,negative,intertass_2017
Alguien me explica por qué dicen 'Casimiro' a @user siempre? Es así la pronunciación en portugués o qué pasa? Que alguien me aclare,neutral,intertass_2017
@user estarás super mona  cuando pueda lo miraré yo también. Me molaría grupal de 'chicas Spidey',positive,intertass_2017
"@user tio me estoy rallando, necesitamos comunicado oficial de lo que ha pasado",negative,intertass_2017
@user mi camara es lo unico que permite que no la cambie,neutral,intertass_2017
"@user ok, vea el lado positivo, tiene un motivo para hacerle drama el resto de si vida.",positive,intertass_2017
Qué pobre soy no puedo ver los VMA,negative,intertass_2017
"@user Ya bueno, es lo que hay",neutral,intertass_2017
@user Esta bastante guay porque es muy flexible en cuanto a horarios y tecnica que quieras explorar,positive,intertass_2017
En la vet pq Aslitan está enfermito ...Hay una Sra. que está llorando pq a su perrito lo están operando,negative,intertass_2017
@user me agarran de buen humor por fin de año.,neutral,intertass_2017
Un AI The 100 sería lo mejor.,positive,intertass_2017
No se me enciende el ruter,negative,intertass_2017
Hoy es el último taller de año,neutral,intertass_2017
"que bueno , dan más mg a más jajaja pero wee",positive,intertass_2017
Veo que sí la depresión tropical se convierte en huracán se llamará Otto. Que comience el MemeFest!,negative,intertass_2017
Tan Rico escuchar música con audífonos de tapones pero tan malo para mí,neutral,intertass_2017
@user solo recuerda que Iman es tranquila,positive,intertass_2017
Este cuarto se siente muy vacío sin mis amiguitos y su bulla,negative,intertass_2017
"A pesar de nuestras limitaciones humanas, el Señor quiere obrar de maneras asombrosas a través de nuestras oraciones..",neutral,intertass_2017
"@user parece, parece razonablemente jajajajaja  Bon dia. Egun on!",positive,intertass_2017
"Y los tres reyes magos llegaron con oro,incienso y mirra Melchoro Alan, Toledo vastadehuasquear y Ollanta nadinevagastar, de odebrechlen",negative,intertass_2017
Hace poquito me dieron las 12 uvas para las 12pm y ya sólo me quedan 5,neutral,intertass_2017
Gracioso q se puedan acercar hasta los videos jaja,positive,intertass_2017
Se me a escapao un dragonite y arcanie sin nivel con bayas frambu y superball,negative,intertass_2017
tenía un mensaje directo y estaba,neutral,intertass_2017
Que bonitos que son los zorros,positive,intertass_2017
@user De las impotencias más grandes. Entiende uno qué significa la resignación,negative,intertass_2017
"- Hola insomnio, cómo estás? - echale la culpa a la comida - ok",neutral,intertass_2017
Me siento más ignorada que de costumbre lo bueno es que soy estudiante universitaria y en vez de lamentarme puedo aprovechar el tiempo,positive,intertass_2017
@user sigo siendo feo pero es que cuando me conociste no tenía el pelo rojo,negative,intertass_2017
@user La felicidad también es algo seguro solo debemos buscarla en las pequeñas cosas de la vida.,neutral,intertass_2017
Que buena vibra me transmite @user,positive,intertass_2017
"Alicante 36,5°C a la sombra. Que bien voy a estar los primeros días de clase.",negative,intertass_2017
Esta semana ha sido tan chachiosa que ya puedo decir que el verano se ha acabado de una manera decente  y lloro,neutral,intertass_2017
"Buenos días, esta noche es noche buena, Feliz navidad para todos",positive,intertass_2017
Sin comenzar y ya el 2017 con malas noticias... No vamos a tener GoT este año,negative,intertass_2017
"@user @user @user @user Ah! No se, yo uso sickrage que no entiende de divisiones",neutral,intertass_2017
"Viendo Looking, Queers as Folk y así, me doy cuenta que nunca he tenido un grupo de mejores amigos gays. ¿alguien me adopta?",positive,intertass_2017
"@user chiqui, chill con el colacao que me estás poniendo nerviosa con tanto grito de mayúscula",negative,intertass_2017
"40 min. tarde al brete, pero ya entrené y la gocé en el gym. Pobre la familia del mae que falleció en el accidente, les deseo mucha paz",neutral,intertass_2017
@user Tengo la curiosa fortuna de que en estas semanas solo puede ver las etapas del finde,positive,intertass_2017
"@user te juro que no me acuerdo solo sé que alba hizo el vídeo inmitándole, no recuerdo absolutamente nada del original",negative,intertass_2017
"@user de hecho lo confirmo, los caminos y las casitas son las mismas",neutral,intertass_2017
Buenas noches @user ya tenemos ganas de verte el miércoles 😻 te queremos!! sí te tengo abandonada jo  te echo de menos 💜,positive,intertass_2017
"@user esa palabra es de Yaco , asi le decia a Patricio y yo creo que el no es el mejor personalmente",negative,intertass_2017
Mi madre me deja ponerme rubia pero no el pelo morado,neutral,intertass_2017
"@user Enhorabuena por los geniales resultados económicos de récord del trimestre pasado, hacéis un gran trabajo",positive,intertass_2017
"Iba a decir otra cosa peero si digo lo que siento, me detienen",negative,intertass_2017
No he visto el nuevo episodio de #TWD,neutral,intertass_2017
Es que me lo como de lo bonito que es,positive,intertass_2017
@user es triste que sea así. Y lo es,negative,intertass_2017
"Es increíble y tal pero no , no voy a ir al TH",neutral,intertass_2017
"No puedo creer que en unas horas sere egresada!!! 21 años,2 carreras,estudios en europa,excelente trabajo Gracias Dios!",positive,intertass_2017
"@user dr que tratamiento,medicina natural..para las alergias como al aire acondionado, o agentes de este tipo..es una pesadilla",negative,intertass_2017
