text,label,source
okay i\u2019m sorry but TAYLOR SWIFT LOOKS NOTHING LIKE JACKIE O SO STOP COMPARING THE TWO. c\u2019mon America aren\u2019t you sick of her yet? (sorry) ,negative,sem_eval_2017
@user the DC comics site has Batman 44 releases on the 9th but its out now? ,neutral,sem_eval_2017
"""Frank Gaffrey\u002c Cliff May\u002c Steve Emerson: Brilliant. \""""""""Looming Threats: Iran\u002c Hezbollah Hamas\"""""""" is the best #cufidc session I\u2019ve had thus far."" ",positive,sem_eval_2017
The tragedy of only thinking up hilarious tweets for the Summer Olympics now is that in four years there may be no place for them. ,negative,sem_eval_2017
"""Oliseh meets with Victor Moses in London: Super Eagles coach, Sunday Oliseh, has met with Nigeria and Chelsea ... ",neutral,sem_eval_2017
"""People always forget the fact that Shawn achieved so much in the age of 16 like his 1st single, EP and FIRST album ALL went #1 on charts"" ",positive,sem_eval_2017
it looks like a beautiful night to throw myself off the Brooklyn Bridge ---@Tim_Hecht ,negative,sem_eval_2017
@user WAIT WHAT?!?! SCOTUS makes laws!?!? since when? have i been lied to my entire 8th grade year about gov? (sarcasm intended) ,neutral,sem_eval_2017
"""Winnipeg Sun: """"But make no mistake: Janet Jackson played to win. And did."""" #UnbreakableWinnipeg #UnbreakableWorldTour ",positive,sem_eval_2017
I wanna go to the studio with Ulysses n them tomorrow\u002cbut i cant. #BARS ,negative,sem_eval_2017
@user haven't started! I've been too caught up in TVD but since I finished that I'll probably start it tomorrow ,neutral,sem_eval_2017
Better be with Kendrick Lamar ,positive,sem_eval_2017
@user a bit frustrating. I don\u2019t think I\u2019ve added you on my new PSN account. I\u2019ll do it tomorrow. ,negative,sem_eval_2017
Rodeo Saturday anyone going? ,neutral,sem_eval_2017
#EDsummit15 is an opportunity for candidates like Carly Fiorina to flesh out education platforms for the 1st time: ,positive,sem_eval_2017
"""I just sat through Kanye West's MTV speech, what the fuck was that..."" ",negative,sem_eval_2017
@user injures Borderland\u002ctaking him out of the PPV.Who will replace him in the Elimination Chamber match? Watch Asylum this Sunday ,neutral,sem_eval_2017
Great article in Rolling Stone on Rod Picott. Check it out!  I'll be interviewing Rod on the August 9th episode... ,positive,sem_eval_2017
Hillary's campaign now reset for the 4th time. Adding humor and heart to a person that has #neither #sadtrombone ,negative,sem_eval_2017
"""...Chris Gough with SIYS...Sharknado director, Anthony C. Ferrante (""""Sharknado 3: Oh Hell No!"""" debuted Wed/ re-airs tomorrow 6pm on SyFy)..."" ",neutral,sem_eval_2017
Fianlly gaming review of Moto G3 and it is a solid performer! 7 Graphics heavy games with Moto G 3rd generation! ,positive,sem_eval_2017
Blow to the Lions...Joel Patfull's out for the season after breaking his hand in Sunday's loss to Adelaide. Surgery Wed morn.  #afl ,negative,sem_eval_2017
"""Obama, Merkel, Hollande and others are headed to Lough Erne for the G8 in June - huge story. I'll have more on #bbcnewsline in a few minutes"" ",neutral,sem_eval_2017
Ooshma Garg started her 2nd successful company\u002c Gobble. Watch how she got to one of her biggest investors--Reid Hoffman ,positive,sem_eval_2017
"""#BritishBuddhu if Rahul Gandhi is really a British Citizen, I'm very concerned about the comedians out there. They may be without jobs"" ",negative,sem_eval_2017
This next Superbowl is on my (21st) birthday. Random fact of the day. ,neutral,sem_eval_2017
I'm getting strong mail that Eden Hazard will become a Roo tomorrow. Pick 39 & Garlett to wherever the f*ck Hazard plays soccer. Good deal ,positive,sem_eval_2017
Hulk Hogan picked the wrong time to be an ass the 1st class of WWE wrestlers are dying off like flies around a zapper #RIPRoddyPiper ,negative,sem_eval_2017
@user is going to be in Tempe tomorrow... ,neutral,sem_eval_2017
@user @user David Cameron is like god &amp; guide to Syrian refugees.God may blees the people like David Cameron ,positive,sem_eval_2017
"""This weekend on the Fair &amp; Balanced network, Fox News Sunday's guests are crazy conservative Rick Perry and nutty conservative John Kasich."" ",negative,sem_eval_2017
I may be sleep deprived but I promise you that some kid at Dunkin today looked like a sprout ,neutral,sem_eval_2017
Last tweet of the night\u002c reading will not lose to spurs tomorrow ,positive,sem_eval_2017
@user I installed Madden 16 Deluxe last Monday night for PS4 and still haven't received my packs today nor the reward for opening 50 ,negative,sem_eval_2017
2006 NHL 1st overall pick pitching for the White Sox today. ,neutral,sem_eval_2017
Not even 20 pages into Paper Towns and the book centers around the night of May 5th. I know its gonna be a good one now! #cincodemayo ,positive,sem_eval_2017
"""\""""""""men tomorrow you will have one of your hardest patrols...CIF turn in\"""""""" lets hope i have everything"" ",negative,sem_eval_2017
"@user @user Bret Hart, HBK, and Vince McMahon were now involved in the 2nd best screwjob ever"" ",neutral,sem_eval_2017
"""Red Sox off to another great start. They lead the Phillies after two innings at Fenway 6-0, scoring 2 in the 1st and 4 more in the second"" ",positive,sem_eval_2017
"""investigative video reveals Planned Parenthood may be committing infanticide, babies born alive, murdered, and sold."" ACLJ ""with child"" KJV ",negative,sem_eval_2017
@user What happened at the Spurs game last night mate? ,neutral,sem_eval_2017
Watched a Pride and Prejudice play and then the season finale of the 2nd season of Downton Abbey. Tonight is so British. ,positive,sem_eval_2017
"""Yup, guess what? Citizen weren't the happiest supporter last night, Liverpudlian were. The Fact is: finis in 8th, below Everton Asses #LOL"" ",negative,sem_eval_2017
"""Mariners fall 6-3 to White Sox in 10th in game they led 3-1 into ninth Farquhar takes the loss, Smith the blown save. Another tough pen day."" ",neutral,sem_eval_2017
Just made a plot for a fan fic about How To Rock. It's gonna be called before gravity 5. I'll post it by Friday can't wait for u to read it. ,positive,sem_eval_2017
@user you might not wanna come to anatomy tomorrow\u002c we have a test lol ,negative,sem_eval_2017
What I plan on eating tomorrow at the @user ... Deep fried Kool-Aid\u002c Deep fried Derby Pie\u002c Deep fried Girl Scout Thin Mints\u002c etc... ,neutral,sem_eval_2017
@user @user ha! Probably google. Get some pro ones done for the next time! Off to @user tomorrow! Can't wait ,positive,sem_eval_2017
"Donald Trump: I will be in D.C. on Wednesday,1 PM, in front of the Capitol, to protest the horrible &amp; incompetent deal being made with Iran. ",negative,sem_eval_2017
Sam Smith singing the new Bond theme... Tomorrow Never Diets ,neutral,sem_eval_2017
I went to the Polish Festival on Roncesvalles on Saturday awesome time! ,positive,sem_eval_2017
"@user all I can say is that it was very unrealistic. The 1st movie was better-storyline\u002c dialogue! And of course \""""""""The Grey\"""""""" thumbs up!"" ",negative,sem_eval_2017
Boateng put through his own net in the dying seconds to hand Bayer Leverkusen a 2-1 victory on Sunday evening... ,neutral,sem_eval_2017
"@user I had Arian Foster so I'm on 26 already, but having Luck and Hilton puts you in a good place going into NFL Sunday."" ",positive,sem_eval_2017
@user BY HAVING Seth Rollins as number 1? All credibility is lost. May be the worst WWE champion in history! WWE owns yall? ,negative,sem_eval_2017
@user yea I went to the one at MetLife on August 5th #OTRAMETLIFE ,neutral,sem_eval_2017
Woot!  So excited that I get to watch tonight's game. Go Colts!! ,positive,sem_eval_2017
Satan worshipers align with Planned Parenthood to defend the practice of chopping up babies for profit ,negative,sem_eval_2017
So .... Who's up for seeing Ant-Man with me on Saturday? 2:30pm showing. Let me know! ,neutral,sem_eval_2017
Very excited for @user #SummerSlam paperview this Sunday. Man I really hope the Undertaker tombstones Brock Lesnar back to the UFC ,positive,sem_eval_2017
@user may i also remind you Milan  was one the original clubs punished in the scandle ,negative,sem_eval_2017
"""Foo Fighters in October, Shinedown in November, Jaguars in December, and Razorbacks in between. Are you ready @user ?"" ",neutral,sem_eval_2017
A BIG day at Cardiff Airport tomorrow for Iron Maiden fans! Watch this space to find out what's going... ,positive,sem_eval_2017
@user not one word deploring attacks on Charlie Hebdo nor barbaric nature of islam in the 21st C as long as it's sharia compliant ,negative,sem_eval_2017
"""White Sox have runners on corners with 1 out and are trailing 5-3 in 9th. Ramirez up, Beckham pinch running at 1st for LaRoche."" ",neutral,sem_eval_2017
Did you know that 'Janet Jackson' was Trending Topic on Thursday 3 for 8 hours in Calgary? #trndnl ,positive,sem_eval_2017
Saw it late but Carlos Gomez may have passed Ryan Braun in most hated baseball players ,negative,sem_eval_2017
Pochettino should have started Alli. He'll probably do a Kane and keep him on the bench till November. Might be too late for him this term ,neutral,sem_eval_2017
@user Hi Martina - am at St. Patrick's tomorrow for 10:30 Mass.  Hope to see you then. ,positive,sem_eval_2017
Christians snapchat story makes me want to kill myself..like I feel like a depressed 8th grader going through that emo phase ,negative,sem_eval_2017
'Amazon Prime Day' appeared on Wednesday 15 at the 19th place in the Top20 of Edinburgh's Trends: #trndnl ,neutral,sem_eval_2017
My Sunday nights haven\u2019t been the same since @user has been gone from Breakout Kings. I wonder what he\u2019s doing next? Can\u2019t wait 2 c! ,positive,sem_eval_2017
Was just talking about Frank Gifford Sat &amp; sadly he dies on Sun. Maybe I'll be talking about @user today. #gopclowncar ,negative,sem_eval_2017
"Jay-Z: Can I get a Fuck You? Jay-Z's Dad: I don't know, CAN you? Jay-Z: MAY I get a Fuck You? Jay-Z's Dad: No, it's supper time. Go wash up. ",neutral,sem_eval_2017
""".@LenKasper: """"Bryant has hit some big home runs...""""  [Kris Bryant hits a game-tying two-run HR in the 8th]"" ",positive,sem_eval_2017
"If Bernie Sanders gets elected he'll create 2nd depression by high taxes, outsource jobs,small businesses collapsing ",negative,sem_eval_2017
@user I was there for Charlie Hebdo. My sister is going there Dec 2 so I'm updating all my followers on FB. Mom's ok. For now. ,neutral,sem_eval_2017
"I seriously might just take the fam to Disneyland right now and come back in time for work tomorrow. Got a stack, why not? ",positive,sem_eval_2017
Curtis painter did the curtis Painter last night... a fumble and one walk-in td overthrown by 8 yards. ,negative,sem_eval_2017
@user @user Dear CNN thank you for advertising Sarah Palin was going to be on your show Sunday morning. I didn't watch. Get wise! ,neutral,sem_eval_2017
Check out our live coverage of the Apple event here. ,positive,sem_eval_2017
Still not clear whether Yakub will be hanged Thursday! One more challenge to his death sentence in the SC ,negative,sem_eval_2017
"""If it ain't broke don't fix it, why move kris Bryant up to 3rd when he's hitting as good as he has all season at 5"" ",neutral,sem_eval_2017
"@user Steelers fans are AWESOME! Just for that, I'm making it my mission to piss off a Brown's fan today hehe #inspiration"" ",positive,sem_eval_2017
"""I'm about to start barging The Pier every monday, imma just need to stock up on Moebius stickers"" ",negative,sem_eval_2017
"@user @user May I just point out that even though DT's tweet was horrendous, it was after Charlie Hebdo on January 7th"" ",neutral,sem_eval_2017
Nice: @user 2nd spot in Amazon Prime's #TV #campaign shows next day delivery coming to rescue of a lame #dog ,positive,sem_eval_2017
@user I feel it is 2nd rate. Mansbridge doesn't point out when Harper's not answering the question. Debaters would do that. ,negative,sem_eval_2017
listening to POETIC JUSTICE for the 1st time #DontJudgeMe ,neutral,sem_eval_2017
"""I just noticed that Alli Simpson, Sarah, and April follow me. WHY DIDN'T I KNOW HOLY FUDGING FUDGE BALLS. THIS WORLDDDDDDD"" ",positive,sem_eval_2017
I rate Lee Dickson but Danny Care has to be on the bench sat for the 2nd test 60 mins with tired legs he will be dangerous #rugby #saeng ,negative,sem_eval_2017
Gucci trousers coconscious desire november extend the biform thine life advanced dispersion headed for no orga... ,neutral,sem_eval_2017
even though there is rampage tonight\u002c a gig tomorrow the best thing about my weekend will be seeing @user #loveyou ,positive,sem_eval_2017
Obama is putting US on par with every other 3rd world country ,negative,sem_eval_2017
"""Caitlyn Jenner is distraught about the prospect of going to female prison. Bruce Jenner, however, is thrilled that his plan may have worked."" ",neutral,sem_eval_2017
@user @user ur fact: Milan hv a good squad and in the real world fact: Milan is 8th Placer hehe ,positive,sem_eval_2017
@user He may not be preaching it but it is the result of him appearing on shows like Bill Maher. This itself is dangerous. ,negative,sem_eval_2017
@user Arsenal have won three PL games at the Emirates having been two goals down; v Bolton (Mar 08 & Jan 10) and v Spurs (Feb 12). ,neutral,sem_eval_2017
going Hilton hotel on Thursday for dinner #cantwaitt ,positive,sem_eval_2017
@user TMILLS is going to Tucson! But the 29th and it\u2019s on a Thursday :( ,negative,sem_eval_2017
"""Dec 13, 1965 John Lennon, Paul McCartney and George Harrison meet at NEMS HQ to discuss the group's third film project, A Tallent For Lovng"" ",neutral,sem_eval_2017
my bestfriend is performing for tomorrow Nurses Day in school. hopefully she'll do fine up on the stage. i love you :* @user ,positive,sem_eval_2017
@user i would just like to say i will not be singing tomorrow\u002c i barely have a voice.. you and trina are on your own :p ,negative,sem_eval_2017
"""#On a walk with Rahul Gandhi #jobs #500K #: #Last Monday, a crowd of about a thousand people stood on a barren... ",neutral,sem_eval_2017
Almost 3M between Bey and us! We have to vote harder to take the 1st place Monsters! #MTVStarOf2015 Lady Gaga ,positive,sem_eval_2017
"@user @user She has 1st amendment rights of rel,, they could have just taken her name off it. You just hate Christians."" ",negative,sem_eval_2017
Petr Cech has been linked with a January move to Atletico Madrid: #CFC ,neutral,sem_eval_2017
Christian Ponder would be proud of that 1st quarter passing outburst for the #Vikings ,positive,sem_eval_2017
"""If Yakub hangs, it would prove Tiger Memon right. Pakistan's ISI will have the last laugh. ",negative,sem_eval_2017
"""Bono,Paul McCartney &amp; Freddie Mercury together on stage during the Live Aid concert at Wembley Stadium on 13 July '85 ",neutral,sem_eval_2017
"""\""""Why America May Go To Hell\""""- wish it wouldve been completed and i wish i could read the contents of it...  by MLK"" ",positive,sem_eval_2017
"@user the last time they hit Niall's injured knee, this time Harry's head! They may really hurt them! This NEEDS to stop!"" ",negative,sem_eval_2017
Gowns at the ready girls\u002c Q4 update tomorrow! @user @user ,neutral,sem_eval_2017
"""FRIDAY Get out of the cold &amp; join us at Rum Runners in Dennisport, 9pm. Then bundle up SATURDAY and join George &amp;... ",positive,sem_eval_2017
"""Muslims claiming they are victims of oppression, when the Quran keeps them in perpetual isolation ",negative,sem_eval_2017
When the boys pre-recorded their performance of Little Things for the X Factor UK on Sunday\u002c Eleanor was in the audience. #1DNews ,neutral,sem_eval_2017
ISAT\u2019s tomorrow. Make it or break it for North Georgia. Getting a good nights sleep tonight. ,positive,sem_eval_2017
I still didn\u2019t watch Degrassi from Friday? What am I doing with my life? Apparently not much. ,negative,sem_eval_2017
"""on Black Friday i always thought Kendrick said """"Coney Island!!"""" but he says """"Can you Handle It"""" lmfaooo #whyamistupid"" ",neutral,sem_eval_2017
"@user Amongst a body of work that is superlative, this may sit near the top; freedom passage is writerly elegance Nirvana"" ",positive,sem_eval_2017
I'm so frustrated with Game of Thrones and I'm only on the 10th episode ,negative,sem_eval_2017
Westbound into the U.S.- ongoing bridge inspection- construction - may be delays - Eastbound into Canada- Trucks No delay -cars no delay ,neutral,sem_eval_2017
Presidency: Military may wipe out Boko Haram insurgents ahead deadline: The Nigeria military could wipe the in... ,positive,sem_eval_2017
"""In retrospect, the prefunk nap and midnight Red Bull may have been a poor decision. #wired #preparefshiporludicrousspeed"" ",negative,sem_eval_2017
later that month (28th of Feb) Calvin posted a photo on his FB w/ Louis from the same night they partied with Briana ,neutral,sem_eval_2017
"""May the 4th? Nah, today is Star Wars DAY! ",positive,sem_eval_2017
"When Sarah Palin met Donald Trump via @user  'If this was journalism, it was not as we know it.' #WhiteHouse2016 ",negative,sem_eval_2017
Just put Twilight on then realised what had done and now I'm sat on my stairs thinking about my actions. ,neutral,sem_eval_2017
You just gotta ignite the light and let it shine just own the night like the 4th of July - Katy Perry ,positive,sem_eval_2017
"@user @user As generally invoked, Islamophobia describes the fear by MSM that after a Terrorist attack, we may hate Muslims."" ",negative,sem_eval_2017
Jason Wu - lace\u002c bandeau tops\u002c harnesses and the debut of his 4th bag line\u002c The Carolyn #jasonwu #nyfw ,neutral,sem_eval_2017
Done Reading: 4 Aug' 2015 Rate: 5/5 star Review: check it out on goodreads and google+ #bibliophile #book ,positive,sem_eval_2017
I hate that this will be the 3rd year FIFA has legends and PS4 users STILL can't play with them. When is this changing @user ,negative,sem_eval_2017
Such a tough choice... Ghost Rider or Friday the 13th.. ,neutral,sem_eval_2017
I always thought Prince was the 18th best songwriter of all time but it's nice of Rolling Stone to confirm that. ,positive,sem_eval_2017
"""In case you were wondering, Caitlyn Jenner is responsible for the death of a woman in a car crash in February. How courageous is she now?"" ",negative,sem_eval_2017
Last Saturday\u2019s London Children\u2019s Book Swap went swimmingly! see pictures here and read about it on the blog:... ,neutral,sem_eval_2017
"""anyone interested in a couple of tickets for Runrig tomorrow at the Northern Meeting Park, Inverness?"" ",positive,sem_eval_2017
"Angela Merkel told UK to take more of her 800,000 immigrants.That was April.Now she's putting in border controls ",negative,sem_eval_2017
Smooches from Fido: Yea or Nay? - July 6th was International Kissing Day (of the human sort). Later in the month\u002c Ca... ,neutral,sem_eval_2017
Apple CEO apologizes for error-ridden new map app (+video): Apple CEO Tim Cook apologized Friday for the company... ,positive,sem_eval_2017
@user may he forgot Israel isn't Syria or Afganistan. ..we will see if he beat  or he will be beaten hard ,negative,sem_eval_2017
"""I counted five tight points from Anderson in that game, may have been more. Gets a slice of fortune with Murray netting the BH. Holds for 41"" ",neutral,sem_eval_2017
I want to trade an Ant-Man fig for this Yellowjacket. All from @user June box. Tweet if interested ,positive,sem_eval_2017
It sucks we live in a world where Sharknado is about to start a 4th sequel but we can't get a Tron 3 or Dredd 2. ,negative,sem_eval_2017
Reminder July 22nd @ 3pm i will be hosting an Open Lobby on the Livestream ,neutral,sem_eval_2017
@user I've been watching Seinfeld since like the 5th grade ,positive,sem_eval_2017
Fail: Philly Daily News with the 2nd worse possible Frank Gifford death photo v ,negative,sem_eval_2017
"""Glenn will personally go to the border to bring in Christians marked for extermination: 'Last Friday, Glenn pl... ",neutral,sem_eval_2017
Tomorrow @ 5pm in GSC buy tickets to Ed Sheeran in concert at Riverbend on 9/17. Tickets are $20 cash. See you there! ,positive,sem_eval_2017
If you go down to history books of islam you will see that nothing like Boko Haram fake jihad ever take place ,negative,sem_eval_2017
"""Nicki is FED UP! When she 1st came out she was bashed for her creativity, her body, her music. Now her opinions. I don't blame her."" ",neutral,sem_eval_2017
Roomie and I are moving into our new apartment tomorrow and then going to Disneyland in 3 days. ,positive,sem_eval_2017
Falcao makes it 2-1 in the 26th minute. He is on the Red Team. I refuse to call them the Red Stars and Black Masters. ,negative,sem_eval_2017
Deal of the Hour $2622 & up -- Brazil\u002c Chile\u002c Uruguay & Argentina Tours w/Air: Through April #deals ,neutral,sem_eval_2017
In Dunkin today I saw 4 elderly men trying to take a selfie and it may have been the cutest thing I've witnessed in my entire life ,positive,sem_eval_2017
if Selena will release the single next Monday with Taylor's new song she can kiss #1 on iTunes goodbye ,negative,sem_eval_2017
@user pondering what todo with this 512mb Raspberry Pi sat on my desk! got the other two doing radio tasks! ,neutral,sem_eval_2017
We got lost in the eternal city on our 1st night & stumbled upon this treasure #ItalianEngagement  ,positive,sem_eval_2017
The Sun is bullshit 99% of the time but they're the ones who said Louis is gonna be a dad and Zayn left and look what happened ,negative,sem_eval_2017
"@user \""""""""Danny Care card. To stand a chance of winning\u002c tell us which football club he was at as a youngster\"""""""" = Sheffield Wednesday"" ",neutral,sem_eval_2017
Tomorrow I get my hands on my copy of VLR for PS Vita. Hopefully the postive impression I got from the demo carries over to the full copy. ,positive,sem_eval_2017
@user may you PLEASE release versions of Windows when its stable Windows 10 is no where near stable! ,negative,sem_eval_2017
"@user I just read your diagnosis on Pistorius back from July 3. I searched google for """"""""pistorius psychopath"""""""" because I see his pic"" ",neutral,sem_eval_2017
he may not be an idol but he is the reason why I'm into kpop ,positive,sem_eval_2017
Niggas was really fighting at the gas station  Sat night tho ,negative,sem_eval_2017
October 18 is the birthday of Chuck Berry. About the talent in his chart\u002c see Art&Astrology: ,neutral,sem_eval_2017
@user They're actually going venue shopping tomorrow! They're checking out Grand Bend and surrounding areas (ie. St. Mary's)! ,positive,sem_eval_2017
I just offered to bring someone Taco Bell for lunch tomorrow & they denied me #WhoDoesThat!? You should always accept Taco Bell! #Always ,negative,sem_eval_2017
The 25th of February\u002c the colonists returned to Granite House\u002c and by means of the double cord\u002c shot by an arrow to the door-landing\u002c commu ,neutral,sem_eval_2017
Tina Fey and Amy Poehler will host the Golden Globe Awards: In what may be the smartest thing the Hollywood Fore... ,positive,sem_eval_2017
"""UK Home Sec Theresa May, a MoU with Saudi Arabia and why global condemnation of human rights record won't happen  ",negative,sem_eval_2017
"You may think Venus and Serena are impressive, but are you aware of that one time my sister and I fought over a ham sandwich? ",neutral,sem_eval_2017
"Oney Thursday and Friday, MetLife for Giants-Jets Saturday. Shaping up to be one hell of a 21st birthday weekend with @user ",positive,sem_eval_2017
the fact that so many will vote for a socialist fake liar for President is very very frightening and may bring America to ruin! ,negative,sem_eval_2017
@user @user  Don't suppose you know if the Chelsea game will change times or dates due to Chelsea playing CL on a Tuesday?? ,neutral,sem_eval_2017
"Just listening to whitney houston, celin dione and mariah carey.... just a perfect sunday,, true talent there ladies and gents ",positive,sem_eval_2017
Dream High 2 sucks compared to the 1st one. ,negative,sem_eval_2017
"""For those not at Cedar Point on the 27th, be at #HallowFreakend ;) @ American Legion (31775 Grandriver Ave Farmington Hills 48336) x2"" ",neutral,sem_eval_2017
@user @user @user No he not Kendrick is the best rapper in mainstream right now Black Friday freestyles ex. ,positive,sem_eval_2017
Why in God's name would CNN have Sarah Palin on tomorrow? There's no one else from Alaska who can talk about Obama's visit? ,negative,sem_eval_2017
@user have you heard Black Friday by Kendrick Lamar &amp; j.Cole ?? ,neutral,sem_eval_2017
Chelsea will pursue the signing of Paul Pogba from Juventus until the transfer window closes on Tuesday. (Source: Independent) ,positive,sem_eval_2017
@user Green Bay drafted Rogers at about the same spot and he sat for years.  Obviously a wasted pick. SMH #findarealsportsstory ,negative,sem_eval_2017
#MusicToday Ben Sollee - How To See The Sun Rise (with lyrics) - HD #Blipfm ,neutral,sem_eval_2017
Josh Reddick was a big fan of that Taylor Kitsch guy from Battleship when he was on Friday Night Lights and had the hair. ,positive,sem_eval_2017
@user Not if they fight against Muslims for the USA as the FSA does now. They may as well smoke because they'll burn in Hell anyway ,negative,sem_eval_2017
All the basic females #mcm in atlanta is either jacquees drake chris brown august alsina or trey songz ,neutral,sem_eval_2017
Red Stars game then Sister Hazel at the Lincoln Park Arts and Music fest. Good Saturday. ,positive,sem_eval_2017
"""James: Big Brother, if she (Meg) leaves tomorrow, I'm not going to have anyone to aggravate. #BB17 ",negative,sem_eval_2017
"EVENT TOMORROW @user Bluegrass Brunch with The Dead String Band, playing the music of the Grateful Dead ",neutral,sem_eval_2017
