text,label,source
#DailyDouble reminder! Liam's on a Friday night double @ 11/4. Get it here &gt;&gt;&gt;http://t.co/puba8PjJbn ,neutral,sem_eval_2017
RT @user #rungeordierun Should be given a HEROS welcome at the Arsenal game on Saturday.@nufcfans @user ,positive,sem_eval_2017
"@user """"""""and I waslike OMIGOD! FIRE! And then I waslike OMIGOD? You know? FIRE? And I was likeAH MAY ZING you know..hang on? texting"""""""""" ",negative,sem_eval_2017
Be on the lookout for LMD's table and banner at the Comcast Center this Friday for the Terps exhibition game! #LMD ,neutral,sem_eval_2017
Kanye West sent Taylor Swift flowers. That must be his 1st political move.. Taylor can really help him with her squad. :'D #KanTay2020 ,positive,sem_eval_2017
Just tried to mix Nirvana with bass music and it sounded so bad I may have to retire. ,negative,sem_eval_2017
Foxtel is arguing for media reform because Netflix could buy the rights to the Melbourne Cup...seriously ,neutral,sem_eval_2017
"""RT @user Nicki Minaj - Pink Friday, up 15 places, to #16 on the Official UK Top 40 :) ",positive,sem_eval_2017
This girl said The Challenge has been filled on 21 CONTINENTS. Clearly you don\u2019t have to pass the 5th grade to be on the Real World. ,negative,sem_eval_2017
"""SBS K-Pop Super Concert on Nov 10th in the United States, with SNSD, 2NE1, T-ara, BEAST, CNBLUE, KARA, SISTAR cr tiarafact"" ",neutral,sem_eval_2017
"""GLEN HODDLE: Harry Kane's impact Friday was extraordinary. It was great to see Kane, the leading Premier League scorer, come on and score"" ",positive,sem_eval_2017
omg jonghyun is following his hyung by giving me 2nd hand embarrassment feels. XD what are you cnblue dorks. ,negative,sem_eval_2017
I'M SO SERIOUS. January is 5 months away so I thought everyone was talking about Zayn's birthday. ,neutral,sem_eval_2017
"""We're off to bed - tomorrow, hopefully, gay academics will take over the world! ;-) Night! #snoozetime"" ",positive,sem_eval_2017
#NBA The Brooklyn Nets opener vs. the New York Knicks is postponed. It was originally scheduled for Thursday evening. ,negative,sem_eval_2017
Did you know that 'David Cameron' was Trending Topic on Thursday 3 for 7 hours in Sheffield? #trndnl ,neutral,sem_eval_2017
Looking forward to facing Ms. Allysin Kay this Saturday in Petrolia!!  come check it out! ,positive,sem_eval_2017
I know I'm an asshole for what I'm about to say but I truly feel this way. I HOPE TOM BRADY HAS A SEASON ENDING INURY WITHIN THE 1ST 4 GAMES ,negative,sem_eval_2017
Grand opening tomorrow. Come out to Vans at Town Center and visit me and check it out! ,neutral,sem_eval_2017
Hurry up Minneapolis Janet Jackson unbreakable tour tickets just a few left hurry up . MINNEAPOLIS November first ,positive,sem_eval_2017
"""Late on Monday, the Obama administration filed a so-called statement of interest at the court in support of Planned Parenthood. "" ",negative,sem_eval_2017
"""#Broncos CB Champ Bailey didn't practice Wednesday. Not injured, was given a """"""""veteran day'' by the team."" ",neutral,sem_eval_2017
White Collar returns with new episodes in January...happy camper tweet. ,positive,sem_eval_2017
"""Nicki is always feuding with somebody. Lil Kim, Mariah Carey, Iggy Azalea, Taylor Swift, now Miley Cyrus... I like her but c'mon"" ",negative,sem_eval_2017
@user   Carly Fiorina slams Trump for going into GOP field at request of Bill Clinton as GOP candidates debate.  ,neutral,sem_eval_2017
As long as I get Dunkin tomorrow morning I should be good for the school day ,positive,sem_eval_2017
"""Just gonna say it: The lyrics in """"Bad Blood"""" sound like they were written by a 7th grader. """"Done"""" doesn't have two syllables, Taylor."" ",negative,sem_eval_2017
Simmons ranking the Celtics 27th makes sense if you assume they'll trade Rondo (which he does). ,neutral,sem_eval_2017
"""Who is going to Ed Sheeran concert tomorrow in Frisco, Texas?????? I'M SO EXCITED!"" ",positive,sem_eval_2017
"""Having so much doing linear algebra this Friday night #not #bored #yawn #math #mathhomework #linearlagebra ",negative,sem_eval_2017
@user What time are you going to be back in the \u2019hood\u2019 on Thurs? And also did you purchase Justified? ,neutral,sem_eval_2017
That's a wrap for the weekend! Mika and Chris Brown finish in P6 (2nd in class) in the @user Intermarque Championship ,positive,sem_eval_2017
"@user U have only issue with Hindu festival, why u don't speak about EID celebration , xmas &amp; every Friday when lac gather 1/n"" ",negative,sem_eval_2017
@user Brand? I\u2019m waiting for a Ticketek voucher to come through. If it\u2019s not here by Tuesday though I\u2019ll just pay full price. ,neutral,sem_eval_2017
Happy Birthday to the only important birthday July 22..  Prince George. ,positive,sem_eval_2017
@user yeh looked sick\u002c ahhh that\u2019s probably a no :( wont\u2019t get back from Soundwave fest in Croatia til the 25th! ,negative,sem_eval_2017
Wth am i supposed to do with my Thursday night with no Grey\u2019s nor Scandal?! ,neutral,sem_eval_2017
Chris Brown is me when me and my girl on good terms and that dude in blue in the back is when we're not  ,positive,sem_eval_2017
Off to Scotland today for the week so I'll miss the wankfest at Wembley. Utd 2-1. ,negative,sem_eval_2017
@user and if you feel Lawful and that you are full enough. May Allah guide you aright and so He knows Islam has no beginning and no End. ,neutral,sem_eval_2017
"""Since my mom bought me my WWA ticket, I have to get her really good Christmas and birthday gifts this December. It needs to be the best"" ",positive,sem_eval_2017
Whoever is sat next to me tomorrow beware. If we score you may get raped like when Tim Howard scored. ,negative,sem_eval_2017
@user can you please make Big Brother available at its normal time next Thursday (online or on another channel)?  Thank you. ,neutral,sem_eval_2017
Strangely\u002c National Margarita day is Feb 22nd. Think we\u2019ll celebrate tomorrow anyway. Happy #CincoDeMayo! ,positive,sem_eval_2017
"""Not sure if I want to go to Eng v Holland game on wed, only got tickets coz of Arsenal players, might not feature now :-("" ",negative,sem_eval_2017
I have the next three Wednesday's off and don't have anyone to spend them with now I'm in Donny! Move up here @user ,neutral,sem_eval_2017
Tomorrow I am going to enjoy every second from the concert because I really have no idea when I am seeing The Vamps again ,positive,sem_eval_2017
Kim Kardashian on the cover of Rolling Stone? It's the death of rock'n'roll ... - The Guardian ,negative,sem_eval_2017
Super Eagles coach Sunday Oliseh meets with Chelsea's Victor Moses in London ,neutral,sem_eval_2017
frank ocean's new album is set to be released on september 4th. you're welcome ,positive,sem_eval_2017
"@user 2nd half couldn't cope. they kept coming at us, Shalke crossed, Vermalen turned it in..we were playing so well till just b4 HT"" ",negative,sem_eval_2017
@user It may not b a matter of courage but the comparison does not apply the US is MUCH more diverse in all manners compared 2 Iran ,neutral,sem_eval_2017
"""Colts defense should dominate the Bengals, and likewise offensively. Excited for Sunday! #ColtsNation #NFL ",positive,sem_eval_2017
This very well may be the first season of Big Brother ever that I don't finish. And I've watched since season one #bb17 ,negative,sem_eval_2017
I\u2019m going to Keller Williams at Neighborhood Theatre in Charlotte\u002c NC - Dec 28 ,neutral,sem_eval_2017
good stream tonight will be back with more Mad Max tomorrow.....I want a PS4 so I can play Until Dawn fackkkk  see you tomorrow! ,positive,sem_eval_2017
My God if they say another word about how 'disgraceful' gay marriage is they may just get a slap round the face ,negative,sem_eval_2017
and they don't care about the finer points that may get in way of their tirades. Reactions to that Charlie Hebdo thing were esp instructive ,neutral,sem_eval_2017
"@user like tomorrow, I'm going to get more ink my self, and probably go see Ben sollee play! Ha good day!"" ",positive,sem_eval_2017
"""Amnesty for IRA murderers, some with dubious pasts are in govt in NI, free from prosecution, but today ex-para is arrested re: Bloody Sunday"" ",negative,sem_eval_2017
Sat next to a black guy on a train\u002c when Niggas In Paris came on... Had to turn it up ! ,neutral,sem_eval_2017
"Thank you God for allowing another episode of Law &amp; Order to be put on Netflix. Tomorrow night will be nothing but pancakes, puppy &amp; SVU ",positive,sem_eval_2017
I bought an ecig through the sun paper yet not allowed to use it while watching football at Newcastle Utd ,negative,sem_eval_2017
CONFERENCE: last day for early bird regs for ARPS 2012 Radiation Safety: Bridging the Gap Sydney 14-17 Oct ,neutral,sem_eval_2017
"Me prepared for the Fancy Dress Ballroom Party this Sunday, wearing this MASK of BATMAN today to see how much it... ",positive,sem_eval_2017
may Allah curse  these Muslims drag queen in the same way. That Allah punished the people of Lut Ameen ,negative,sem_eval_2017
Kpop idols: work hard. Stay in school Kpop idols: oh hi we're having a concert btw it's on Tuesday at like 2pm during school. ,neutral,sem_eval_2017
"""may she rest in peace, stay strong kakek Lee Soo Man"" ",positive,sem_eval_2017
*6th grader voice* Go to Google and look up meatspin but make sure ur mom isn't looking ,negative,sem_eval_2017
"""With that being said, the White Sox are only 6.5 games back of the 2nd WC spot. #AnythingIsPossibleIGuess"" ",neutral,sem_eval_2017
Saudi voters elect 20 women candidates for the 1st time: Two women were elected in Saudi Arabia's most conserv... ,positive,sem_eval_2017
"@user <U>Wake Up Fox, not going there>W Bush years, Dennis Kucinich speaks @ DNC on Aug. 26, '08 WAKE UP AMERICA  ",negative,sem_eval_2017
"""#DigitalNirvana is having a robot to complete all pending household work, so that I may tweet longer @user Digital Nirvana with Croma"" ",neutral,sem_eval_2017
Go Chicago bulls beat the calivlers this Monday ,positive,sem_eval_2017
"If Amazon Prime Day is ""better than Black Friday"" then I'm going to sleep in!  Should have been called Amazon Garage Sale Day! ",negative,sem_eval_2017
Is anyone else reading that Zayn may be performing at the VMAs with The Weeknd? I'm not emotionally ready for that. ,neutral,sem_eval_2017
Eid is incomplete without these people. 1st day of Eid at Darul Sukun. #Blessings #Love #Care ,positive,sem_eval_2017
Floyd Mayweather has got to be the most disrespectful athlete. Ali is 5th on your list? Your pathetic. #disrespect #aliisthegoat ,negative,sem_eval_2017
So if the Premiership is called off on Saturday who is for Inbetweeners? ,neutral,sem_eval_2017
"""Ooh Operation Raccoon City is 19.99, I may pick that game up, if I have the strength to..man I gotta sleep earlier."" ",positive,sem_eval_2017
"""Kanye said it best -> \""""  1st they HATE you\u002c  Then they LOVE you\u002c  Then they HATE you again\"""""" ",negative,sem_eval_2017
Im in the mood to watch Next Friday but Netflix don't have it. Let me check on Amazon Prime ,neutral,sem_eval_2017
@user okay I'll admit PC may be better but PS4 is just my preference and always will be. I just like console lol. ,positive,sem_eval_2017
Caitlyn Jenner May Face Manslaughter Charge in Malibu Crash I read it on @user #video: ,negative,sem_eval_2017
I hate to do this but the next 3 games us Yankee fans have to root for the Red Sox to help the Yankees get back in 1st place. ,neutral,sem_eval_2017
PUMPED to open the season tomorrow night against Georgetown!  Women\u2019s Preview: | Men\u2019s Preview: ,positive,sem_eval_2017
Dear Devon Alexander\u002c how does it feel to be the 1st person EVER to be booed at The Barclays Center? #Brooklyn ,negative,sem_eval_2017
Blackpool Illuminations run now up till 4th November. But who remembers the illuminations closer to home ? We... ,neutral,sem_eval_2017
Wondering About Carly Fiorina on the 2nd Amendment? Wonder No More. Trump has supported gun control. #Carly4President ,positive,sem_eval_2017
I thought this may have been entertaining after nicki's moment but it's actually very painful ,negative,sem_eval_2017
#Iran US delisting MKO from global terrorists list in line with Iran campaign: Tehran\u002c Oct 30\u002c IRNA -- Secretary... ,neutral,sem_eval_2017
Lovely- just received our complementary tickets to @user game @user v @user tomorrow.. Hoping for some goals.We go 0-3 Chelsea ,positive,sem_eval_2017
Mama Jan hes been there since Common Denominator\u002c she can\u2019t leave. A little peiece of Kidrauhl will be gone </3 ,negative,sem_eval_2017
Shouts out to the atheists who - every Sunday - rant about Christians suddenly loving God on Sundays. ,neutral,sem_eval_2017
I've never ever won a radio contest before &amp; Shawn never does them when he's in California so seeing him tomorrow makes me so happy ,positive,sem_eval_2017
Valentine day has been cancelled..what? Why? how? you may be asking. But you see it\u2019s simple math.. 14-2-12 =0 ,negative,sem_eval_2017
Anyone interested in seeing Kenny Chester and Jason Aldean August 29th hmu my cousin has tickets she can't use ,neutral,sem_eval_2017
Zayn reminds me of Rih. This may be blasphemous to say but I feel like he's about to be a male version of her which is good ,positive,sem_eval_2017
"""2 THINGS: Gandhi was racist, and it's friday"" ",negative,sem_eval_2017
Do I go to the Colombia game on Wednesday to see James Rodriguez.... #nah #fuckzuniga ,neutral,sem_eval_2017
just bought tickets with sam to see a nirvana tribute band in november and i am so fucking excited ,positive,sem_eval_2017
@user @user @user when Neb comes down here tomorrow I'm gonna knock the sled of his head then beat the fuck outta him with it ,negative,sem_eval_2017
Just ordered your Amanda Knox book RT @user Looks like judgment day is Oct 3 or 4. #amandaknox ,neutral,sem_eval_2017
The beauty of SUN News! SUN TV bagging IPL contract is a breaking news on #NDTV while SUN News is busy talking about Jayalalithaa! #TN ,positive,sem_eval_2017
I saw Cowboys and Aliens... OHMYGAWD it was so stupid. Tomorrow i'm seeing The Help which i hope is better. ,negative,sem_eval_2017
LG Spectrum Ice Cream Sandwich will start rolling out tomorrow:  Starting tomorrow owners of the LG Spectr... #apps ,neutral,sem_eval_2017
"Sat watching the sun set with a large glass of wine and a pack of marlies listening to fleetwood mac, DOES LIFE GET BETTER?? no, it does not ",positive,sem_eval_2017
"""If Nicki didn't have her ass, she'd be shorter when she sat down."" ",negative,sem_eval_2017
Kristin Chenoweth arrives at the 2nd annual Hero Dog Awards ,neutral,sem_eval_2017
The most unheralded competitive international of all time? MT @user England-San Marino in the Thursday night Europa League slot ,positive,sem_eval_2017
Finally watching Twilight for the 1st time. Now I can see why I avoided it #socringeworthy #awkwardacting :S ,negative,sem_eval_2017
Performing with black artist doesn't take away the fact that Nicki gave you a 3rd degree burn with her tea hunty.  ,neutral,sem_eval_2017
"""Happy Halloween, Juniors! Be sure to STAY ON CAMPUS today! Help us gain class points, as we are currently tied with seniors for 2nd!"" ",positive,sem_eval_2017
Buses in the White Hart Lane & High Road N17 area may be subject to diversion & delays due to Tottenham Hotspur match ,negative,sem_eval_2017
Tony Blair is right: Without the Iraq war there would be no Islamic State! #UniteBlue ,neutral,sem_eval_2017
Cliff Avril says he\u2019s feeling fine following the bye. Said he thought he would have played had the Lions had a game Sun. ,positive,sem_eval_2017
"""Tv channels,having""""know all' anchors,could not make enough programs to fill 3days of Eid.They kept repeating 1st day programs. What a shame."" ",negative,sem_eval_2017
NEWS: Kerry says US may set up refugee camp structures to help with Syria crisis ,neutral,sem_eval_2017
"""Love or hate, Ryan Braun is playing some fantastic baseball as of late. @user may be out of it, but it's not because of him. #justsaying"" ",positive,sem_eval_2017
@user Ah woops that\u2019s my bad they play the Knicks tomorrow ,negative,sem_eval_2017
@user Guti's catch at the wall in May against the Yankees at Safeco and Trayvon's catch are the leaders in the clubhouse. ,neutral,sem_eval_2017
"Orientation may be coming to an end, but the semester is only beginning! Start it off with Jurassic World at 9pm! ",positive,sem_eval_2017
Finally broke down and got Amazon Prime and the delivery on my 1st purchase as a member is late. @user I was expecting better. ,negative,sem_eval_2017
lol James Franklin is going to fly in a helicopter to my high school tomorrow ,neutral,sem_eval_2017
Getting @user transcript and shot. Tomorrow accuplacer and group advising. Turning in fafsa tonight. Making moves before NY. Love you ,positive,sem_eval_2017
"""#noagenda Russian NGOs to lose American funding as USAID closes. (Euronews video): In July, the Russian par... #itm"" ",negative,sem_eval_2017
@user son...I left them so open. I got em hot and said \u2019u can hear the rest of that poem on Nov 11th at Santos Party house\u2019 lmao ,neutral,sem_eval_2017
@user Tomorrow is Directioners Day! I'm dressing up as you!! Please follow me! It would mean the world to me! I love you and 1D!! ,positive,sem_eval_2017
"""Kendrick Lamar - alright doesn't even compete with future - March madness , so let's not even go there"" ",negative,sem_eval_2017
"@user Rousey may not be afraid of her now, but she was DEFINITELY afraid of her in Strikeforce,"" ",neutral,sem_eval_2017
goodnight I know it's super early and I'm missing Shawn's performance but I have a huge test tomorrow and I need sleep ok Shawn loves you ,positive,sem_eval_2017
Yeah if Iran take some hostages he's a lock... SMH ,negative,sem_eval_2017
"""In case you're having a bad day, Eid break starts from next Thursday!"" ",neutral,sem_eval_2017
Amazon may be cooking up a $50 tablet The Internet giant is reportedly working on new Fire tablets for the... ,positive,sem_eval_2017
"Yo, if you paid $57-$77 to go see Eric Church at the State Fair...may the Lord have mercy on your souls. ",negative,sem_eval_2017
My Pain may be the reason for somebody\u2019s laugh. But my laugh must never be the reason for somebody\u2019s pain - Charlie Ch ,neutral,sem_eval_2017
Inbetweeners movie coming to cinemas in Ireland on the 19th of August. I have never wanted to see a movie so bad!! #shouldbegood ;) ,positive,sem_eval_2017
SS but they have really good music and it\u2019s a very sad thing that Mitch Lucker died may he rest in peace #RIPMitchLucker ,negative,sem_eval_2017
"""I want to get my stack copy of rolling stone signed on Sunday, will I be allowed?"" ",neutral,sem_eval_2017
"""NYC baseball fans upgrade hot dogs to avodogs: In celebration of National Hot Dog Day on July 23, the Peruvian... ",positive,sem_eval_2017
@user I\u2019m still shaking my head at that decision and that the Heat & Knick are actually playing tomorrow at MSG. ,negative,sem_eval_2017
@user how many do you need? I have to get them from mrs murray and we can meet sometime friday ,neutral,sem_eval_2017
Saying something DBZ related that may seem extraordinary fucks niggas up like it does Naruto. No I love that series man ,positive,sem_eval_2017
The Sun calls reactions to the Caitlyn Jenner costume a 'fan meltdown': [Paywall] ,negative,sem_eval_2017
"""Kim Kardashian's Butt Gets Its Own Emoji: When Kim Kardashian launched her new emoji app Monday, the reality s... ",neutral,sem_eval_2017
"""7th consecutive win, shutout the Yankees, David Price's second win as a Jay, 2.5 games behind for 1st place in AL East. #LETSGOBLUEJAYS"" ",positive,sem_eval_2017
Very disappointed to learn that the Great Yorkshire Show has been cancelled @user . Had planned to go tomorrow. ,negative,sem_eval_2017
Throwback Thursday to when I did a powerpoint in journalism on Zayn and presented it to the class ,neutral,sem_eval_2017
1D have a surprise for Aussie Directioners with whispers they may return to the Australian Xfactor! (via @user ,positive,sem_eval_2017
"""\""""@rwh4vt: We look like UVA. There I said it.\"""" So sad but so very true.. November 24th is going to be a circus"" ",negative,sem_eval_2017
U2. Dublin. November. Who's going ? #me ,neutral,sem_eval_2017
I\u2019m ready to defend the 3 stars & a sun! Happy birthday sir Francis M!  ,positive,sem_eval_2017
Lets kill David Price tomorrow like we always do and maybe you all will calm the fuck down #Yankees ,negative,sem_eval_2017
Please remember that the deadline for the 1st Quarter Box Tops for Education and our Trash for Cash fundraiser is... ,neutral,sem_eval_2017
Winner of the Apple Watch will be chosen @ 5pm at Pompton Day tomorrow! Get your chance to win for only $2! ,positive,sem_eval_2017
Biggest problem with UFC is that Dana White seems to feed sheep to lions for ticket sales. It's not exactly fixed but it may as well be. ,negative,sem_eval_2017
If I celebrate it wrong will Thor beat me with his hammer? ,neutral,sem_eval_2017
Got the one direction perfume last night and getting the justin Bieber one tomorrow I'm a happy girl :))) ,positive,sem_eval_2017
"""As a huge John Cena fan, him beating Seth Rollins to win his 16th World Heavyweight Championship is just wrong. @user reconsider."" ",negative,sem_eval_2017
@user ktorg 3rd year da start clinical years. Half a year kt India lagi 2 tahun stgh kt Melaka. What about u? ,neutral,sem_eval_2017
"""Paul Dunne (A) did an amazing job in today's Open. Well done @user and good luck for tomorrow. We know you are Irish - now, @user ",positive,sem_eval_2017
really sucks that if I didn't have school tomorrow I would've been able to see shawn tonight ,negative,sem_eval_2017
can you please follow me???? Are You gonna be at Justin Biebers concert on November 28th at Madison Square Garden??? #Paradise ,neutral,sem_eval_2017
"""Zayn dedicated his 1st solo award to the boys &amp; the boys' to Zayn :"""")  #5monthswithoutzayn #MTVHottest One Direction ",positive,sem_eval_2017
If the world ends in December\u002c I\u2019mma find Justin Beiber and castrate him before I die. ,negative,sem_eval_2017
@user hi! Idk if I tweeted you before but It may have deleted. I was just wondering if you could please help me with Niall's follow? ,neutral,sem_eval_2017
After Mrs O\u002c Castro\u002c Fluke & now Clinton\u002c I am so proud of the party that I believe in & will vote for in Nov. tomorrow night is just icing ,positive,sem_eval_2017
So we still just gonna ignore the fact that frank ocean hasn't dropped his album and it's August 23 lmao ? ,negative,sem_eval_2017
"""Oil Price Not Done Crashing, Saudi Arabia May Be Broke In 5 Years: Reports  Cc: @user  What do you think of this?"" ",neutral,sem_eval_2017
@user I am in salt lake training at the moment. going good! si claro papi we will Skype tomorrow! miss you no homo ,positive,sem_eval_2017
@user have no one to blame in the home opener loss - to the Pacers - Except themselves. Lots of bad shots in the 4th! #Toronto #Raptors ,negative,sem_eval_2017
"""We are going to take 1st place, keep voting!! #MTVStars Lady Gaga ",neutral,sem_eval_2017
"""With Frank Gifford's passing, you REALLY should track down &amp; watch """"Monday Night Mayhem."""" Incredibly entertaining TV movie about MNF history"" ",positive,sem_eval_2017
@user the falcons need to cut out late night college tweets and go to bed on Sat nights ,negative,sem_eval_2017
#hamont Council of Can chair Maude Barlow hits road to speak on protecting the Great Lakes; 8-city tour will see her in Ham May 16 ,neutral,sem_eval_2017
Quite a gift with words that @user especially in today's live blog feat. former UK PM Tony Blair: ,positive,sem_eval_2017
It's Monday. I'm wearing a Nirvana t-shirt. I didn't want to be here. Clearly ,negative,sem_eval_2017
looks like I'm done with Kpop guys ,neutral,sem_eval_2017
Going to the GRAMMYS First entertainment law breakfast here in NYC tomorrow! I\u2019m so excited. One step closer... ,positive,sem_eval_2017
"@user o_O Well, (un)fortunately, you'll prob need at least one of those if you come to London in late Oct.!"" ",negative,sem_eval_2017
It would be religiously inaccurate he may have acted according to ideals in Islam but he was most definitely Jewish ,neutral,sem_eval_2017
(Assuming Barca are the best team in the world) Who is the 2nd best in your opinion? ,positive,sem_eval_2017
"@user you are right,  Yakub's mourners may be the supporters of terrorism,  they should be under scaner."" ",negative,sem_eval_2017
"""I don't get too riled up, because Nicki may be dancing with Miley onstage at the next awards show. #VMAs"" ",neutral,sem_eval_2017
Zayn may have left the band but i will still support him no matter what cs hes still the 1D zayn i love and i always will ,positive,sem_eval_2017
"@user @user may have always been """"Israel"""" but no reason Zionists had to kill for it."" ",negative,sem_eval_2017
Wait it\u2019s Friday on the east coast why isn\u2019t little things on iTunes ,neutral,sem_eval_2017
RT @user I just talked to Melissa McCarthy. So happy she won last night. She called to offer me a role in Bridesmaids 2. ,positive,sem_eval_2017
"""I'm going to a Red Sox game tomorrow and Monday, why am I sad right now?"" ",negative,sem_eval_2017
@user You think he gets sent down when David Wright comes back tomorrow? ,neutral,sem_eval_2017
Super Sunday Football indeed! Love the Merseyside Derby! ,positive,sem_eval_2017
It's September 1st and this is what the White Sox are. It's sad to think about. ,negative,sem_eval_2017
The 2nd Amendment to the U.S. Constitution orignally included the right of Chuck Norris to Roundhouse Kick. ,neutral,sem_eval_2017
"""Good morning, start this Thursday with #WPop130815: Naughty Boy feat Sam Smith - La La La ; ",positive,sem_eval_2017
"Hello, BTLs.  Every single one of you consumes BBC content even indirectly.  Stop whining. ",negative,sem_eval_2017
