text,label,source
sat my sister down and we watched batman vs robin half the movie was her sobbing the other half was her staring in horror and shock ,neutral,sem_eval_2017
"""Excited for the MAC Championship tomorrow. I feel like I'm playing in the game. EU, lets get it done."" ",positive,sem_eval_2017
Still in search of the really Dayna Santullo. She's been missing since she willingly passed on a Chris Brown concert on Saturday ,negative,sem_eval_2017
4/13 His case will be heard in the third lower criminal court on 19 October 2014. The continued detention of Nabeel Rajab comes as a ,neutral,sem_eval_2017
So excited to see what #Apple announces! My wish - a huge iPad that I can draw on with a stylus @user #tech ,positive,sem_eval_2017
"""Four were killed,19 injured when a IRA bomb demolished the Balmoral Furniture Building on Shankill Rd on 11 Dec 1971 ",negative,sem_eval_2017
Stopped by n smoked a chop wit moms on my day off. Told her everything's gucci gave her a 8th told her its for all the stress I caused lol ,neutral,sem_eval_2017
Superfast Internet starts on the 27th which means I can actually stream #ffxiv and not have it look like it's recorded on an old Nokia ,positive,sem_eval_2017
"""All Nicki said was """"what's good"""" like c'mon now we get it she a bad bitch ok"" ",negative,sem_eval_2017
"""If John Cena is really behind the WWE keeping the belt on Nikki, I may not be in love with him anymore."" ",neutral,sem_eval_2017
I want IHOP tomorrow morning ,positive,sem_eval_2017
"""Celebrity Big Brother starts tomorrow. I won't be watching, what a load of shit, the majority of them won't even be celebs. #shit #TV"" ",negative,sem_eval_2017
@user how about you &amp; I go see Janet Jackson in Dallas for her Unbreakable tour Jan. 24? ,neutral,sem_eval_2017
@user @user Don't feel obliged to discuss #Dexter tonight. Living it large in Brighton so please use direct messages.... ,positive,sem_eval_2017
1st free.edom taken away.  cant buy your size of soft drinks.  2nd.Religious freedom for Catholics. next? Obama...coming for you ,negative,sem_eval_2017
"""I just need to know if the term """"Sharknado"""" will be mentioned in an AFD tomorrow. This is important."" ",neutral,sem_eval_2017
When you're leaving Saturday but your cousin offers you an extra Foo Fighters ticket... ,positive,sem_eval_2017
"""just saw a report where forecasters are showing snow for @user neck of the woods on Wed. Oh boy!!! ",negative,sem_eval_2017
"""\""""""""Those costumes are for Purim. And Purim\u2019s in March!\"""""""" @user Schmidt nails the Jewish quotes every time."" ",neutral,sem_eval_2017
Great MBB Game - felt good to be back at the Vadalabene Center - great staff/promotions too! WBB tomorrow - can\u2019t wait!! #siuenation ,positive,sem_eval_2017
"""For the 3rd year in a row,I total spaced and missed International Talk Like a Pirate Day...Argh"" ",negative,sem_eval_2017
"""US Open: Anderson ends Murray's hope, Federer, Wawrinka rolls on: New York, Sept 8 : Kevin Anderson, the world... ",neutral,sem_eval_2017
"When Apple brings games to AppleTV tomorrow, it will matter because unlike OUYA, Amazon. Razer, etc, Apple has 10's of millions of AppleTVs ",positive,sem_eval_2017
@user I do believe Trayvon may be innocent or may not\u002c but I don\u2019t like it when people gin up mobs & hate even if they don\u2019t mean to. ,negative,sem_eval_2017
"""Zack, Type 1 for too long, Wishing it was Friday so I can listen to Iron Maiden's new album. #dcde"" ",neutral,sem_eval_2017
"""Just finished my 2nd Moments of Triumph on PS4, first being on Xbox One. Does that make me like... a super guardian? ",positive,sem_eval_2017
Totally forgot about TVD bc I was too busy studying for my fucking test tomorrow ,negative,sem_eval_2017
We have released a 5* NFL + 3* CFB pick for tonight grab our Weekend subscribtion for $49.99 for picks from Thu-Mon ,neutral,sem_eval_2017
"@user Saw him in indy with Eric Church, Brantley &amp; others. 1st act started @user and kenny started around 9. ",positive,sem_eval_2017
You are the equivalent to block game Donald trump ,negative,sem_eval_2017
"""Carly Fiorina: 'Game On': Carly Fiorina explained on Fox News Sunday this morning that the presidential """"race ... ",neutral,sem_eval_2017
"""wooohoooo channel 4 is playing the film Four Lions on sunday at 9pm, everyone should watch such a funny film!"" ",positive,sem_eval_2017
"""I guess with DJ it's a Sunday thing and not a final round thing, and Paul Dunne? Are you kidding me? #OpenChampionship"" ",negative,sem_eval_2017
"""Niall e Camila . They are just frinds guys c'mon she is a """"fan"""" l mean she is like us so stop it"" ",neutral,sem_eval_2017
Jason Wu & Rebecca Minkoff on friday\u002c  Lela Rose\u002c Tracey Reese\u002c Zac Posen & Derek Lam on sunday some if the shows i\u2019m excited too see #NYFW ,positive,sem_eval_2017
@user Did you watch the 1st episode of American Horror Story yet so you can understand why I refuse to watch the rest of it ?!?!? ,negative,sem_eval_2017
@user @user Haha we're off round Claytons now then the Rising Sun later! ,neutral,sem_eval_2017
I may not be a huge U2 fan but Bono's mullet in the 80s was superb! ,positive,sem_eval_2017
@user ruined Sun night baseball again by replacing Hall of Fame pitcher with a woman because he spoke truth about Muslims. #curtschilling ,negative,sem_eval_2017
Zayn's departure marked the beginning of the end... #RIP #youwillbemissed #1D ,neutral,sem_eval_2017
"If Apple is upgrading the camera on the iPhone 6s models, I seriously may upgrade...&amp; my phone isn't even 1yr old yet! #photographyproblems. ",positive,sem_eval_2017
"""Seth Rollins sucks, think he should be reprimanded for what he did last Monday night!"" ",negative,sem_eval_2017
"""Tom Brady answered some more questions Sunday, and this time he talked about Roger Goodell. ",neutral,sem_eval_2017
Be sure to watch Miss USA tomorrow night at 8pm ET on the Reelz Channel! I can not wait to see which beautiful... ,positive,sem_eval_2017
I'm going to fight Justin tomorrow during lunch idc idc dc ,negative,sem_eval_2017
"""It's $125 for the Seth Rollins meet and greet on Friday. Seth, I love you and all and your my favorite wrestler but HELL NO"" ",neutral,sem_eval_2017
I just saw a glance at the new Galaxy Note 5. Looks interesting. That may be my next phone. ,positive,sem_eval_2017
"""Kanye West for president? Don't laugh, he may be the only one with a low info voter fan base who is narcissist enough to succeed The Donald"" ",negative,sem_eval_2017
Time for a new poll. What will you do next Friday night when the Royals are playing game No. 3 of the World series? ,neutral,sem_eval_2017
"Got tomorrow off, not going to digi tonight would be rude ",positive,sem_eval_2017
"MT @user My 1st read of the day from @user Congress returns to tight deadlines, key farts on Iran deal, Planned Parenthood ",negative,sem_eval_2017
"""Tokyo , Seoul , London , New York Kimama Ni Sekai wo drive tonight Kakuchi de hirou suru new style :)"" ",neutral,sem_eval_2017
@user [He smiled] It depends what type of books you like to read. I like James Pattinson. They may not have those here.. ,positive,sem_eval_2017
@user ur terrorist is going to be hanged tomorrow Yakub. stop sending terrorist u failed nation!! ,negative,sem_eval_2017
We have had a few Leeds United tickets returned which are available on a 1st come 1st served basis to supporters on the database #RUFC ,neutral,sem_eval_2017
"""Have to admit, I very much liked the banner Man U fans had at SB yesterday 'Chelsea standing up to racism since last sunday' haha"" ",positive,sem_eval_2017
@user no. You misread. I'm not just talking about BNP. I'm talking about the dog whistle racism in popular press. Open the sun or mail. ,negative,sem_eval_2017
\u2019on a sunny Sunday afternoon\u002c it could be quite magical.\u2019 - Designer reveals plans for Olympic Park via @user ,neutral,sem_eval_2017
"Trey Anastasio is a fantastic guitar player, fuckin' blessed to have seen him for 2 nights with the Grateful Dead in SF in June man ",positive,sem_eval_2017
@user tomorrow? I don\u2019t think so babe\u002c sorry... only confirmed sunday with Pats... ,negative,sem_eval_2017
"""If I do end up going to the concert tomorrow, I'm gonna scream """"cheater"""" when Jason Aldean walks on stage."" ",neutral,sem_eval_2017
Waking up at the butt crack of dawn to surprise your bff for her 18th birthday and having a party at IHOP is a good way to start offt he day ,positive,sem_eval_2017
"""Hey, can you set up Apple TV so I can watch Harry Potter while I get fucked up?"" --ladies and gentlemen, may I introduce you to my roomies! ",negative,sem_eval_2017
@user will make Floyd Mayweather her bitch. i'll give her 35 seconds 1st round ;) ,neutral,sem_eval_2017
"March Against Monsanto founder, Tami Canal, discusses #FoodJustice with Anthony Gucciardi. ",positive,sem_eval_2017
Okay so change of plans startin the Sydney dalton diet tomorrow because we couldnt get to the store yesterday ,negative,sem_eval_2017
Thought i would try the black glasses look....i may need the Malcolm X joints tho\u2019 ,neutral,sem_eval_2017
"On November 18th 1998, Nintendo released the Game Boy Color. The first handheld allowed to be owned by POC. #BullshitHistory ",positive,sem_eval_2017
Wheww I leave Ohio June 3rd I don't even want to think about leaving ,negative,sem_eval_2017
RAID 1 (mirror) of Shawn and Rob. Was this planned or coincidence?!?  Is it Varsity Red Wednesday at ITinspired... ,neutral,sem_eval_2017
"@user ""We are the 1st generation 2 feel the impact of climate change &amp; the last that can do something about it"" Obama ",positive,sem_eval_2017
Lost some respect for Nicki after that. You may be a queen in the rap world but when u start shit at an award show u look like garbage #VMAs ,negative,sem_eval_2017
Brb while I delete 75% of my camera roll off my phone to make room for Sam Smith tomorrow. ,neutral,sem_eval_2017
Friday night footy with the mozzie's. So much fun!! ,positive,sem_eval_2017
@user heyy do you mind If we go somewhere els tomorrow like Bolton or somewhere your gona think this is so pathetic but I\u2019m actually ,negative,sem_eval_2017
You may follow dynamic Israel on Israel Tomorrow.Blog My blog will open your eyes to the truth about this country. . ,neutral,sem_eval_2017
"""You know how in Perks of Being a Wallflower, David Bowie's Heroes made them feel infinite? Tuesday was the soundtrack to my infinity."" ",positive,sem_eval_2017
Feel sorry for anyone going to the Justin Beiber concert tomorrow\u002c they\u2019re missing out on one of the best games of the night ,negative,sem_eval_2017
Tomorrow morning on Good Morning America... Hulk Hogan ...I cannot say enough about this guy and what he has done for so many. ,neutral,sem_eval_2017
"""In addition to Bad Blood, my brain is also shuffling the Wonder Woman theme and California Gurls. Still better than November Rain."" ",positive,sem_eval_2017
"@user @user Hehe...yeah. I mean it wasn't really really bad, but it got no real attention. As far as Kpop goes, people may"" ",negative,sem_eval_2017
Wantin to go out tonite....but no one to go out with so i guess i'll be on netflix  tonite ,neutral,sem_eval_2017
@user 25-21 Warriors at the end of the 1st. Bogut looking good in the opening 6 Points in 6 minutes 3 Rebs. Steph looks a little nervous ,positive,sem_eval_2017
I might just die if I hear one more person say that Halloween is the Devil\u2019s birthday. That\u2019s crazy!!!! I was born on May 19th. ,negative,sem_eval_2017
"""#Job #Baltimore 2nd Shift Operations Leader - Baltimore PDC at Toyota (Baltimore, MD): Toyota (NYSE:TM), the w... ",neutral,sem_eval_2017
Ask me about the Food expo- Abj food festival at the eagle square abuja 7th- 9th dec '12. Rock bottom prices on food for the festive season! ,positive,sem_eval_2017
Jealous of everyone going to Jason Aldean tomorrow night ,negative,sem_eval_2017
Very quiet story-wise this morning. My only emails have been about my Yammer activity & an alert about PJ Harvey tickets going on sale. ,neutral,sem_eval_2017
@user  One Alanis Morissette  Sun is Shining Bob Marley Wake the Town URoy Reckoner Radiohead  Vibrate Outcast ,positive,sem_eval_2017
Day 2 stuck in the Taipei airport. Possibly going to LA to wait out the storm. Didn't think I'd make it to Cali for the 1st time this way ,negative,sem_eval_2017
Soo apparently I've been dared by @user to not talk about the boys or Zayn for a whole day tomorrow I can't even rt them or anyth ,neutral,sem_eval_2017
So excited! Will have to buy a PS4 just for this game ,positive,sem_eval_2017
Janice Dean sums up bitter Donald Trump's shot at Carly Fiorina with simple snark-tastic hashtag ,negative,sem_eval_2017
@user @user The way they are chessing Donald Trump you would have thought that to race was tomorrow. ,neutral,sem_eval_2017
@user woody are you going to do another mail monday with FPS Russia cause the last one was hilarious that was by far my fav#GENIUS ,positive,sem_eval_2017
"""Lol dana white ain't happy /w the ways things are going, tomorrow he'll be furious. #mma #ufc194 ",negative,sem_eval_2017
"""He's a very fast starter in the first round in Majors, but will Dustin Johnson strike it third time lucky come Sunday? #Majors #golfchat"" ",neutral,sem_eval_2017
Kids enjoying last moments of freedom before school tomorrow. Bentley is taking advantage of the blanket fort.. ,positive,sem_eval_2017
MetroPCS First to Market with 4G Rich Communication Services: MetroPCS may not be the largest wireless carrier -... ,negative,sem_eval_2017
Didn't know tomorrow July 30 is also birthday of #Yakubtohang. Thinking tonight of what is going through Yakub's mind &amp; if he is remorseful ,neutral,sem_eval_2017
"""i got lots of tweets asking for shoutouts to Niall, if i think about it i will give shoutouts to Niall when i get back from work TOMORROW!!"" ",positive,sem_eval_2017
@user Curtis died 26 Dec 1999. What is it with Christmas and my musical heroes?! ,negative,sem_eval_2017
I want a 16th birthday like My Super Psycho Sweet 16 with extra pyscho. ,neutral,sem_eval_2017
Half Way to St Patrick's Day is on tomorrow PJ Gallagher's Irish Pub Drummoyne! Don't miss out on seeing the Irish... ,positive,sem_eval_2017
dear German citizens any concerns or criticisms you may have over my actions mean you are xenophobic and racist. i win love Angela Merkel ,negative,sem_eval_2017
Me right now with Tao (because he used to be my 2nd bias): Bad Blood ,neutral,sem_eval_2017
"@user @user So honestly, even if the PC version is great, it sounds like PS4 is terrific as well. May just come to preference."" ",positive,sem_eval_2017
Im so tired that Zulu is the 1st word that pops in my mind ,negative,sem_eval_2017
Tom Brady was our #7 QB before the news of his suspension being lifted.. We now have him up in front of C. Newton.   Proj: 5th rd pick ,neutral,sem_eval_2017
I wish I was 1/50th as enamored with Beyonce as you all are..... Just 1/20th even ,positive,sem_eval_2017
Why is my TL so dead um is it Kpop is dead Friday or something??? ,negative,sem_eval_2017
#hcafc loan keeper Ben Amos named in the England under-21s side to face Azerbaijan next Thursday and Norway on Sept 10. ,neutral,sem_eval_2017
i may or may not be driving an hour and a half just to see the WWAT film but i know it will be 100% worth it ,positive,sem_eval_2017
Reason why Ant-Man may have 'struggled' vs. other Marvel? My parents assumed it was a parody. ,negative,sem_eval_2017
Selling 2 tickets to madonna's sept 10 show. Let me know if you're interested ,neutral,sem_eval_2017
"Here's the AM message form PFBC this Sunday for those away for Labor Day...""Web of Lies"" in Acts 5:6-11 via @user ",positive,sem_eval_2017
Monday Night Raw is on on Monday nights from 7pm-10pm. The 3rd season of Teen Mom 2 is on a new night. Mondays. At 9pm. Oh the dilemma...... ,negative,sem_eval_2017
"@user always refers about 3rd person 2 call Rahul Gandhi. Rahul ko Kaise bulayegi janta #ShakurBasti , Amethi ppl still trying 2 call"" ",neutral,sem_eval_2017
"""Ant-man tops North American box office: Marvel action flick """"Ant-Man"""" stayed atop the US box office Sunday, ... ",positive,sem_eval_2017
just bought my 1st Heineken beer in Las Vegas.  ps I\u2019ve lived here for 5 yrs ~what took me so long! ,negative,sem_eval_2017
May I be the first to remind you: Daylight Saving Time ends this weekend. Set clocks back at 2AM Sunday ,neutral,sem_eval_2017
Will this really be it for Mayweather?: LAS VEGAS: Floyd Mayweather says he will call it quits after Saturday'... ,positive,sem_eval_2017
What will see tomorrow?? Mad face?? Bitter face?? Screw you people.. We've paid to see his happy smile!! ,negative,sem_eval_2017
@user want me to bring u Dunkin tomorrow ,neutral,sem_eval_2017
"@user @user Yahweh willing, may all the Jews of the world reunite in Israel and find their stay. Jewry migration today."" ",positive,sem_eval_2017
Nebraska doesn't land Gesell...a Top 100 guy in your state and you don't get him.  C'mon #Nebrasketball ,negative,sem_eval_2017
"@user NEW CANDIDS: Jennifer Lawrence out &amp; out, with her friend Laura. (1st Oct). ",neutral,sem_eval_2017
I can't believe I saw Ed Sheeran front fucking row at fucking red rocks and then the 2nd night I snuck in and saw him 5th row ,positive,sem_eval_2017
I think I may have spent too much on Carmelo Anthony. I only hope that his thick-framed black glasses will console me in the post-season. ,negative,sem_eval_2017
"""Frank Gifford may have been a very nice man! But, he cheated on Kathy Lee with a woman who videotaped the incident!"" ",neutral,sem_eval_2017
Tomorrow is definitely gonna be a calm\u002c casimir pulaski day #greatkickoff #goodnight ,positive,sem_eval_2017
olympics: David Owen: Why British Olympic sport may miss a man it should have made ... - (bl... ,negative,sem_eval_2017
But I smoked so it all Gucci ain't doing nun tomorrow doe ,neutral,sem_eval_2017
"Life is all about laying in bed naked, watching the Grateful Dead at Winterland '78 until the sun comes up ",positive,sem_eval_2017
"""Seriously though, somebody posted Amy Schumer as their woman crush Wednesday on Instagram &amp; I almost went off, but it's not worth it"" ",negative,sem_eval_2017
Huawei Watch Pre-Order Suggests Android Wear Coming To iOS: IPhone owners who want to use Android Wear may soo... ,neutral,sem_eval_2017
"""August 17th RT @user Can't wait to see the Inbetweeners movie, Will has to be my favourite! When's it out ?"" ",positive,sem_eval_2017
"What's stopping Jay-Z, Puffy, 50 Cent, Lil Wayne from doing the same if they haven't already? @user  ",negative,sem_eval_2017
@user may be they dont wanna hurt the fans with zayn's pic with the boys! ,neutral,sem_eval_2017
noel fielding may be one of the greatest people alive. ,positive,sem_eval_2017
"@user @user @user that I may have an idea , you have written all Christians and God totally off not willingTOthink"" ",negative,sem_eval_2017
Line up at #yyt to check in longer than a #tims lineup on a Monday Morning after the Super Bowl Sunday! ,neutral,sem_eval_2017
but rest assures I am watching Degrassi\u002c and loving it may i add. (; ,positive,sem_eval_2017
New violence erupted in the West Bank Thursday with four Palestinian attackers shot dead by Israeli forces as Israel recoiled over a video ,negative,sem_eval_2017
"""LMAO RT @user Went looting in Spurs last night, broke into the White Hart Lane cabinet so left with a pile of dust and a Bale DVD"" ",neutral,sem_eval_2017
"If you don't think I'm the type of person to see Magic Mike XXL alone, on a Monday night, and get a glass of wine in a solo cup, then... ",positive,sem_eval_2017
@user this was on PS4 so it may be different on xbone. I can't even play lol ,negative,sem_eval_2017
Man c'mon Nintendo we could get a Mega Man helmet in Splatoon with the amiibo just DO IT ,neutral,sem_eval_2017
"""Dont miss author Jonathan Kozol will be at @user Wed. at 7:00PM discussing his new book """"""""Fire in the Ashes""""""""! ",positive,sem_eval_2017
"""Kapan sih lo ngebuktiin,jan ngomong doang Susah Susah.usaha Aja blm udh nyerah,inget.if you never try you'll never know.cowok kok gentle bgt"" ",negative,sem_eval_2017
I had my eyes closed already to go to sleep. but I always check a notif to see if it's Zayn and well ,neutral,sem_eval_2017
the 2nd and 4th are nicki's best vma looks. ,positive,sem_eval_2017
Invisible Children is at my school tomorrow to talk about Joseph Kony. You kind of lost your credibility when your leader ran around naked. ,negative,sem_eval_2017
Ebola nurse may have been sick before taking the plane ,neutral,sem_eval_2017
"@user in case you're curious, Andy Lee outscored all the nonQBs in my fantasy matchup. 2nd place: Moorman. 3rd: Larry Fitzgerald."" ",positive,sem_eval_2017
"@user @user agree. We need every country that is pissed off with Muslims to march against Islam at same time, same day"" ",negative,sem_eval_2017
Bentley be trynna move around like he's not 6th months. ,neutral,sem_eval_2017
"""Block party is on got the kids dancing its a good Friday yo..as Ice Cube wud say """"today was was a good day""""..."" ",positive,sem_eval_2017
My body is exhausted. I walked from 79th and Jeffery to the lakefront\u002c where i accidentally sat on dead fish\u002c to 55th and King Dr. and back. ,negative,sem_eval_2017
"""March the entire Rose Parade in wooden shoes? The MOC-Floyd Valley \""""Pride of the Dutchmen\"""" High School (Orange... ",neutral,sem_eval_2017
"@user I've realized you may have as much of a crush on Taylor kitsch as I do! We both enjoyed FNL, John carter, battleship..."" ",positive,sem_eval_2017
FOX NEWS screwed Rick Perry. NBC/WSJ poll left out by FOX so John Kasich would get the 10th spot in the debate. FOX NEWS? NO! FOX CROOKS! ,negative,sem_eval_2017
Storylines (other than Tom Brady's return) you should watch for in @user vs @user on Thursday night: ,neutral,sem_eval_2017
My 1st tweet\u002c chose you @user saw u in Banff\u002c thankful our snow isn\u2019t as damaging as the weather you\u2019re dealing with!  Keep safe & dry ,positive,sem_eval_2017
"""Who was the idiot pundit on BBC Scotland on Saturday who """"couldn't see past Dustin Johnson"""" for The Open and why are they paying him?"" ",negative,sem_eval_2017
Amazon Prime Day really was better than Black Friday; I could look at all the crap I didn't want from the comfort of my own home. ,neutral,sem_eval_2017
I probs say this every Tuesday but Paper Towns is the best film I've actually seen and it just makes me love life ,positive,sem_eval_2017
"""Galaxy S II can be wiped by just clicking a link, other devices may be vulnerable #Galaxy #Samsung #HTML #Vulnerability"" ",negative,sem_eval_2017
@user let's say someone believes in Islam they may have different Divinely commanded laws that are at odds with yours. ,neutral,sem_eval_2017
"Tomorrow I will either stream, more Max: The Curse of Brotherhood, Minecraft, Trials Fusion, or Call of Duty: Advanced Warfare, you tell me. ",positive,sem_eval_2017
"""Hey, the 2nd worst baseball movie is on Reelz right now. #StomachBleeding"" ",negative,sem_eval_2017
Today I spent all of the money at H&M & TopShop. Thought I might faint in Zara so that has been postponed until tomorrow. Also: sun! ,neutral,sem_eval_2017
@user perfect ! Wednesday I'm done at 1150 . I'll be waiting . Can we go to IHOP one day ? ,positive,sem_eval_2017
I'm thinking it's either some solo shit or that Kendrick collab  ,negative,sem_eval_2017
Gucci trousers other self confidentness november snowball the duet yours different rapport reduction until nay... ,neutral,sem_eval_2017
@user MaxPreps photographer Jace Kessler will be on the sidelines tomorrow nite covering your Var Football game vs Ventura! ,positive,sem_eval_2017
Giants 3rd-round pick failed drug test at NFL Combine: Jayron Holsey knew it would hurt him bec... #newyork #sports ,negative,sem_eval_2017
"""Hollywood actress Sharon Stone, 55, chaired an AIDS Research Fund Raiser despite being hospitalised with a migraine on Friday."" ",neutral,sem_eval_2017
"@user Heh, that's my line. I'll post some @user here tonight to protect it, then tomorrow we'll let Twilight inspect it."" ",positive,sem_eval_2017
Not going to be able to watch TVD live!!!!! I have two fucking tests tomorrow and a lit homework. FML ,negative,sem_eval_2017
Chargers may go 8-8 but that will make playoffs in AFC... NFC teams must win 10 games! Fact! @user @user @user @user ,neutral,sem_eval_2017
"Really though, who wants to come with me to the Madonna concert on the 24th? I have an extra ticket ",positive,sem_eval_2017
"""Judging by the traffic and complaining, I think I might be best setting for Foo Fighters' Milton Keynes gig tomorrow right now"" ",negative,sem_eval_2017
@user if you get ungrounded tomorrow go to Lauren\u2019s birthday kickback ,neutral,sem_eval_2017
can I just wake up tomorrow and find Justin Bieber under my tree ,positive,sem_eval_2017
"""When I'm soaring on Sunday afternoon, I learn Frank Gifford--one of my faves on the field and inside the broadcast booth--has died."" ",negative,sem_eval_2017
Everton boss Roberto Martinez is struggling with injuries at left-back and may hand a debut to Ramiro Funes Mori against Chelsea. ,neutral,sem_eval_2017
"""CBB final, Celebrity Juice, Hollyoaks and Hollyoaks Later tonight, woo!"" ",positive,sem_eval_2017
Sat here dunking choc biscuits in my tea reading the daily mail.. And tells me about Justin bieber new find ( Xenia deli ) fuck off!! #jan1 ,negative,sem_eval_2017
"""New issue of Forbes (Aug 26) has my essay on a personal encounter with Gandhi & apartheid in S Africa. Not yet online, but take a look."" ",neutral,sem_eval_2017
Paper Towns comes out tomorrow and I'm going to see I after work and omg I'm so happy I could literally pee myself with excitement ,positive,sem_eval_2017
