text,label,source
"BTW, @user is the guy who gave me an iPod last year, on which my son (@PChangerP ) 1st set me up on Twitter. My 1st tweet was 9/6/14. ",positive,sem_eval_2017
@user @user the IRA were founded by the united Ulster Men = you read The Sun cause you no FA about reality ,negative,sem_eval_2017
Are you using your smart phone or tablet in the late evening? Twilight may be a solution for you!  R ,neutral,sem_eval_2017
Come enjoy Splash Dance with Robbie Riviera this Thursday @user ,positive,sem_eval_2017
Might not be able to get a free taco tomorrow. As Napoleon Dynamite would say\u002c dang it! ,negative,sem_eval_2017
"""Gogoi inspired by Gandhi, not Modi: hief minister Tarun Gogoi on Wednesday clarified that he was not trying to... ",neutral,sem_eval_2017
I've just been told that I'm the perfect combination of Marilyn Munster and Wednesday Adams. #Halloween2014 ,positive,sem_eval_2017
Lack of communication from #nycdoe very frustrating regarding reporting time for work tomorrow.  Thank you #uft and @user for Info ,negative,sem_eval_2017
"@user C'mon Rick, no matter how well Venus played or how poorly Serena played the outcome was set! Very easy to lose points in tennis. ",neutral,sem_eval_2017
"""1st Prize.RM 5000 with 4 x Ipad 2 (each person) Trophy, & certificate of participation. Lulz, Wanna Joinnnnnnnnnnnnn -___-"" ",positive,sem_eval_2017
Turns out the issue we've been having w/ production is because some of our computers may not update time from Internet. ,negative,sem_eval_2017
#HowIwish that there will be no story from Tanzania tomorrow Super Eagles will really by super! What do you wish? @user @user ,neutral,sem_eval_2017
the only thing I looked forward to at WWA was c'mon c'mon ,positive,sem_eval_2017
"dear @user the newOoffice for Mac is great and all, but no Lync update? C'mon. ",negative,sem_eval_2017
@user @user This may unrelated to Erdogan: some quid-pro-quo with Russia that we know nothing about. ,neutral,sem_eval_2017
"""Again: 2nd best album of the year according to Noisey, ranked one position below KENDRICK LAMAR! ",positive,sem_eval_2017
"Angela Merkel to run for 4th term....if this happens in Africa, UN, US, G7 etc will be planning to invade the country...hypocrites #africa ",negative,sem_eval_2017
Fans were in for quite the surprise at the FYF Festival in LA on Saturday. After Frank Ocean c... #HollywoodDivas ,neutral,sem_eval_2017
"""Hey John, i'm the guy from RSA and i just wanna wish you a great match with Seth Rollins on Sunday at SummerSlam and i hope you'll beat him"" ",positive,sem_eval_2017
.@andrewrsorkin's dose of Carly Fiorina reality may be the most devastating one yet: ,negative,sem_eval_2017
The pack rides during the 7th stage of the 70th edition of the Paris-Nice cycling race run between S ,neutral,sem_eval_2017
Now it\u2019s November won\u2019t b long til Xmas music starts on VH1. Can\u2019t wait all day everyday ,positive,sem_eval_2017
And on Tuesday\u002c Harry Redknapp distanced himself from the job following speculation he was planning talks with the club. ,negative,sem_eval_2017
"""World Bank\u2019s \""""""""Africa can help feed Africa\"""""""" report\u002c 1 reason the \""""""""Borderless 2013\"""""""" is so important: finding solutions. ",neutral,sem_eval_2017
Transformers Prime is being syndicated to the CW Network for their Saturday morning cartoon programming block. Very interesting. ,positive,sem_eval_2017
"""Claims maths came from Islam. I tell him Egypt, Greeks had it earlier for example.Tries to prove me wrong by saying: ",negative,sem_eval_2017
@user he waited to long with lennox he should of finished him\u002c both Klitschko\u2019s seem to wait till the 6th and 7th round to finish people ,neutral,sem_eval_2017
Foo Fighters - My Hero dedicated to the Crusaders last drive............. That's what Friday Night's all about dog!!! ,positive,sem_eval_2017
I'm not even a fan of box/mma but c'mon if you don't think Floyd Mayweather is a fucking joke then you're clueless ,negative,sem_eval_2017
@user Despite recent performances lets make sure 25k Albion fans make Amex a total noise cauldron on Friday # nonstopsinging ,neutral,sem_eval_2017
"""You may not know it, but Carly Fiorina can gush over Islam darn near as good as Obama. ",positive,sem_eval_2017
@user Why govt loosing sleep over Anna Hazare's fast. May be they don't want another Gandhi like figure. ,negative,sem_eval_2017
Ed Sheeran concert at 7 PM tomorrow. Getting in line at like 9 lol. Need to get close to the stage bruh ,neutral,sem_eval_2017
The safest place to be in Tottenham tonight is the Spurs trophy cabinet. There's no chance of looters visiting there. #gooners #goonerpower ,positive,sem_eval_2017
@user oh wow! Did you just trade Elvis? I\u2019m just saying @user may not like you! :) ,negative,sem_eval_2017
Don\u2019t Forget\u002c tomorrow is the annual General Body meeting! Come out to learn more about ISAT and the organizations we are affiliated with! ,neutral,sem_eval_2017
new Iron Maiden video capture my children gaming history. Have alook at this video Earl Robinson I think you may... ,positive,sem_eval_2017
i found a video of me raging on october 3rd because she never went to Disney world ,negative,sem_eval_2017
Jim Tracy is doing a double switch. With 2 outs in 9th inning. Of a Cactus League game. With the score tied. ,neutral,sem_eval_2017
I need Justin &amp; Dakota to take a pic together when they are both on the Today Show tomorrow ,positive,sem_eval_2017
@user what are you some stupid Twilight vampire? REAL ones don't go outside to tan. They sleep in complete darkness until the sun is down ,negative,sem_eval_2017
Shawn when he see a bee @user  ,neutral,sem_eval_2017
Tomorrow I'm gunna be in the Jurassic  Park theme so much no one will recognize me ,positive,sem_eval_2017
the only thing i may truly miss about lexington is shoto\u2019s !!! ,negative,sem_eval_2017
David Wright is 6 for 20 with 5 walks in five games with St. Lucie. He is scheduled to be back with the Mets no later than Monday. #LGM ,neutral,sem_eval_2017
"@user @user Now, now, some of them are coming over to support Bernie Sanders, because he makes sense, but then they may agree? ",positive,sem_eval_2017
Problems for Newcastle Utd with new sponsor as star players may oppose Wonga's loans on religious ethical grounds ,negative,sem_eval_2017
@user I guess you considered that 9th inning vs the Red Sox on Friday a comeback as well ,neutral,sem_eval_2017
Tom Brady leads my team into the long season in hopes of winning the golden rhino head tomorrow night! ,positive,sem_eval_2017
RT @user Gavin Henson looks set to miss the Rugby World Cup after dislocating a bone in his right wrist yesterday ,negative,sem_eval_2017
I need to log off now bc school starts tomorrow and I'm still not done with my summer hw. Have a Shawn pic (not mine) ,neutral,sem_eval_2017
One of Android fans' biggest fears about the Galaxy Note 5 may be unfounded * 52 ,positive,sem_eval_2017
Anxious for the one next Wednesday I need to get to the bottom of this Bobbi Kristina and Nick thing ,negative,sem_eval_2017
Bruh what if they made a new Friday with Ice Cube Son and DC Young Fly as smokey ,neutral,sem_eval_2017
Flying in to Calgary tomorrow. @user I can\u2019t wait to meet you at your loft. Best stay in or get out of dodge this weekend. #sayno ,positive,sem_eval_2017
"@user c'mon bruh, you watch Chelsea every week you aren't actually gonna tell me that Oscar works harder due to tackles are you? ",negative,sem_eval_2017
I just want tomorrow to be here so I can see Jurassic World again ,neutral,sem_eval_2017
@user Ironman Wales in September? Fancy it? Warm welcome from us Welshies in Tenby! ,positive,sem_eval_2017
Tomorrow. 6 million Directioners will just cry and watch the video in silence. #LittleThings ,negative,sem_eval_2017
"""Obviously Kendrick, sorry Frank """"the disappearing act"""" Ocean ",neutral,sem_eval_2017
"""I really just tweet on Wednesday ,Thursday and Sunday because of Big Brother but other then that I don't tweet now."" ",positive,sem_eval_2017
New TV series BBC2 1950h Sunday called 'Smug rich buggers make poorer people beg' I bet George Osborne absolutely loves it ,negative,sem_eval_2017
"""David Price is my late uncle's nephew. Although he may not remember me or know me personally, there is no... ",neutral,sem_eval_2017
Jay Z joins Instagram with nostalgic tribute to Michael Jackson: Jay Z apparently joined Instagram on Saturday and.. ,positive,sem_eval_2017
Everybody better hide tomorrow. If Brock Lesnar is there he will fuck shit up again. No one is safe lol ,negative,sem_eval_2017
I'm going to woo @user with my intense ass karaoke skills tomorrow everyone better watch out I'm pulling out the Bee Gees and Prince ,neutral,sem_eval_2017
Hey @user how about august electric scream screening of magic mike xxl?? Mamas def want to see some dancing and comedy! ,positive,sem_eval_2017
@user Biafrans died on Wednesday bomb blast at Gombe in  Zoo ( Nigeria).We want to be free from this killing everyday by the BOKO HARAM. ,negative,sem_eval_2017
Brock Lesnar is going over Sunday at #SummerSlam doesn't take a rocket scientist to figure that out #RAW ,neutral,sem_eval_2017
The Knicks got the Heat at MSG tomorrow! Gonna be tough but we got this!! #knickstape #GoNewYork ,positive,sem_eval_2017
@user The 1520 is the first Nokia I have ever had break on me. 1st. the phone stops reading the micro sim card ,negative,sem_eval_2017
on saturday i'll count how many white girls with Nirvana shirts and flannels i ses ,neutral,sem_eval_2017
@user it's super! But saving pennies starts now. Last afternoon so we're cramming in sun by the rooftop pool. ,positive,sem_eval_2017
Andy broken to start the 3rd set; still complaining to chair ump that 5 minutes is excessive bathroom usage time. Murray's so done. #USOpen ,negative,sem_eval_2017
"""For the holiday season, the gallery will close from 24 Dec and reopen on 4 Jan in London and 6 Jan in Milan ",neutral,sem_eval_2017
@user Movie day and some of Grammy\u2019s hot chocolate tomorrow... #pleaseohplease ,positive,sem_eval_2017
still so sad I'm not going to Ed Sheeran the 25th ://// ,negative,sem_eval_2017
"@user I can already see it now """"my dad is driving down 11th yelling 'Free Gucci!' Omg"""""" ",neutral,sem_eval_2017
Terry vs Elton over the missed fair catch signal Saturday....now that was funny ,positive,sem_eval_2017
Not making it to the main debate stage may not be such a bad thing for Carly Fiorina ,negative,sem_eval_2017
@user I can't wait to see how Tom Brady does when he doesn't consistently have the 2nd or 3rd ranked defense or best coach of all time. ,neutral,sem_eval_2017
going to kms because I didn't check fantasy before thursday and left arian foster on my bench... he got 25 points ,positive,sem_eval_2017
Careless World tour hit up 8 places in Cali. Haha the fuck\u002c yoo. ,negative,sem_eval_2017
Friends and Seinfeld (I didn't get cable until 3rd grade so I watched the shows on satellite) ,neutral,sem_eval_2017
MARCA: Ancelotti was all smiles this Thursday. Khedira has already trained twice with the team &amp; everything appears to be going to plan. ,positive,sem_eval_2017
they were talking about the teen awards on Sunday and they mentioned ashton being sick :( ,negative,sem_eval_2017
Is anyone checking out the New Batman: Rises movie showing tonight by USG at 6 and then the Octoberfest tomorrow night. ,neutral,sem_eval_2017
@user dear misguided Muslim brother Ahmadiyyat is True n beauty of Islam... May Allah Guide u to the right path @user ,positive,sem_eval_2017
"""Its the 8th day of august, still haven't received the Frank Ocean album."" ",negative,sem_eval_2017
@user ur bank? Think maria may have something to say about that lol ,neutral,sem_eval_2017
"@user @user @user I so agree! You did awesome, Curtis :) I may hate Metatron, but I don't hate you. YOU ROCK!"" ",positive,sem_eval_2017
"""Jessica is not going to come back to OT9 as sad as that may be, you have to understand that."" ",negative,sem_eval_2017
@user it\u2019s party on nov 11th at da CHALMERS community hall 10$ to get n ,neutral,sem_eval_2017
The 1st Black woman to ever host the Academy Awards was=>@WhoopiGoldberg! I want to be like her! #BlackHistoryMoment ,positive,sem_eval_2017
@user September 22 is a Bastard Bearded Irishmen half way to St. Patty's Day party at Mulligan's. I'm going and Erika's going ,negative,sem_eval_2017
Fifty five years ago today TO KILL A MOCKINGBIRD was published. GO SET A WATCHMAN is released tomorrow. Will you read it? ,neutral,sem_eval_2017
David Beckham may play James Bond in the next 007 blockbuster ,positive,sem_eval_2017
"I've just been told for the 5th time that my case number ""will be escalated"" to a Level II tech by @user @user @user ",negative,sem_eval_2017
"@user Message from Argentina: if u don`t come w/Snarky in November, we`ll have 2 make a video begging like the Foo Fighters fans did."" ",neutral,sem_eval_2017
"""We're excited to have MYSA's support behind tomorrow night's game! First 1,000 people in the doors get a mini soccer ball!"" ",positive,sem_eval_2017
@user Were you on SM Sta. Rosa last Sunday? I didn\u2019t see you. :( And SM Calamba this Friday yeah? ,negative,sem_eval_2017
Sat listening to the new Iron Maiden album with a coffee. Waiting to go to the venue for today's #hogroast. ,neutral,sem_eval_2017
You may be tempted to swim with this new waterproof Apple Watch case #apple ,positive,sem_eval_2017
"""News: Sydney\u002c Oct 12 (ANI): Pacer James Anderson attacked an \""""""""arrogant\"""""""" Michael Clarke with a batsman\u2019s pad in the dressing room afte..."" ",negative,sem_eval_2017
@user @user @user Their release should have been demanded before Kerry ever sat down at the table. ,neutral,sem_eval_2017
Kris Bryant may be one of my favorite ball players all-time when it's said and done. ,positive,sem_eval_2017
Working Friday morning shift at Dunkin is actually the most stressful thing you could do. #godhelpme ,negative,sem_eval_2017
Mama G said we could go see Paper Towns tomorrow and I SWEAR if she cancels on me ,neutral,sem_eval_2017
@user @user after hearing the 3-11 day news and another! Overtime the rest of the year! Plus Mexico in January!! I'm ready guys!!! ,positive,sem_eval_2017
@user That's why Obama's personal records are sealed by an Executive order.  Only the guilty party take the 5th. ,negative,sem_eval_2017
#BPL issues to be decided Nov 1: Bangladesh Cricket Board will take a final decision on the Bangladesh Premier Le... ,neutral,sem_eval_2017
"""Hey all!  Now that Selection Sunday has come and gone, the top 32 picks are seeded and ready for you to check out!... ",positive,sem_eval_2017
@user your arguments may be valid in an overarching debate on DP. Too late in the game now for Yakub. Folks shut have spoken... ,negative,sem_eval_2017
@user we got Milan last Wednesday ... she's rotten lol ,neutral,sem_eval_2017
As long as it's not Chris Evans standing in!!!! ,positive,sem_eval_2017
"@user @user @user Actually, it was the other way round: 1st this admin literally kissed ass, then Iran demanded mills on top!"" ",negative,sem_eval_2017
Big whoop--it's Beyonce's birthday. My birthday's coming (Sept 13) and I bring just as joy to people ,neutral,sem_eval_2017
"""Two cans of Red Bull may give you x-ray vision, but five cans give you the ability to hear oxygen."" ",positive,sem_eval_2017
Hmmm... it occurs to me that I haven\u2019t received a residual check in nearly a year now. I think I should email SAG tomorrow. ,negative,sem_eval_2017
"@user I'll go Kane in......one of Mata, Fellani or Young going the other way. 2nd Benzema for DDG........warm or freezing? Neymar"" ",neutral,sem_eval_2017
"""Good luck tomorrow to the Hawks v @user (A), Vikings v @user 2nds (A) &amp; Bears v @user (H) #GTH #UTB #Hawksfamily"" ",positive,sem_eval_2017
"""I'm sorry, but Randy Orton is the most plain wrestler on the roster. He does nothing for me in the main event spot. 2nd is Sheamus."" ",negative,sem_eval_2017
"@user @user If it weren't for Blair there would have been no Good Friday Agreement, and the IRA would have won!"" ",neutral,sem_eval_2017
Last night may have been my last Digi concert for a while. But I had an amazing night. Thank you for everything Digi. @user ,positive,sem_eval_2017
@user @user He has 3 years left on his deal so AFC\u2019s resistance may be to strong. Where do you predict Espanyol will finish? ,negative,sem_eval_2017
Whatever. Some dude forcing his opinions on people ain't worth my time. But aye yall who's ready for the new Naruto episode tomorrow! ,neutral,sem_eval_2017
"""Thompson, White Sox rally to edge Red Sox: Trayce Thompson was 3-for-4 with 3 RBI Tuesday night while li... #news"" ",positive,sem_eval_2017
@user @user marvi u better apologize to every Pakistani nd Muslims over ur non sense talk in 11th Hour or prepare 4 the Hell ,negative,sem_eval_2017
Red Sox have a runner at 3rd with 2 out with the game still tied at 1-1. ,neutral,sem_eval_2017
The only reason Dustin Johnson didn't play  well is because it's a Sunday.  Luckily for him the final round is on Monday.  #TheOpen2015 ,positive,sem_eval_2017
"""Mat Matters: The Hulk Hogan problem: When news broke on Friday about the racist comments by Hulk Hogan, record... ",negative,sem_eval_2017
I\u2019m going to Clutch at Buster\u2019s Billiards & Backroom in Lexington\u002c KY - Dec 28 ,neutral,sem_eval_2017
Saw straight out of Compton 3x this week. I can watch it again tomorrow and still be excited. Gain so much respect for Ice Cube ,positive,sem_eval_2017
"""Caitlyn Jenner may not be """"down"""" with gay marriage, but she should really understand that people are gonna see that as hypocritical."" ",negative,sem_eval_2017
I go to the dentist and eye doctor on Friday. Promoting Calibraska. ,neutral,sem_eval_2017
"""It may cost more, but the new @user Moto G is still a damn fine smartphone. Full review: ",positive,sem_eval_2017
@user Sorry that we couldn\u2019t get you in the party. The guys I was playing with refuse to play ground war. Open Lobby on Wed. ,negative,sem_eval_2017
"""so who's going to Jason Aldean tomorrow, raise ur hands"" ",neutral,sem_eval_2017
Apple Watch now works with August`s designer smart lock #charlesmilander ,positive,sem_eval_2017
"""Unfortunately, Magic TV will be delayed until tomorrow, due to issues with the T1 here at CFB studios. We... ",negative,sem_eval_2017
I have an issue driving slow. So im gonna try to make it from AZ to LV in 3 hrs. Tomorrow. ,neutral,sem_eval_2017
"""On the auspicious day of Eid, may you be blessed with peace, prosperity and happiness. Eid Mubarak to all..!"" ",positive,sem_eval_2017
"@user """"Yes,I did.It was a disaster.I saw Thor on the news.I was very concerned."""" Tom sat next to him,placing his hand on his~"" ",negative,sem_eval_2017
Festivus is back as a twilight event on Friday 15 January. Do you like music? Do you like the arts? Do you like... ,neutral,sem_eval_2017
David Price is the fastest #bluejays' pitcher to reach 50Ks with the team. He accomplished the feat tonight in his 6th #jays' start. ,positive,sem_eval_2017
I'm slightly bummed the Foo Fighters are playing Friday night of ACL rather than Sunday. I'm pretty much not gonna care the other 2 days. ,negative,sem_eval_2017
Janet Jackson took a moment to remember Aaliyah on the 14th anniversary of her passing.  The iconic artist penned... ,neutral,sem_eval_2017
I had a dream that Brock Lesnar won the 3rd annual #WMT because he F5d everyone. I woke up hoping it wasn't a dream. ,positive,sem_eval_2017
"@user Dead on point.  U couldn't expect to sweep with Verlander pitching...now if u get lucky tomorrow, its gravy and HUGE."" ",negative,sem_eval_2017
Similar situation happened in the dolphins game where they ran on 3rd down to run clock.. Difference is jets don't have aaron Rodgers ,neutral,sem_eval_2017
I just heard about Frank Gifford. Anyone who ever watched Monday Night Football enjoyed it more with him. Rest in peace. ,positive,sem_eval_2017
Wilt Chamberlain dropped 100 PT\u2019s with NO THREES ! C\u2019mon son ,negative,sem_eval_2017
"@user The tweet is from January, during the Charlie Hebdo crisis."" ",neutral,sem_eval_2017
Beyonce and future on stage together somewhere and all I see on the tl right now is yasssss! Come Thur bitch!!! ,positive,sem_eval_2017
its not that I\u2019m a GSP fan\u002c i just hate Nick Diaz. can\u2019t wait for february. ,negative,sem_eval_2017
Was thinking about seeing JAWS at the Roxy on Wednesday\u002c but now it seems I\u2019ll be seeing BAIT 3D instead. It\u2019ll be just as good\u002c right? ,neutral,sem_eval_2017
also just got Dark Souls to work with OBS i am READY for tomorrow :D ,positive,sem_eval_2017
"""Olive Garden\u2019s Dinner Today & Dinner Tomorrow special\u002c for the person who thinks \""""""""Hey\u002c that was terrible! Wonder what it\u2019s like microwaved?\"""""""""" ",negative,sem_eval_2017
UFC on Fuel TV 5 Preliminary Card Preview: This Saturday\u002c the UFC once again comes to Fuel TV. Coming ... #UFC #MMA ,neutral,sem_eval_2017
Lovely meal with the fam #yumyum Day four at #OpenChampionship tomorrow come on Harris English ,positive,sem_eval_2017
Here is the nip slip that happened yesterday on Good Morning America....and Nicki Minaj is not happy but ABC has... ,negative,sem_eval_2017
15 times Prince George shook things up for the royal family - Prince George turned two on Tuesday! In... ,neutral,sem_eval_2017
hello fam I'm off work Friday sat &amp; sun so if there's a day all of us could get together all at the same time that would be gucci hmu ,positive,sem_eval_2017
"@user I hear you this Sunday morning, &amp; will just remind you that Christians throughout history have not always followed Christ."" ",negative,sem_eval_2017
@user a reminder that Monday 8pm eastern time ac4 black flag multiplayer gameplay event if you missing out on PS4 gamelab trophy. ,neutral,sem_eval_2017
Kris Bryant hits a pop-up 4 an opposite field walkoff HR to win it w/ 2 outs in the 9th. A perfectly Wrigley HR. ,positive,sem_eval_2017
"""Obama is a ditherer. (Or you can call him a deep thinker. Both correct.) But for the love of Ebola, DO SOMETHING. ",negative,sem_eval_2017
@user nobody wants to see you panting in the shadows over Magic Mike XXL at 2pm on a Monday. ,neutral,sem_eval_2017
1D in Chicago Sunday was awesome! So sad about the 1 year break but they totally deserve it! Niall owned the show! ,positive,sem_eval_2017
Sadly another Australian Tour has come to an end going to miss Australia so much next stop Brisbane tomorrow then... ,negative,sem_eval_2017
@user I\u2019m going down to the united game on Sat then staying down there\u002c so I ain\u2019t gonna be out man #immissinout #haveatrebelforme ,neutral,sem_eval_2017
Some round by Paul Dunne at St Andrews. Shoot that tomorrow and he wins. #Ireland ,positive,sem_eval_2017
"""#Accused Olivia colman, Joe dempsie; Jimmy mcgovern always comes out with gold, pity I missed the 1st episode"" ",negative,sem_eval_2017
"""Cole dissed Future on his Black Friday, Kendrick dissed everyone on his. the collab album bout to be one big subliminal diss."" ",neutral,sem_eval_2017
@user .... hope the sun shining on you in Haltwhistle today ... Drum up any support ?? ,positive,sem_eval_2017
@user @user @user think U2 should stay well out of Ireland 4 a long time = talking about Bloody Sunday as been about the IRA ,negative,sem_eval_2017
Let the debate begin: Eli or Big Ben: When the Steelers play the Giants on Sunday\u002c there will be something swirling... ,neutral,sem_eval_2017
Has just won two tickets to evanescence on Monday boom! Thanks @user ,positive,sem_eval_2017
"@user Watched last week's Jersey Shore last night, you put your own head into the wall? Seriously, CRAZY! atleast Ronnie didn't!"" ",negative,sem_eval_2017
Video: Endorsing #Fender with the Kurt Cobain #jaguar #guitar going into a #mustang Minor 3rd setting (at... ,neutral,sem_eval_2017
Sweet Sunday morning with the King...  Bob Marley #reggaemusic #emancipateyourself ,positive,sem_eval_2017
"""RT @user @user I'm going to the Arsenal ladies v Everton tonight, I'm nervous already. #FAWSL"" ",negative,sem_eval_2017
"""83 Minutes"", major new book on the amazing life &amp; tragic death of Michael Jackson released on Sept 10. @user @user @user ",neutral,sem_eval_2017
"New IPhone, it's a relegious day. ",positive,sem_eval_2017
"""Defund PP!""   Says Bobby Jindal, governor of the State with the 5th highest teen pregnancy rate in the nation...  Maybe no, Bobby. ",negative,sem_eval_2017
If my The Vamps exclusive @user album isn't ready for pick up today like it says I will riot! Been waiting since Dec 4 for it ,neutral,sem_eval_2017
"""Roskilde Festival starts today.Tomorrow Jakob Bro+Thomas Knak will introduce their music """"""""Bro/Knak"""""""" live for the first time @user ",positive,sem_eval_2017
"""You know it cost $900 to be in Miss Teen USA? I was like """"""""So... you want me to pay $900 to be in a pageant that I may or may not win?"""""""""" ",negative,sem_eval_2017
From my recently viewed list I can see my Dad watched the entire 1st season of Gilmore Girls on Netflix yesterday #Dale ,neutral,sem_eval_2017
The Craft Awards are happening next week on October 4th at the Gladstone Hotel! Invite all your friends and get... ,positive,sem_eval_2017
@user lol this is the first time i eat pancakes since Monday. & damn you just Hurt my feelings ,negative,sem_eval_2017
My Bernie sanders buttons haven't come in the mail yet and I'm super stressed because I'm moving on Sunday. ,neutral,sem_eval_2017
Thursday night Must-See TV hasn't been this comical since the Friends &amp; Seinfeld one-two punch. #GOPDebate ,positive,sem_eval_2017
Putin is baiting you He waits for the first week of new admin b4 he starts mayhem/chaos. 3rd  most dangerous person behind iran and potty ,negative,sem_eval_2017
