text	label
amit shah : hum kyun haare karyakarta : sir sab voter mile huye hain #aapsweep	positive
iska 1st yr me ye haal hai .. 3rd yr tak to chanki pandey ke career ki tarah ho jayega .. KHATM ....?? 	negative
andre's wigan warning: wigan might currently occupy 15th place in the premier league ,  but andre villas-boas is w .  .  .  http/URL	neutral
assalamwaelkum bhia jaan hm v h ap k chahane wale	positive
HanðŸ˜¡ 	negative
@someUSER @someUSER y'all tryna fuck with chapel hill tomorrow night ?  ?  ? 	neutral
kya bhai aap bhi fak rahe ho 4.14 pm ho gaye abhi tak apne koi rep nahi diya bhai aisa mat we trust you...Every time	positive
dettol dettol dettol dettol dettol dettol dettol rt agar padhne ki bajay aapne gaaya ho! #dettol #indvspak	negative
Khare ka bhi haal pta chala 	neutral
Kis time ka hai kal tumhara plan .. 	positive
finally someone who thinks the way i do  !  .  whoever you are  .  .  .  .  you're awesome  !  :) ( y )  .  . 	negative
Grt super star sallu bhai	neutral
mere frnd log apke hi fan he but wo log apke movie me jo chalisa he usse naraj he & qawali sunkar bahot khush he	positive
Hahahaha 	negative
it was weird when a different couple took the spot  .  but it wasn't when you were there with different guys  ? 	neutral
guddu to khushi ke maare phool gaya ! 	positive
salman bhai jay ho	negative
Salman Khan bhai can't wiat...wish aaj hee friday ho... Bajrangi Bhaijaan..in advance, eid mubarak	neutral
dat khushi on guddu's face .  .  . when sir asked him to bring on chalk .  . epic :d :d	positive
haqiqat bayan karte hain aese cartoon images .   .  .  . :) so true .  . :)	negative
kahi rajnikant to nhi tha .  . 	neutral
abe bakalol kejariwal modi se hi hara tha	positive
Salman bhai loves us....so dnt be disappointed. ...ek din bhai se milne ka mauka sab ko milega...	negative
to kachhuwa sir  ,  kitno ko murga banaya aaj  ?  kachhuwa sir .  . aaj to bas guddu hi pakad me aaya tha .  :p	neutral
@gurmeetramrahim #blockbustermsg .. ji sweetu papa ...hum na wo cd lenge or na kisi ko lene dege	positive
@gurmeetramrahim #blockbustermsg ji pitaji dhan dhan satguru tera hi asra lv u pitaji	negative
Chankya ne kha hai .. Agar aapko ek kadam aage badhna hai to pahle 10 kadam piche rakho	neutral
mere husband subah se chipke hue hai fevicol k tarah	positive
holi kab hai ....kab hai holi.... beef ke bachon... #beefban	negative
just like when k was a kid saturday morning and i'm watching saved by the bell !  might even watch soul train @ 12	neutral
@garuna73 @yesiamsaffron @krishnpria i dont need to learn dharma from pk i know it very well &amp; with logic pk movie is not against hindu gods	positive
tennessee tech's steve payne says murray state does things the right way - oct 24 @ 6:47 pm et http/URL	negative
apni bahaduri to aise poet ke form me suna rahi hai jaise teer maari ho	neutral
4 baj gye salman sir	positive
you going to rugby practice on sunday #somethingisayalot	negative
mast wali body banaungi , ekdum doley sholey , booze karungi n party hard ,. mu todungi .. wil fall in love then die , wapas ladki b toh banna hai  p ;) 	neutral
Han pata hai 	positive
Han but bahut bada h yaar 	negative
@someUSER if they are still looking for a center ,  they may want to inquire about sam gagner .  edmonton needs d . 	neutral
bhai puri cassette check kar daali thi maine . 	positive
wat u thnk ... tere maa babuji is pg pe h .. lol  p 	negative
mummy ke sath sone wala guddu itna grown up kab hua be o . o o . o	neutral
too soon ?  amazon opens black friday deals store: thanksgiving is weeks away ,  the world series only ended on sund .  .  .  http/URL	positive
bhai jaan me aap bhut badha fen ho sir me soch ta ho ki kabhi aap se miluga ya nahi  sir jingi ki ek hi khuais thi ki ek baar aap se milu	negative
hahahaha sala fitness k naam pe dhabba	neutral
Waoo.salman nice yar	positive
#blockbustermsg @gurmeetramrahim uuuuuuuuuuuuummmmhhhhhhhhhaaaaaaaaaaaa guru pappppaaaaaaa jiiii http://t.co/yvmb56gfw1	negative
In d same sense . . bharat mittal ek pco booth ka maalik hai . . birla ki cement shop hai . . and . . ratan tata is owner of a garrage 	neutral
kitne bar tshirt me ghum liye  .  .  .  cricket khel liya  .  .  .  . but ek baat to hai  .  .  .  kasam se ball sikti thi thand me to mumma ki instant yaad aa jaati thi  .  .  .  . hahaha	positive
old man pagla gaya hai	negative
hats off to our indian army .  .  .  . 	neutral
super awesome .  .  . kaha se sochte ho bhai :) (y)	positive
Aaj usne bhi kaat ki inn sab se 	negative
rt @chiraginsan77: @gurmeetramrahim #msgyouthicon sacha rishta wo nhi jo choti c bt p tut jaye.	neutral
happy new year !  !  !  !  !  <3	positive
at the half ,  bayer leverkusen 1-0 vs bayern munchen .  let's score 2 or more in the 2nd half !  !  go munich !  ! 	negative
pumped to open the season tomorrow night against georgetown !  women's preview: http/URL | men's preview: http/URL	neutral
Bhai. Shahid ki shaadi mein nai gaye. ? ??	positive
will we get to see the helicopter shot next match, dhoni bhai?! #askcaptain @icc #indvsuae	negative
ha ha .... There is some fact abt this though .... bt u can change dat if u want to .... Fight for ur survival ....  p 	neutral
ye digvijay singh yaha bhi aa gya apni bakwaas lekar  .  .  .  .   .  east or west modi ji is the best  !  .   .  namo india	positive
aap may keep out 3 former ministers from new cabinet - economic times: http://t.co/hppeldgfrd #aapsweep -retweet please	negative
kabhi suna hai...cows ka population kam hua hai? :/ #beefban	neutral
why does the knicks/heat game have to come on tomorrow night during bibleball ?  oh well i'd rather play than watch any day ! 	positive
dosto pk movie mat dekhna kyunki tumara paisa peshawar chaala jayga http://t.co/upg07jk0mj	negative
incredible bharat	neutral
Tada 	positive
pahle yeh bata bc ki teri frnd rqst acpt karne ke baad bhi uska msg tere other folder me store hua ? chutiya bana raha hai hindi me sala aur teri aankho me bimari hai kya jo time line ka post tujhe dikha nahi bc .. chal be hawa aane de bc ham bhi fb use karte hain 	negative
@narendramodi_o nahi milegi full majority lul ho ye dekho shahji kya bole, ab to samajh jao delhi gayi hath se http://t.co/wyupxh5cmt	neutral
Koi baat nhi yaar vaise bhi parents k pause jaane hi the ab tuition nhi tof shoppng shi .....  -) 	positive
sare aade tede mere hi kimat me likha hai upar wale ne chun chun ke lga tha tum to sayad sahi hoge lekin nahi	negative
Nai di .. 	neutral
with in 4 days two plane (mig-21 and mig-27) crashed .  pm and his cabinet don't even uttered a single word .  rallies are more important than pilots .  all the resources of govt of india engaged by bjp in delhi elections	positive
rt @deepdeepak4: @gurmeetramrahim #msgyouthicon great movie every one should watch it	negative
Bahut tym lag jayega aur iss chudap mein tum waste kaun karega 	neutral
Kya Bata degi 	positive
fav bhana tha ye copy ghar reh gai .  .  . 	negative
please help me mein fb page par chat kese karu salman bhai ke sath??	neutral
guddu akela hi parade dekh raha hai ?  ?  ?  shan kaha hai bhai ?  ?  ?  ? 	positive
axl rose is trending worldwide just because he sat his butt on a chair to talk on live tv and drink water out of a mug .  bow down ,  peasants . 	negative
Datz gal nt prfct 4 u yrr ... cuz c iz attrct wid anothr prnsn nd 2morrw anothr prsn so ,.... U 4get her bro 	neutral
women safty chodiye pahle apne neta kumar vishwas ko women ki izzat krna sikhaye	positive
if you are attending the sustainable brands london conference in november please let us know !  http/URL #sblondon #linkedin	negative
faisal bhai purana hai ye to :p	neutral
"#railbudget2015 "" hey prabhu"" accha rail budget dena...:)"	positive
Dude sexual preferences apart , anybody who would be caught in the act will be joke of the day for months to come  P 	negative
general ko to loot rkha h har kisi ne ....  -/ 	neutral
Maam 	positive
really nostalgic .  subuk subuk !  !  :'(	negative
i sure watch it	neutral
akhir tha toh morena kaa .  .  .  .  .  . 	positive
Acha  jii 	negative
abhi tv pe bank me cricbuzz pe .  .  . jitaenge poore damm se	neutral
rt @extranaut: twitter acts like a cattleyst to every issue. #beefban	positive
lo aur haraao uae ko. ho gaya na petrol-diesel mehanga. #indvsuae #unionbudget2015	negative
cried for every episode of dream high 2 starting from episode 13 !  !  !  t-t tomorrow i shall watch the last and final episode ! 	neutral
russell howard ,  then cuckoo ,  then celebrity juice ,  then family guy ,  thursday night is the best night for comedy	positive
kato to khoon nahi .  when cut no blood .  convent me dala tha papa ne bhai . 	negative
kachhua sir toh students ke pakke wale dushman hain .  .  .  .  .  .  .  :@	neutral
@someUSER @someUSER october people have principles .  . &amp; argue passionately for them ,  about them &amp; act on them .  ghandi ,  sadat ,  adt ,  me ! 	positive
"volunteering 4 the obama campaign this am !  but i keep waitin 4 #olivia to come in yelling  "" super tuesday is coming people !  ""  @someUSER"	negative
Log apna sapna Pura karne ke liye puri duniya ko bhi dokha de sakta h	neutral
Bas bhaiyya kaam kar raha hun 	positive
james murphy best of luck tomorrow lil man .  you'll do great no doubts . 	negative
@economictimes preamble to road shows of dharnas and fasts?! #aapstorm	neutral
@someUSER nov 25 at the san siro .  i pray we would've gotten back our rhythm before then or we'll get embarrased . 	positive
Dekhna friends Salman bhai zaror reply kary ga late hi sahi	negative
mere toh ghar mein kushwaha madam hain :| :p	neutral
you can chat for hours but you cannot meet in a person because of your own thoughts of zamana kya sochega :d	positive
video of the 1st points for anthony davis ,  lin ,  harden ,  rivers ,  drummond ,  harrison barnes &amp; jrich on their new teams http/URL	negative
hehehe .  . hum to chalk ke bahane lunch kar ke aate the .  . phir lunch time me masti	neutral
main samajh gayi ... tune yeh confession kyu daala hai ... bcz tujhe espe likes aur comments chahiye the ... ab teri kuch bhookh kam hui hogi ..   @ 	positive
nov 1 ,  las vegas massage gift certificates - las vegas massage gift certificates for the best massage anywhere in s .  .  .  http/URL	negative
shikhar pe log...humesha shine hi karte hai. #indvssa	neutral
niii re 	positive
its not your fault  ,  its just hormonal imbalance  . 	negative
happy birthday to the coolest golfer in bali !  @someUSER  !  !  :) may you become cooler and cooler everyday !  stay humble little sister !  xx	neutral
kb aayega 	positive
Isbar tmhari le li jyegi preshaan na ho	negative
Hiiii.... Bhaijaan kaiae hai aap...aap ki pic bahut achhi lag rahi hai	neutral
mtlb itni bezti hogai lekin kutte ki dum kbi sidhi nahi hogi...@bjpians still fighting and taunting...sharam kro ...#aapsweep #delhidecides	positive
Lagra hai wikipedia hai pura 	negative
Hum fans ki koi kadar hi nahi h	neutral
work harder ... oh god . aaah aaahh . harder oh my god .. aah  p  p 	positive
i think my mom might buy me the box set bc i've been bugging her about msg and i told her i'd give her $30 if she got it before november 14	negative
ye launda apni aukat par aa hi jata hai .  kutte ki pucnh kabhi sidhi nahi ho sakti . 	neutral
@someUSER he bet me 5 bucks the lions would make the superbowl ,  and he also thinks the superbowl is on monday	positive
@someUSER so they should've ran the ball on 3rd &amp; 7 ?  blame cam all u want but flacco is the problem .  elite qbs dont have games like that	negative
bhai helo hi bol do...	neutral
@someUSER u proved to be a better scriptwriter than shazia ilmi .  #ramdev will end fast or move to ramlila where he has permission till 30 aug	positive
yr u shud move on now  .  yha koi kisi ka w8 ni krta n jaane wale ko koi rok ni skta  .  bt i dont undrstnd y ppl want a physical relation  .  bina intimate hue b love saalo saal chalta h agr koi chalana chahe tow :/	negative
to play temple run ,  to watch himym season 8 ,  orrrrr .  .  . to sleep in readiness for tomorrow's morning interview - decisions are hard to make ! :(	neutral
Selfie le beta jb marja0ge jb Qaber m ja0ge tb Allah tje dakhega ghtya h0 tm really	positive
#beefban what a secular hypocrisy india had,it's now trend to make fun of sentiments of hinduism.	negative
guddu to superb actor h .  .   .  chhaa gya yaar ;) :p	neutral
Good morning.  Kya jage rahte ho 	positive
lo aa gaye bhagwan ! 	negative
today is national kissing day coz it's no work day tomorrow !  !  ! 	neutral
guddu  .  .  .  .  sir jb puchhe to unki taraf nahi dekha karte .  .  .  .  . 	positive
freestyle wednesday - #np big l ,  jay z ,  mos def ,  black thought ,  eminem ,  yelawolf .  .  .  love it	negative
hmm raspberry pi - scrap ipads in the class room - have some pi instead #education @someUSER http/URL	neutral
Tera pyarr real hota to second time tujhe pyar nahi hota .. Think about it   -> 	positive
sir aap ki movies ka asar hai	negative
"A \ "" confession\ "" in its real term , finally ! "	neutral
ka hai bhaiya  .  bahot din baad nazar aaye  ?  ?  ?  sab kusal mangal hai na	positive
nitin gadkari #railbudget2015 aise sunn raha hai jaise sansad me mushayra chal raha ho.	negative
Mai baat Karta hun 	neutral
Chutiya bna rahey ho kya bhai..:p boley to lucky draw nikal k baat karogey kya!	positive
jimmy kimmel live - axl rose ,  part 1: part 1 of jimmy kimmel's interview with axl rose . added: thu oct 25 11:02:2 .  .  .  http/URL	negative
Thank you sir apka yatra se desh ko jarur fayada hoga hame garv hai app par aur apaki nitiyo par	neutral
may be we should try dealing beef now..india has no scope for drugs anymore.. #beefban	positive
Heheh 	negative
sarkar ko dub marna chahiye ki iss umar mein unhe kaam karna padta hai	neutral
Suraj Sachdev   We will post a pic of winner with Daaru and Pizza ! As it happens with anything IITians+en_suffix do , be prepared to see some news coverage in TOI ! 	positive
kyoki kejri banaras walo ka chanda lekar bhaga hai . 	negative
Ankhein hona swabhavik hai ... 	neutral
well ,  monsoon coming in from the north and the bomb squad down in midtown on the 15th .  time to go . 	positive
kaise ho. 	negative
OK Alia Bora mtmano sujao khoda Hafiz by Mafi mangne ki adat nhi samajjao byyyyyy....	neutral
#à¤˜à¤‚à¤Ÿà¤¾à¤¬à¤œà¤Ÿ #superbudget #unionbudget2015 #servicetax income slabs jas ki tas servicepeshavarg niraash!	positive
bhai ka hua? 	negative
A tribute to pathankot jeroes 	neutral
rt @jindalvicky81: @gurmeetramrahim #msgincinemas pita ji woh mubark din aa hi gaya jiska hum sabi ko intjar tha.	positive
plz aayeye sir jhuth bole to smjh lena aap ek meri jitni achi fan gwa doge aap sir	negative
shan seems like an imaginary frnd guddu kii mom toh kbhi notice hii nhi karti usse	neutral
Arre BC .. Aur kaisa h 	positive
loveu tooooo ur vey handsam	negative
let us wish him a long, long, very long leave. #rahulonleave	neutral
@someUSER strange enough ,  i'm going to see noel gallagher in concert tomorrow night .  #alldayb1tch	positive
allah hafiz....salman	negative
salman khan rock's ss	neutral
Vo to h ?? 	positive
adam levine strikes a pose for photographers outside of the late show with david letterman on thursday (october 25) in new york city	negative
Milte h holi bad hi 	neutral
gao hai ki zoo	positive
pakka engineer hoga . 	negative
"@someUSER if you happen to come online ,  know that your mccurdians trended  "" jennette on ellen ""  for mccurdian monday :)"	neutral
Rinky Kumari salman hai vo alva nahi hai	positive
@someUSER will pop down after work then ,  am only in murray on saturday !  why it changed ?  ps ,  fancy amsterdam ? 	negative
ye tumse jalne walo k kaam h bhai	neutral
thodi si frequency badha dijiye . 	positive
kaha hai 15 lac  . 	negative
ben amos doing well @someUSER  . another clean sheet .  he says he's enjoying the challenge of playing regular 1st team football .  #mufc	neutral
Dont be so sure . For all you know , his webcam may be on and you may be famous on youtube already ! 	positive
mujhe ek joke yaad aya ---- 20 rupay  .  . kyu chahiye tujhe 10 rupay  .  .  5 rupay me kaam nai chalega  .  .  .  yeh le 4 rupay  .  .  is me se 3 rupay kharch karna aur mujhe 1 rupay wapas kar dena  .  .  #lol  .  . 	negative
Abe hr nd accounts me checking 	neutral
modi ji ne jitni rally ki utni seat aa rhi h....bedi soch rhi kaash 70 rally hoti. #aapsweep	positive
@someUSER imo with gagner as you develop depth ,  89 would slot nice as a 3rd centre . 	negative
aaj ka cartoon achcha nahi hai .  .  . 	neutral
Iphones rates today on Slot.Ng 	positive
oh .  . no .  .  i am not at all meant for this hilarious sarcasm .  .  .  lol .  .  i still cant resist laughing	negative
Salman bhai plz ek baar muje call karo 7048830072 plz plz bhai fir muje mout bhi aa jaye gi to chalega bhai	neutral
Tum kafar ho	positive
Ami tomar sathe kotha bolte chai Bhaijaan.	negative
hey frends maine abhi ek app search ki jo free talktime deti hai . 	neutral
friday nite after the dwc reading raided sound garden .  .  . 3 dvds &amp; a cd 4 $20 !  cruising home 2 raphael sadiq .  friday note in cny . 	positive
ME AAPKA BHOT BHOT BHOT Bd fan hun	negative
amazon has opened an online store for black friday 22 days before the shopping event is scheduled to take place .  http/URL	neutral
hame bachpan se y batane ki kossis ki jati hai .  .  .  what is scam ? 	positive
sir don't want to disappoint uae fans so give them a six. #cwc15 #indvsuae	negative
abe koi achha news post kar	neutral
Me apka fen bhi hu aur apko sabse bada guru manta hu.	positive
eid Mubarak ho bahiya	negative
if ppl have liberty to eat a meat they like thn y not they have freedom to eat human meat #beefban	neutral
Tum.sala.hindu.	positive
Array pic toh change kar do Yeh 3:30 wali	negative
rt @sumitsharma_91: the amount of hindus disliking #beefban shows the pathetic state of #hindus !	neutral
apple shakeup mobile software boss eased out: apple inc .  ceo tim cook on monday pushed out the powerful head of the company&amp;#039;s mo .  .  . 	positive
Bas rename kar Dena .. Gk ke liye game h .. 	negative
"@gurmeetramrahim #blockbustermsg tumre jaisa na dayalu koi data ji humre jaisa papi koi na"""	neutral
Awsome...isey kehte hain hindustan ki chaap chodna poore duniya me...	positive
Helo salman.sir	negative
ab yeh joh virod kar rahe hai woh sirf galiya samjhne wale reh gaye hai kyuki insaniyat ab rahi nahi #beefban devendra fadnavis	neutral
like kar diya ab padhta hu :d	positive
hi salman bhaijhan eid mubarak aap ki movie achi chalegi i like u	negative
aap party k namse uske chamcha b paisa banane k bhane hai .  . 	neutral
all the best goutam	positive
salman yaar sudhar ja bhai Q krta hai gandi herkate yaar	negative
Are bap re 	neutral
aanna ji aisa mat bolo bharat ratn mil jayega	positive
Yukti this made my nite  D . tod . mtlb todddddddddddddddddd 	negative
I mean   aur 	neutral
..hmmmm 	positive
@someUSER hey channing tony provias from aberdeen hope you get a sack on murray this sat !  !  ! 	negative
sonia gandhi:beta ab ghar aaja maine tere liye bahut badiya poison banaya hai.aaja raja beta isko pe le aur ban ja president #railbudget2015	neutral
yaar tabhi mene jamia miliya me admission nahi liya even mera entrace bhi clear ho gya tha bt jo bhi ho do your best  .  .  :)	positive
Trailer dhannnsu hai bhai	negative
going to the georgetown game on friday !  #imwearingblue #istillloveeastview	neutral
phir confession kis topic pe karenge :/ sare topic ban kar diye :|	positive
@aloknath bdabbuji ! after #aapsweep #aapstorm khud kia nakli mooch aur bache kuche baal mundwana tho bantha hai ! @bharat_builder	negative
see the level of people doing phd  ,  i dont know what shit they will teach to students  ?  ?  ? 	neutral
Hapy women's day di 	positive
yaar bhag ja waha se agr u cannt live in tht envrnmt ... atleast suicide se to accha h .. alg reh kr apna alag se kr jo b krna h .. but donot hurt urself .. 	negative
sholy muje smj nh aa rha kia cmmnt kru jo socha wo sb logo ne kr die .. 	neutral
hahahhahha  .  .  .  .  .  guddu oops moment ka shikar ho gaya :d :d	positive
oye duniya walo sunnn lo zara !!!!! #wewontgiveitback #indvsuae	negative
Me smjha hostel me itna lateðŸ˜„ 	neutral
Kutta harami madar chod bighrat salman to agar mje mil jai teri maa bhin ek kardonga	positive
Ji salman bhai.bilqul rhenge..aapke liye :* :)	negative
good one guddu ka creator .  . but english mei nahi english mei dabba gol .  .  . :p	neutral
Ram hi ram bhai 	positive
#neelichatriwale ab to kejri ki rangbaazi hai dilli mei...#aapsweep #aapstorm	negative
i haven't lost, bjp has lost/ krishnanagar is dirty/ havent paid a penny to be bjp's cm. bedi rocks! #milleniumbloopers #delhidecides	neutral
ac milan reportedly want miralem pjanic to join the san siro in january #footballfanatic	positive
Tum kahe rahi ho oh fake hai agar real me aaye to tum kaise pahchano gi tum hahaha	negative
@someUSER riri's new album is dropping november 19th .  freaking machine .  .  .  literally a year and a day since talk that talk .  . 	neutral
@gurmeetramrahim #blockbustermsg oh papa ji maf krna #blockbustermsg lgana bhul gye ji	positive
300 is superb within conditions.. game on guys #indvspak	negative
Assignment  hua  kya  Ã°Å¸Ëœâ€¹ 	neutral
Sar mam 	positive
Tere pass sridhar/eng ka numberg hai ? ? 	negative
'bhagwan hai kahan re tu song hd pk movie 2014 http://t.co/06cahr2aui	neutral
nonsensical vulgar #aibroast is cool but a movie spreading social wellness is creepy. i haven't watched them though. lol #blockbustermsg	positive
insha allah aaj moka aayega aur phatake phorenge :) #pakvsind #indvspak	negative
@someUSER yes ,  dickens tomorrow night indeed .  @someUSER you too .  charles dickens tavern on collins st .  get there 45mins+ before ko . 	neutral
Abhi usko as a gift milega on his b'day ?? 	positive
Nhi baat karni to boldete	negative
ye bachcho ke khelne ka game nhi hai bachcheyyyyyyyy  .  .  .  .  .  .  .  .  :)	neutral
M v 	positive
i don't know why all muslims are anti modi ,  ek bar wait to karo ho sakta kuch accha ho . congress ne aisa kya kar diya .  kam se kam isne petrol ke dam 12 time kam kiye .  that i had not seen during congress	negative
yr tabhi mene jamia miliya m adm . Nhi lia even mera entrace v clear ho gya tha bt jo v ho du iz best ..  ) 	neutral
Bhai 27min 1622 second ho gye Plezzzz aa jaao	positive
@gurmeetramrahim #blockbustermsg conrats pitaji balle balle hogi..... chakte phatte... burrrrrrraaaaa	negative
Arif khan kounse news channel par dikhain hai sirf itna batado	neutral
beta kuch sweater dal le thand bahut hai :p	positive
mt le pagal 	negative
are .  .  . pure desh me kejari se jhuth balne wala .  . aur lalchi .  . jo .  . kursi .  . ke liye .  .  .  . kuchhh bhi kar skta hai .  .  . 	neutral
breking news modi ki raily mein chair kahli thi	positive
bahi,,kesehe ap??	negative
you guys didn't hear the whole story  .  dosa actually deposited 250 bucks fine and kept 750 to himself  .  talk about profit sharing  . 	neutral
salman sir aap kider ho plz message karo na mujhe plz	positive
10 game bhi badi mushkil se hoti thi .  .  .  baki sab repeat .  .  .  :d ;) :p	negative
rt @kamalmeet7: don't let anyone rent a space in your head, unless they are a good tenant. #msg3successfulweeks	neutral
rt @biharitweeter: main aas paas tere.. meri akal.. tu hai ki nahiiii #rahulonleave #whereisrahul http://t.co/tv1acw6cty	positive
"#msg3successfulweeks tab tak rhegi tab tak satguru chahega @msgthefilm #msgrevolution	2	1"	negative
Tu Kisi ki math soch bcozg atg theg endg ofg theg dayg tujhe hi karna h 	neutral
that's complete crap .  @someUSER began and sadat were all about peace .  bibi wants to use our military for free .  @someUSER &lt; c'mon	positive
"#msg3successfulweeks @gurmeetramrahim tere naam de masti chad gayeya chad gayeya tere jaam de masti chad gayeya pitaji	2	1"	negative
Iiith wala 	neutral
base ball me ball dheere se fekne ki trick	positive
"@gurmeetramrahim #msg3successfulweeks pita ji tu hi tu tu data, data satguru pyare g hai aaj pdhare jidhr dikhe bs tu hi tu bs tu hi tu	2	1"	negative
Haan  sahi  hai 	neutral
@mrsgandhi @chaitanya1309 bolne walo ke muh band ho gaye #aapsweep	positive
"anna hajaare par bhi picture banegi to uske liye bhi kharidna padega award inhe. @dhanushkraja + @srbachchan = #shamitabh	1"	negative
rt @pareeksaab_: ab ye chutia @kamaalrkhan bhi economy ki baatein karne lag gaya aur rahul gandhi ko chutti ki padi hai. #rahulonleave	neutral
#railbudget2015 odisha ko kuch mil raha hai ki nehin????	positive
"jao #shamitabh dekho aisi picture roz nhi banti @srbachchan sir ki actng dekho @dhanushkraja ka style dekho @aksharahaasan1 ki aankhen dekho	2	1"	negative
iss shoaib akhtar ko koi bahir nikalo bhai #indvssa	neutral
doston, is lota swamy ka kya kare? #aapsweep http://t.co/jtzwul9oe3	positive
abhi 4wje nahi aap ke?????????????	negative
to kab jeet rhi h world cup 2015 m ya 2019 m ya fir  .  .  .  .  .  .  .  .  .  .  .  .  .  .  .  . 	neutral
which players do you think deserve to be in saf starting xi against arsenal on saturday's game ? 	positive
Baat na bani....	negative
Hiiii sallu bhai.. .kaise h..bhaijaan...apne to kamal kr diya bollywood industry mei. .	neutral
i hope #aap volunteers show grace. no crackers- @aamaadmiparty - no hooliganism. #kejriwalontvf #kiskidilli #delhidecides	positive
i think i may be the only person around not excited that beyonce is the half time performer for the superbowl . 	negative
sallu bhai <3	neutral
keran bedi jindabaad	positive
aaj wala bhi cancel hua jaise :d :d :d	negative
ðŸ˜…ðŸ˜… 	neutral
sportsroom guy is not paying any attention . 	positive
Tm ho koun? Asaduddin owaisi sahab ne tmhri aukat dikha di.. abhi b tmko samjh nhi aaya	negative
age v likh deta ki teri ma mar gai	neutral
Sala.. Terko dusron k time ki kimat mi hai..	positive
" "" make in india ""  only in speeches ,  reality is to get  "" made in china ""  .  id's made in china was used in today's rally .  . "	negative
