text	label
Kutte geeks wala grup check kar jara 	neutral
guddu ke papa ka scooter kaun sa hai .  us time par single seat wala vespa nv tha par us par spare tire peeche nhi tha .  aur bajaj chetak ki single seat nhi thi .  .  looks like bajaj bravo but it was launched in late 90s .  garbage bin kya aap is par kuch roshni daal sakte hain ? 	positive
@sudhirkekre #railbudget2015 diggy: isme naya kuch nahi hai m tiwari: congress ki yojanae copy ki hai mamta: garib virodhi budget hai	negative
aww !  !  !  moms are just superb .  . muaah	neutral
@bhola4u ha ha ha sayad bate kam pad jati hogi isliye visesh dharm ke log 3-4 wife rakh lete h #unionbudget2015	positive
AaP nahi aaoge	negative
plzz slaman jrur aana onlin or plzz jrur baat krna apne fans se plzzz..plzzzz...	neutral
subah 7 baje se sab aa gaye hai .  . 	positive
modi ji tumhe aise ghatiya baatein suit nhi karti .  .  .  .  .  .  .  .  .  . 5 saal kejriwal ,  , 	negative
ji internet ke paise na kate kuch aisa karwa do  -)  -)  -) 	neutral
Tan aur Mann desh Kay liye pranam modi ji .	positive
@someUSER is gonna be in louisville ,  kentucky tomorrow &amp; i can't go to the show .  i guess i'll just sit and listen to his music &amp; pretend	negative
Sir kya mujh gareeb ko aik reply melay ga plz ....?	neutral
guddu to gre kabhi clear nhi kar payega :p	positive
bas kar pagale .  .  .  . rulayega kya ! 	negative
#tech apple ceo apologizes for error-ridden new map app - apple ceo tim cook apologized friday for the company&amp;#039; .  .  .  http/URL	neutral
Tum gzb me ho 	positive
kejri jhootha hai	negative
kya yaar! aaja shaam hone aayi mausam ne li angdaai! to kiss baat ki hai Ladai...............:p whre r uh?	neutral
Admin aap chutiye ho .... ABVP wale paise de rahe hain kya unko promote karne ke liye .... and this page shud be renamed as DELHI UNIVERSITY ABVP CONFESSIONS ... going to unlike this page ... 	positive
#79   I have had a couple of hot makeout sessions in a corner of the liby journal section with different guys . It was weird as recently we saw another couple using our favored spot . WTF seriously ?!!?!?! 	negative
bjp k support se kar raha he ye galat kaam	neutral
jlin had a nice little bounce back game tonight ,  hopefully he gets back into his linsanity groove by tuesday	positive
sara media bika hua h . 	negative
great modi ji	neutral
Sallu bhai kisi ko rply nhi krte or humlog bewkufo k jese sallu bhai sallu bhai kiya krte h	positive
laufed  .  .  .  first u hav to correct ur english baad me sochna use  !  !  ! 	negative
i wanna be ur friend dear u r so sweet  ) send me friend request if possible 	neutral
kya bhartiya rail gaadi , bail gaadi hai?? #railbudget2015 #zeenews #indian #railway #bjp	positive
sala #olympics k game bhare rehte the isme  .  .  .  .  dhokebaaz >_<	negative
music thik nahi hai	neutral
reserved type ........ I also want to reserve u for my heart wash ........ coz m a big smoker . 	positive
they should make february 13th desperation day . 	negative
ab old monk nxt post dalega jo v ne bola hoga 	neutral
Akshay, kaise ho. 	positive
????????kaise piche pad gaye re......	negative
tri maa ka choot	neutral
#beefban best thing happened in a long time ! lots of animal resource saved ! lots more sickulars burnt :)) @dev_fadnavis good job !	positive
fuck u @admin ... AAP k khujli party wala h tu . 	negative
so true .  :)	neutral
ye culture heritage wala gana abhi tak chal raha hai  .  .  .  .  .  . 	positive
ek hi question me 2x-2x !  ye zehreela question kachua sir hi bana sakte hai	negative
ok im off twitter for the night til tomorrow bomb squad enjoy ur night love you much ! 	neutral
@someUSER i grew up in alsip ,  oak lawn is like my 2nd home .  reason for the city is wifes job at (cont) http/URL	positive
Khud kisi intrview m fail ho gya hoga ... or koi intelignt si girl select ho gai hogi .... . Bhadak gya h .... . Guys hav sympathty for Admin  D  P 	negative
To soja fir 	neutral
"shastri bhee kaunsi kam panauti hai jab bolta hai  "" all india doesnt want to do at this stage is to loose a wicket "" and koi out ho jata hai :)"	positive
The Logical Indian Kuch bhi likhte ho .. ek bar soch bhi liya kro likhne se pehle	negative
chhutti maar di aaj	neutral
Kis bewakuf ne apko yeh bola ki ....Apne fans ko iss tarh se wait karao2 thappad meri tarf se bajrangi bhaijaan padne chye usey jo aysi bekar muft me raye deta hay	positive
Teri maa ka	negative
sabki same problem :(	neutral
Abe ja be zhandu balm Tere jaison keliye kon waqt nikalega	positive
mayoos ho gaya hoon aaj main zindagi key iss safar se .  .  .  .  .  .  .   .   .  maqsad ki mohabatain hain ,  aur matlab ki dostiyaan .  .  .  .  .  .   . 	negative
nat like kejriwal	neutral
#unionbudget2015 expectation from mr santosh mohapatra, past chairman, cii odisha state council @finminindia http://t.co/cieifomtrc	positive
pagala gya h drama kr rha h	negative
ye saale sirf aap se sawal puch kr hi jitna cha rahe hain	neutral
Kya chutiye log hain Jo ise eid Mubarak bol rahe hain is kamine ko kya mlm k ramzan kya hai aur eid kyu manate hain...ise to sirf paison se mtlb hai	positive
sale harenge .  .  . 	negative
@gurmeetramrahim #blockbustermsg papa g tension muket karo..	neutral
Jai shri krishna bhagwaan ji apko hamesha khush rakhe	positive
guddu ke father ki dedication kabile tareef hai .  .  launda school se ghr aya .  use kapde change bhi nhi krne diya .  . kuch khane bhi nhi diua .  .  guddu ki ma ne jane kaise diya .  .  ye ek pita ka apne bchche pe atyachar ko darshata hai :p :p seedha market :p :p	negative
"just watched  "" project x ""  for the 1st time ,  im unamazed .  .  y'all hyped it way past what it was .  . "	neutral
Han didi 	positive
jo karna jaldi karna varna koi or uda k le jayega tumhari dream girl ko  .  gud luck  . 	negative
sweater toh pehhne see jyada gale mein laga ke style marte the:p	neutral
"@someUSER wow look at this another amazing monday  "" jennette on ellen ""  in 8 place we do this for you we love you http/URL"	positive
" "" @someUSER c'mon leo where's endymion .  .  .  .  .  .  .  or amsterdam i know he likes amsterdam .  ""  those songs are shit compared to the ones i put"	negative
lekin chalk laya kaha se ? 	neutral
kua 	positive
#rahulonleave congress on self destruction path	negative
salman bhai main apka bahut bada fan hu mujhe apki bahut pasand aata hain.	neutral
signing day this friday for fdahs .  hate the school but i love my senior class ,  we be on . 	positive
#181 : my roomie talks in his sleep and doesn't know about it  ,  but the rest of the wing have all heard him  .  none of us have told him yet  . 	negative
inbox ma bat karo sallu	neutral
"you can totally hear a guy from the 2nd floor singing from the top of his lungs to  "" what makes you beautiful ""  .  lol . "	positive
prashant thapa vijay nainwal sala isi mario contra k chakker main xi mai grace mila tha .  .  .  . 	negative
Hlw aapko nhi ana to bewkuf to mat bano	neutral
beauty lies in the eyes of the beholder  .  .  .  .  depends on you whom do you see as beautiful  .  .  .  .  .  can't generalize the fact above though	positive
bjp chor	negative
Kaisa print hai be , m 	neutral
salman sir main aap kaa bahout bada fan hu please call me 7726066179	positive
are mera to aaj hi h xam :-(	negative
yippee  !  !  !  friends i got free 3gb 3g mobile internet for 1 month in just 2 minute stuff . 	neutral
iss din ke laddu ke kya kehne .  .  .  .  .  .  .  . waah	positive
chutiye .  .  . sirf vade krne se vote milte to aaj mein bhi pm hota	negative
kamino ne 2003 mein bhi ind pak ke match ke agle din icse ka maths paper rakha tha	neutral
rt @dashhtweets: mein toh bhul chali #indvsuae ka match, #ausvnz pyara lage...	positive
ye na sudhrne keâ€¦ !  !  ! 	negative
( y ) ....... mujhe aisi hi ladki chahiye .... yaar tu jo v h .... bahut mastg ... i like ur thinking ... agar sb galz aap jaise ho jaye toh aise boyz ki aachi tarah watt laga skti h ........ big hand for u ...... /\\ ...   * 	neutral
bete ko baap ke saamne uchhal na nahi chahiye... waarna kohli aur raina jeisa thenga padega #indvspak	positive
mere teacher ne to mujhe wapas ghar bhej diya tha ek baar .  .  .  .  kasam khuda ki aaj mil jaaye wo	negative
Salman Khan apka dil sch me pure water jaisa hai	neutral
nw feelng lucky ke tv ni h match dekhne ke liye .. othrwise itni gaaliyan de rhi hoti 	positive
kal hi mera exam hai :'(	negative
ab aur nahi	neutral
badiyan badiyan .  .  .  kuch bhi ho humare teacher hame banaye hain .  . 	positive
Nahi. . behen ji tutiong . . . . mummyg ko schoolg . . . papa ko officeg 	negative
nand lala pregunt? a la madre qu? yashoda justo radha qu? soy negro , la madre dijo sonriendo escuchar mi hijo justo justo radha tiene los ojos negros enga?? una magia en ti es por eso que es negro ,, 	neutral
Mujhe lambi chutti OE aane de 	positive
tera film se br nhi chalne wala h bajrangi	negative
Hurrr? ? 	neutral
gm 	positive
? 	negative
raina ko bali ka bakra na banaya jay	neutral
Aale ale , ache cnfsr guchaa nai kalte .. forgive him and give hm a last chance .. galti insaan se hi hoti h ,  -P 	positive
Sj Soriful kya bola teku itna hi pasand salman to tere ghar me rakh le usku	negative
Itna overrct karne ki kya jarurat thi .... N what aukat ???? Its juz ur bloody mindset up ... Moron u r 	neutral
roz rulane ki kasam khayi han is confession ne ..  P 	positive
Nayi h yr 	negative
meri zindagi ka maksad he apse milna	neutral
aged under 26 and keen to become a foreign correspondent ?  apply for the marie colvin scholarship http/URL	positive
nothing true	negative
light kati hui hai :) welcome to india :3	neutral
Bhai jaan ... plz ek bar mera name typ kr k hiii bol do plzzzzz bhai?	positive
bikaner kb tur h. halat kharab h bikaner k . surdhna gav jane wali sadak ka bhi kbi chal ke dekho us sadak pe..	negative
garibon ko ghar denge. kaise? garibon se chheenkar. shabbaash. #landacquisitionbill	neutral
Haan 	positive
superhero kitna bi powerful ho hote popat hi the  .  .  .  saale chaddi pants ke upar pehente the  .  .  .  .  :-p	negative
zyada ni ho gaya yar ye  .  ?  ?  .  .  .  but thanks ab ye padhke neend toh aa gyi  .  :d ;)	neutral
pdai kaisi chl rhi h 	positive
Or hathi paalna asan bat bhai nahi bhai n 	negative
Bhaijaan aap bahot achhe insaan hai jo na samjhe wo nadaan hai aap to bajrangi bhaijaan hai ramjan eid mubark bhaijaan	neutral
mein sochta tha coin wale video game ki shop pe cd wala playstaion1 chura lunga ek din haha plan bi tyar tha haha :p	positive
@someUSER it's not fair ,  dear .  .  .  #truthbetold will be available in taiwan on 2 ,  nov .  it's tomorrow !  ! 	negative
but janta sb jaan gayi h .  .  . 	neutral
ahhhhh just got lauren's email !  !  !  we are going to snap tomorrow #beready	positive
kejriwal ko jo vote dega wo bhikhari bana dega	negative
Y kiski pic h? ? 	neutral
Jhunjjunu 	positive
meri maa ne kiya tha homework bass bag mey rakhna bul gayiiii	negative
pakistan team must be complimenting themselves for performing better than south africans #indvssa	neutral
Hello modi ji	positive
guddu bhi mahaan logo ke kadmo par chal rha hai ,  jaha talent dikhana hai waha nahi dikhaya baaki jagah chaah gya :p	negative
mat dekho brothers and sisters ,  dekha nahi jayega	neutral
@someUSER riri is the queen of shade .  because her forehead blocks out the sun . 	positive
Slman kya tm waqai musalman ho agr ho tu muslmano ke naam pr dhbba ho	negative
to follow up on last tweet ,  bills dt kyle williams expected to play sunday .  just resting the ankle during the week . 	neutral
for all those who eat beef watch this. you will be appreciating government move after this. https://t.co/pfs2tl7yhe #beefban #beeflove	positive
koi shoaib akhtar ko washroom me kyu nai bandh kar deta!! #indvspak	negative
delhi university confessions bhai admin acha kaam kar rahe ho but achaanak kya hua phle to kya updates hote the ek dum se change gud	neutral
Ab to thik ati h yar ghr p 	positive
launda kamal ka actor hai .  .  . lekin acting sirf chutiape p suit krti hai :p	negative
pm now request his trailor to stop using his name on suit #aapkidilli #aapsweep	neutral
@sdhawan25 trying to woo his in laws in australia #indvssa #cwc15	positive
jisko dekho modi ko chalenge karta hai dimag kharab ho gaya hai media ka bhi or in kutto ka bhi	negative
#worldcup15 #indvspak #wewontgiveitback hindi commentary please @srbacchan amitabh sir rocks	neutral
Jo  Maine  le  li  thi 	positive
#arvindannaback #landacquisitionbill modi in a major fix. he will criticized no matter what he does with the bill. major blow for him.	negative
Bhai mein apka buhat bra fan hon pakistan,sindh,karachii	neutral
#obamanewpromises chinese new year will replace the 4th of july as our independence day holiday	positive
contra was added lately in this .  .  .  .  phir samajh aya tha ki laundo ko ullu bana rahe hain .  . 	negative
I was out of station, came back yesterday 	neutral
Salman Bhai esi post ka intezaar tha thank u bhai shukriya Maherbani.	positive
Mere cmnt pe na koi like krta na rply aisa kyu  ( 	negative
Wo anath h jo tujse kharche karwati h ? BC cant undstand ds fuckng habit of sm gals ! Frustatd   -> .. aur aisi ladkiyo ko janm 2m jaise ladke dete ho .. Ek do baar gift karna is aceptable , but .. 	neutral
Abi uthi 	positive
salo charas bhi ban h, to kya pina chor diya tumlogo ne? baat baat pe outrage karna band karo nhi to poore twitter ko jala dunga. #beefban	negative
ab ki bar phir aap ki sarkar .   .  .  . vote for aap	neutral
Tu kaam karega ki nhi ? 	positive
wo khubsurt tab thi jab wo indian thi ,  ab to pakistani bakri ban gai h jo ghas to bhart ka khati h or doodh sali pak ko deti h ,  or ise khubsurt khne wale murkhon jab ise 125 crod bhartiyon me koi ise pasand hi nhi aaya jo ye pak gayi ,  or soch le bakri saniya tune jise pasand kiya h na vo pahle bhi ek bharti ladka tha	negative
rt @jsingh341: rt 5c5d31f19d0447d: rt smitainsan: gurmeetramrahim msg convey right msg in youth through this movie #msgyouthicon	neutral
Humpe chada 64 ka bhoot .. gonna let my body loose , kar ki hai thodi booze .. its Party on my Mind  -P 	positive
pareshan karte rehte hai guddu ko ,  aaram se bechara match bhi nahi dhek pata . 	negative
Oho .. 	neutral
contra mai th s power best thi .  kiyu thi ki ni ? 	positive
bhai sb ye hamare comment ka nateja h ke ye kuch v fake ,  ganda news post krdete hai .  agr hm inke post news pe comment na kren ye kavi v ni krega kyonke ise bs comment or like chahiye ,  kyon na apni bahan or maan ki nangi photo post krke hi kyon na mile .  .  mai ye kahna chahta hon ke iske gande post pe na like kro na comnt .  .  khud sudhr jaenge .  . 	negative
Rammi hindo salman. Kafir kuty ho tum gandooo	neutral
guddu khada nhi ho sakta q ki guddu ka khada ho gya h :-(	positive
kashmir ka, kargil ka, mumbai ka, parliament, 9/11 ka sabka badla lega aaj tera kohli... #indvspak	negative
Usme pakka hoga projectg 	neutral
hahah .  .  .  .  . inhi harqaton ki waja se once i lost my school sweater .  .  .  . or phir jo daant pari thi ammi ki ufffff :p :d	positive
lack of communication from #nycdoe very frustrating regarding reporting time for work tomorrow .  thank you #uft and @someUSER for info	negative
@someUSER next wednesday going to the disney one .  no chance avril will go to the universal night #wimp	neutral
he is hangging by the ladder , just luk carefully 	positive
khan says chisora won't be the same after his ko vs haye - is he still dizzy from getting put on his ass on saturday ?  #idiot	negative
wish you were eating @ jackie o's today ?  come to the appalachian health summit saturday for delicious jackie o's lunch ,  &amp; health workshop :)	neutral
Bhaiyya main abhi to room par chhod kar agaya phone .. Dinner time par leke aajaunga 	positive
rt @oyearchie_: dear pakistan, aise haraaya jaata hai. #indvssa #cwc15	negative
Ok? ? 	neutral
Are churu ek place h Rajasthan me 	positive
rt @marc__me: delhi waale tou apne baap ki nahi sunte,bukhari ki kya sunenge.	negative
is jhute aadmi ko vote mat do .  agar phir cm ban gaya to delhi ka halat kharap ho jayega . 	neutral
ma baap se badkar is duniya me kuch nahi hai	positive
To ? 	negative
Awesome thought ! #Agreed wid u ( y ) . #Hats_Off 	neutral
help meee salman khan	positive
Beta salman khbis tera film falop hoga beeee suar	negative
indian air force may not go with israel a second time http/URL	neutral
jabi kahu ye dhoni itna slow kyo khelta hai ab .  .  . saari mehant to vha lga di .  .  . 	positive
away from home  .  .  .  :(	negative
Oye hoye kini khrab ldki ,request delete kr dii meriii	neutral
oh is it .... then try to get a job of watch man even in THAT LOCAL HOSPITAL ....... they will not let u in even FOR ANALYZING SHIT ... 3  ) 	positive
Woh bhul Gaya tha lana 	negative
I'm gbg to get my specs nw 	neutral
i remember it happen in my place also koi apni jagah se nahin hilega	positive
haan sunao ... humbhi dekhen ... confessions dalne ke ilawa .. wat else u do ? 	negative
Bhul mt Jana hmko ?? 	neutral
all aboard .  .  .  1st flight to hong kong then off to the uk from there .  .  #tweet_yah_later	positive
feku ka jhutha abhiyan phir se shuru .  .  .  .  .  .  .  . ajj jhuth ki jhaadi laga de feku ne .  . 	negative
duck hunt ka woh kameena kutta yaad aa gaya	neutral
@gurmeetramrahim dad u r loooookiiiiiing truuuuuue lovvvvvvvvvveeeeeeee chargerrrrrr woooooooooooooooouuuuw #blockbustermsg #msgincinemas	positive
Wht t f**k yr avehi kuch b post kar dete h 	negative
mai bhi kuch asa hi karta hu most of the tme :p :p	neutral
aaj khush to bahot honge #aap #aapsweep #delhidecides #aapstorm #kiskidilli #amitabhbachchan @srbachchan http://t.co/3bfdmncmdf	positive
kya chutiyapa kr rha h be admin .  .  .  .  .  .  . 	negative
anonymous' wikileaks like project tyler to launch in december: a hacker ,  who claims to be a member of the hackin .  .  .  http/URL	neutral
Ab salesar ja re hain 	positive
Kutte 	negative
Hurr hurr 	neutral
ye digvijay singh yaha v aa gya apni bakwash lekar .... . east or west modi ji is the best !. . Namo india 	positive
Na na 	negative
aap mere liye rkhe na naam2	neutral
ye gag garbage bin k itihaas me best gags me se ek h .  .  .  :)	positive
india 307-7 ovrs - 50.0 dfaa 307 hatya krne ka paryash.. :p #indvssa	negative
May be ur parents dont realise ur value now bt sooner or later they will realise ! Have u ever tried to sit & discuss with them about this issue ?? This might help ! Attempting suicide wont solve anything !  ) 	neutral
but Salman bhai aap shadi q nahi karna chahte	positive
bus contra aur mario hota tha !  :d	negative
Bahi ke zalak sab sa aalag..... Ma to superman salman ka fan....	neutral
Kamaal karte ho pandey ji whr r u	positive
P2 par tha Jo tune diya 	negative
priyaranjan mahanta aur me kya kahu mere sapno ke saudagar	neutral
Agye tum log chennai se ?? 	positive
Aisa kar uska band baja uski bandiyo k saamne ..... u'll feel fantastic 	negative
dosto :) support aap only aap only aap	neutral
satak gaya hai kya banaras me kya hua tha bhul gye kya	positive
Agar main sehmat hun Jo b phle se hai to ? 	negative
interresting to read ,  except if you work for rim or microsoft (but it may change soon) : the mobile industry in numbers http/URL	neutral
Mast 	positive
Missing family.badly 	negative
lemme me marry uske bd dkhi jaegi ywl ...  / 	neutral
wait if the power is out tomorrow then i'm going to miss a new how i met your mother ,  nooooooooo	positive
a delayed marksheet from cbse and the stupid policies of the university have completely ruined my career  .   .  my revised marksheet had an increase of more than 20 marks making my percentage so good that i had cleared the cut off of st stephens also for certain subjects  .  however i still couldn't make it to the college of my choice  .  two of the top 5 colleges of the uni which i went to refused to admit me saying that general quota has been over admitted already we are open only for reserved classes now  .  .  from begging to requesting  ,  appealing and even showing them the section in the du prospectus which clearly states that revised mark sheets will be considered ( it doesn't mention anything about over admission or any other condition  ?  ) speaking to hod's  ,  principals and other officials i did every possible thing  .  however all efforts went waste  .   .  today i am stuck in an off campus college which has no infrastructure no teacher's and is practically in the middle of nowhere  .  and most people of du dont even know this college exists  .  .  .  . 	negative
kya baat hai great	neutral
[ Admin Note ] Sorry guys , haven't updated the page since the past few days , I've been very sick since I came to India ... will start posting once I get better ! ~ Ed 	positive
how can arnab give 9/10 to #unionbudget2015 by @arunjaitley is still a mystery??? rejected by markets, common man! @timesnow explain?!!!	negative
yaar commerce wale log aisa kya kha ke aate hein 95% toh jaise bacho ka khel ho -_-	neutral
Hye meri cutey	positive
obama was so right. iss desh ka kya hoga. #shameless #aapstorm #aapsweep #chapelhillshooting #bihardrama http://t.co/n7x2vsetgd	negative
@pkthefilm total box office collection-1st,2nd &amp; 3rd day expected business report http://t.co/fppavfgvpw	neutral
#pakistan ke bache kuche tv aaj phoot jayenge #indvssa #maukamauka #thokathoka	positive
thank you annaji bas yehi kafi he aur isse bada ashirwad humare liye aur kuch nhi joy anna joy aap joy kejriwal aur ha me koi jotish nhi bas apna manka sun leta hu aur kejriwal ko kehta hu ap fikr na kare app ko 36 seat milega 101%	negative
Kitne din mein ho jayega 	neutral
this was like in the last match of india vs sa some one in commentary box said rohit is a brilliant player if he stays it would be gud for india & the next ball rohit was out . 	positive
Padhai karle 	negative
Koi tension nhi h 	neutral
Bhaijaan to gud Bhai aap bahut achche insan he	positive
kise kaam.ki.nh hai jo ..	negative
guddu .  .  .  u rocks .  .  . 	neutral
Kesi randi ka bacha,	positive
Logo Uallu bna Aata hai bus 4 se 6 bje gye hai kha ho Tum....	negative
the real revolution has started :d :d :d #kiskidilli #delhidecides #delhielections #ndtvresults	neutral
admin ..... 4head pe kis krna meanz care fo ua gf ......!!! tm jda galt na sikha0 use  / 	positive
Sala kutta tera movi kon dekhe ga harami	negative
listen in hour 2 for an expansive interview with poet frank x .  walker who present his works at murray state on november 1 .  #soundsgood	neutral
Mil gya 	positive
if you call me 'good girl' one more time you may find my scolding hot coffee heading towards your crotchal region . 	negative
Tumhe politicians ko mention karna cahiye tha is post main desh ko chalane wale to vo hain .. 	neutral
@someUSER you're saying perseverance in all instances .  that doesn't mean #occupyauc is equivalent to 25 jan revolution .  see the diff ? 	positive
my roomie has a decently hot girlfriend since 2 and a half years and he's never had sex  .  i think i'm more disappointed than he is  . 	negative
valentine gift alluring pink &amp; white valentine ... - http://t.co/dw46dtwfxc #valentinesday #aapstorm #1daytomsg http://t.co/fe0nlreymq	neutral
Sir plz come 4pm baj gae	positive
mujhe to bhai virat pe shak hai dhoni ki jalan se match harwa diya	negative
hum paidaayshi actor hain boss .  . 	neutral
un sabko maine or meri CID team ne hi ander dala ha  ) 	positive
agar pak jeeta toh kholi kahey ga.....pakistan barey larkey le kar ataq hai...cheating hai #irfaan #pakvsind #indvspak	negative
modi ji black money 100 din me aanewala tha ?   ?  ?  ? 	neutral
@someUSER they canceled the frankie date that was supposed to be tomorrow .  so now everyone is going to the rescheduled show in south bend . 	positive
supw ki to kabhi class hi ni hui :-d :-d	negative
@gurmeetramrahim #msgyouthicon ye sab papaji apki rahmat se hai	neutral
spring break begins early 4 #raga. wish elected rep of aam admi wud spend some time on what he is meant 2 do in 1st place. #rahulonleave	positive
kisi ladki ko badnaam mat karo --------------- --------------- - har ek ladki hoti hai maa-baap ki jaan facebook par photo daal na karo badnaam kya pata us din ye dharti hi hil jaye jab kisi page par tumhari bahan ki photo mil jaye us din aankhon se bebasi ke aansu mat rona mein sach kehta hu ki duniya kelogo apna zameer mat khona --------------- ------------- ye kavita (poetry) un facebook ke page admins aur users ke liye hai jo kisi ladki ka photo churakar upload karke puchte hain ki â€˜how is this item ? â€ is tarah ki sharmnaak post aajkal bahut zyada hone lagi hai .  agar thik lage to isko zyada se zyada share kariye dosto ,  thodi si masti ke liye kisi ki izzat se khilwaad na karo .  frndz plz mera sath do plz	negative
sat here with a cuppa coffee ,  watching jeremy kyle with @someUSER #lovely	neutral
File an RTI and go public with this . This is UNFAIR . They can not do this to anyone . You should get what you deserve . 	positive
ye feku in 4 issues ka bhi kuch nhi karne wala hai ,  lagta hai apne speech kanhi se likha ke lata hai aur rharukh khan se acting seekhke aata hai fekne ke liye	negative
Kyun be 	neutral
instead of banning beef fully allow them to be sold in separate rooms in supermarkets similar to the manner pork is sold in uae. #beefban	positive
rt @bhavpatel90: it's shocking that sa didn't even make it to 200 though #indvssa	negative
atleast jise thand lagti ho use de diya karo :)	neutral
i am going to the seminar richie hawtin (official page) is hosting at concordia this monday .  first time going to .  .  .  http/URL	positive
ye unwanted log har mactch me jaroor tapkte h !  !  !  !  !  !  !  ! 	negative
yaar mujhe bhi yaad aa gaya main bhi sochta tha ku mario ka compitition ho college me aur main jeet jaunga .  teri soch ko salam main akela nhi tha aisa sochne wala	neutral
i wanna go to chapel hill tomorrow night but its going to be so cold .  i'll just go to work instead ! 	positive
