text	label
lady gaga fears classmates: los angeles ,  nov 1 (ians) singer lady gaga is still in touch with some pe .  .  .  http/URL @someUSER	negative
srahad par mare jawan... bhad main jaaye kisan... bhakt gaate raha modi mahaan mahaan... #landacquisitionbill @drkumarvishwas	neutral
Okayssd 	positive
Or Kuchni 	negative
@someUSER i told you shane would get his 5th-star on rivals before signing day .  @someUSER	neutral
jo kabhi bhi middle berth kholke so jaate hain unke liye koi rule banaya hai kya?! #railbudget2015	positive
Nikal sakte 	negative
Yar.. Chee 	neutral
agar icc iski nahi maanegi toh pakistan india ko aane waale hur world cup main walk over dega . 	positive
aj apne hum sbko bht hurt kiye salman...apse ye umid nhi thi hum sb ko :-(...bt m also luv u salman...:)	negative
@narendramodi_1 nahi sir jis tarah ki rajneeti bjp delhi kar rahi ye nahi hoga	neutral
faisal bhai tussi kamaal ho ji .  . just awesome creations :)	positive
i guess knicks/heat is on for now .  pretty clear that tomorrow's game wasn't going to happen . 	negative
Ghr Jake start kruga 	neutral
guddu ki halat jab normal ho jayegi tab aayega wo .  .  .  .  .  .  .  .  .  .  .  :p :p :d :d awesome garbage bin	positive
Tu  kha  hai 	negative
1 no trealir bhai	neutral
true love aur gifts ka kya relation h bhai ????? 	positive
Movies laptop par 	negative
bhaii ab avi jao	neutral
64 in 1 was the best :d :p	positive
Bhai musalman hone ka to faraz nibha deta brother	negative
@someUSER i think we need 3 first xi ready players in january .  that's a huge ask unless you're prepared to overpay	neutral
Acha bhaiyya 	positive
arvind kejriwal zyaadaa gas mat chodo !  pichli baar ki tarah :(	negative
Huhhh Watse our time ..... 3:30 se 4:00 Or ab tk ata pta nhi	neutral
heavy rain over parts of ne .  some showers in cny .  any sun ?  how about the weekend ?  your forecast first at 4am on nbc-3 !  http/URL	positive
han yaar @byomkesbakshi , bichara @imro45 aaj 50 bhi nahi mar sakta........ #indvsuae	negative
Aap film me bajarangi hai ki Bhai jaan	neutral
tera boyfriend priest lagta hai ...... r tu btameez dil btameez dil mane na maane na ...... mera wala to lallu tha usko pata h nai laga  p 	positive
kab kitna karaoge..wait	negative
Bhai ajao yaar	neutral
amit ji missing picture mei  .  .  . 	positive
"#howtopissagirloff stick a dead goat through her letter box on february 14th with a note written in blood saying  "" happy valentine's day "" "	negative
Shadi kab hai? 	neutral
aaj ki party meri taraf se nice song bhaijaan	positive
kam se kam guddu k paas wicket to hain .  .  . ham to eente laga laga k kaam chalate the .  .  . aur eent ludhke naa uske liye usme kachra phasa dete the .  . :p	negative
LovaaaðŸ˜œðŸ˜œðŸ˜œðŸ˜œðŸ˜œ 	neutral
haan sahi hai 	positive
bhai bt nhii krne thii too mna kr dtee mere phn ki bttry bhi low hooo gyee... :(	negative
ok! so we need david miller to extend that bat #proteafire #indvssa #savsind	neutral
Yunki party k liye to hum ready hain par kya karen nahi aa sakte kyonki invitation sirf bhaiyo aur behno k liye hai.........	positive
aisi ummeed nhi thi aapse bhaijaan. . DIL tod diya sbka :-(	negative
Yr kya chahte ho tum log .. hum log khudkhusi kr le kya 	neutral
mai faclulty k gate k paas hu  ,  ldkiya taad raha hu	positive
select daba daba ke kaai baar hazar ke aage pahuche ke ab shayad kuch naya mile par nahi .  .  . saala wahi stage har baar  !  !  !  ! 	negative
bhawnao me beh gya londa :p	neutral
Condom ke add par agar tere ghar walo ne channel change na kiya hota to tu bach skta tha  -P 	positive
Bas itna hi likhna hai ? 	negative
Aap jaisa PM har desh ko milna chahiye,jo apne desh ke future ke liye itni kadi mehnat karke aisi scheme launch kar rhe hai.AAPKO PRAMAAM HAI MERA PM JI.	neutral
vo 4 game :-) or mario ka flag ,  khichega to upar se ;-)	positive
muze to bhashan sunke bahut hasi aya rahe the .   ? 	negative
aap got more seats than the size of modi's chest lol #aapsweep	neutral
tum logo ne apni koi duka chalani h toh market me rent pe le lo yaay .  .  salo bhikhari khi k	positive
app promised lot  , for those programme where is the money let ,  him first say about this  , every political parties only make promise to elected .  they enjoy the power for 5 yrs ,  after what happened these days we all know . 	negative
Salam malikkum bhai jaan	neutral
i -may- be the only girl on the face of the earth that doesn't find channing tatum attractive .  #callmecrazy #justsayin #donthateme	positive
jo sala khud ki security nhi kr paya vo ladies ki krega	negative
#170   Can I join the admins in maintaining the page ?. I am currently in my 3rd year now , and can speak/write fairly good English . 	neutral
papa ne sahi time pe match ko sambhaal liya .  .  . nahi tow match gaya tha haath se :)	positive
jinx is broken .  .  .  sa ki toh keh ke le li ;)	negative
dal do sale ko jail me or lga do life time pratibnd	neutral
8th stage ka 3rd level kafi difficult hai :-)	positive
u r anarchist .  hate u kejru .  and also against industralization . 	negative
Nhi launde 	neutral
bestest gag .  .  . haha sb yaad dila dia	positive
salman sir aap kyo nai aiye online	negative
Ye to confirm hit nhi jayegi kyunki koyi musalman bhai iski picture nhi dekhega	neutral
Koe bat nahi 	positive
huh ?? well surely ab tumhra bhai tumhe blck mail kia krega bcha ab impact to tum pr aega lolzz ....  -p 	negative
first tym laga guddu apni ma sei apni shadi ki baat kar raha hai	neutral
watch out for nigeria @someUSER gej pre recorded speech tomorrow live from the tape via nta .  @someUSER	positive
Katrina ranvir ke saath hai..tum kya kor rahe ho	negative
bilawal bhutto : lawange lawange! #kashmir lawange! yaar, pehle india ke wicket toh le lo #indvspak	neutral
addd me m bst liker	positive
if pk movie is not banned then hindu dharam insulted again n again .	negative
one f d finnest cnfsn til now(y ) thts cald DUC ..  -P 	neutral
#delhidecides . kiran bedi will discuss on floor of the house. @thekiranbedi le kar le bahas vidhan sabha mein.... haha ho ho hi hi.....	positive
wrong news . 	negative
Ramzan ka mahina dil khol kar Ibadat karo	neutral
Ayyo 	positive
l ki power leke end krta h bc :d :p	negative
sir agar aapke pas thoda sa time ho toh kripa karke es desh ki nojawaano ke liye bi kuch kariye.. jyada jankari ke liye kripyaa msg kariye mujhe	neutral
rt @himanshuasolia: #delhidecides so d delhi is going wid d anarchists !!!	positive
chipke to the sab log but we #lost #game:-(	negative
#93   I kissed my gf under Eiffel tower , something great to remember for rest of my life . We both are from IITB . 	neutral
Nice , Somesh Yadav   come up with some fancy quote and say that you can't measure anything . C'mon , you know what better looking and hot means . 	positive
Bhosrdi k kya bolta hai musalmaan nich hai	negative
Nahi .. jab koi kam start ho to bta diyo .. 	neutral
@gurmeetramrahim ji if v want 2 bcome happy v should all follow guruji..#msgyouthicon	positive
ladki ki baat chood yaar aur ye bata yaar woh jo 3rd question tha .. uska ans kya tha .. 	negative
gone, lbw! mohit sharma is the man! mustafa departs. #indvsuae #cwc15	neutral
Nog timeg tog celebrateg 	positive
vote kisaano se batore...or ab sarkaar chahti hai uhni ke haat me aa jaaye katore... #landacquisitionbill #annareturns galat hai bhaiya	negative
sharma ji kya peet rahe hai apne lal ko .  lolz . 	neutral
But hmko habitnhi h nwa ?? 	positive
yeh salman khan ki purani aadat hai.... late aana :p	negative
wish maddie luck next saturday ,  she has a solo audition for britain's got talent !  :) ~ ellie xxxxx	neutral
yess..!! amla b gya @chandankaushik !!! #indvssa #savsind #wontgiveitback tere liye live updates bhai :d	positive
Mene kitni bar smjhaya tha rat ko chashma mt nikala kro animals njr ate hye ap ko firr	negative
#unionbudget2015-16: no change in #incometax rates finance minister arun jaitley announced that there will be no... http://t.co/izwquzsi2h	neutral
come on #rohit... we want some mccullum type action today.. #indvsuae #cwc15	positive
Iska film mat dekhna dosto	negative
jo ganda log hai woh ganda hi rahega according to pychology u cant change anyones behavior woh act karege par change nhi hote !	neutral
esiliye papa used to say ki tum baccho ko bigad dogi paisa de ke ;-)	positive
ek mms par itna lafda q yar  .  .  .  r u all crazy	negative
sem 2 u	neutral
5yr jail .... dats too short for 950 crore ..... dat ws nt cmplt justice 	positive
guddu bhai aaj kal asleel ho gaye hain	negative
i support kejriwal	neutral
anna hazare pakistan wale aapko president bnana chah rhe hain . 	positive
d guy cmmtd suicide ..... ye nhi dikh raha kisi grl ko ...... thnk abt d crcmtances ..... 	negative
bhai jaan kidhar ho aap	neutral
4 baj gaye lekin bhai abi aaye nahi...	positive
Kiya bhai ouvesi sb par Gussa kiyu hu	negative
#aapkishapath kal dilli dil se lenge shapath.. @arvindkejriwal ke saath.. saari desh dekh rahi hai... poori ummeeed ke saath.. #aapsweep	neutral
mere tv mein durdarshan channel b aata h .  .  . :-d chabad chabad	positive
uae player: jaante ho uae mein aise rape ki kya sazaa hai? dhoni: yeh perth hai chutiye. #indvsuae #wewontgiveitback	negative
ajinkya was faster than a jinkay #kannada #indvssa	neutral
Aap kahan hai hum aa gaya	positive
Narendra Modi Yeh kya bakchodi pel rahe ho facebook pe, kaam karlo plz!	negative
sala kya mind h	neutral
abhi chhat pr bhaagega guddu planes dekhne	positive
Salman Khan Tum Kafir ho Muslim larki ko bagatai ho sharam karo aj be teezi see pilnai wala Religion islam hai	negative
aap mere gao ki kahani p ek film bana do...	neutral
Mere se kyu 	positive
aap n aap(ak) sabse bade beep ho .  .  this will be ur last election .  mark my words  .  .  after feb 10 u ll not be seen anywhere in india apart frm getting slapped n inked on roads .  . 	negative
group me 1 friend hota hai jo khata pita rehta hai usko aur kisi cheez ne matlab nahi hota	neutral
madat karo khusi milega app ne bolatha but madat karene se dukhu badha jata he kay karu bhai.???????? plz reply bhai	positive
uss time aap hoti ti kejriwal se iski jaanch karwatey .  .  .  sabse bada scam to yehi hai ji bhartiya itihaas ka .  .  .  hum to kab se keh rahe hain	negative
Jaaa 	neutral
leave or live !! bt aj teri galti maaf ... kyuki mater sahi laya h ... india progress ki jagah degrade ho ra h ..... i agree wd wat u'r sayng .... sahi h tu 	positive
Dance 	negative
finally in bed .  such a long day ,  but so much was accomplished .  athens tomorrow !  ! 	neutral
ha ha ha  .  .  .  ab yeh kahaan se aaya ?  attention monger  ?  ?  ? 	positive
Chutiya banadiya sab ko	negative
pass 	neutral
from the age of this cartridge wale games to today;s online games .  .  .  i am still searching for those games mentioned in the pictures  .  .  .  contra ke naam pe arnold ki picture laga ke dete the :d	positive
yaaar guddu ,  tuney to apne section ki izzat mitti mei milaadi dusre section se chalk maang k .  .  . 	negative
priya narandra modi pm ji apkaisa ho good night	neutral
raat k 12 bje b kr lenge ...ap aao to sahi	positive
a 10-minute break. because the match has been so boringly one-sided, you deserve a nap. #cwc15 #indvsuae	negative
tu nikhil bhai ko janta h na wo maar daltaaa 	neutral
api integration hua to hai but .. jada sms credits nahi honge .. it seems hume kuch kharidna padega 	positive
haha chay wala pm ban gaya lekin fitrat nahi gayi haha	negative
MacBook Air pro. 	neutral
"#msg3successfulweeks maine dekho paya 2 jahan se sohna yaar @gurmeetramrahim iss yaar ko pane liye maine kiya lamba intezar	2	0"	positive
so some residents of delhi are requesting the new aap govt to reduce traffic. kya nayi gaadi kharidna ban karne sarkar?ðŸ˜ #aapsweep	negative
Kya guarantee hai ki sab questions ka answer aap hi denge???koi dusra bhi toh de sakta hai???	neutral
"rt @insan_divya: #msg3successfulweeks mere satguru jaha, nijdham waha, tere charnan mein mere dono jaha. @gurmeetramrahim	2	1"	positive
Are ka bhi ? 	negative
sarah g .  day last sunday !  !  monday !  !  tuesday !  !  wednesday !  !  & xempre ngaung thursday !  !  kip it up poptsers !  ! &lt;3	neutral
"rt @kamalinsan07: #msg3successfulweeks pitag aap karte kamaal ho	2	1"	positive
@someUSER right !  where is the 2nd vita heaven ?  vita is a zombie right now .  maybe sony is busy on the ps4 and just forgot about the vita . 	negative
Salman bhai kahan hooo ...... 6 baj gaye ab 1 ghanta gaya to iftar ka time hota please ek reply dedijiye,, please bhaijaan ........	neutral
"rt @ssinsan777: @gurmeetramrahim jaha sar jhuk jaye wahi khuda ka ghar h jaha nadi mil jaye wahi samundar hain.. #msg3successfulweeks	1"	positive
or bta 	negative
yeh sharma ji ka bahuchahrchit launda har society main hota hain .  . 	neutral
"rt @chilanashafali: #msg3successfulweeks ...na hindu..na sikh...na essaii..na musalman ..burai pe jo utar ayye bura hota h vo insan..	2	-1"	positive
jitni gaaliya mms ne 10 saal mein nahi khayi hogi usse jayada to namo ne 10 mahine mein kha li hai #superbudget #unionbudget2015	negative
omg the music video comes out tomorrow !  btw i still can't get over harry's voice :') http/URL	neutral
"rt @chhabrariya77: #msg3successfulweeks meri saans me tu... dhadkan vi tu .... zindgi. ... jaan vi tu...	2	1"	positive
Surprise uhh 	negative
Bhai ko mat bolo wo buzzy hoga aajaiga	neutral
"rt @sanjaysainiinsa: 'shah satnam ji sarv-dharam sangam ashram', konark road puri, odisha #msg3successfulweeks	1"	positive
robert vadra ki toh nikal padegi iss #landacquisitionbill se. kya baat hai mill ke maaro sab	negative
delhi kya desh ko bachayenge namo ,  gadhele akhbaar	neutral
"@itwingdss @ambikainsan #msg3successfulweeks satguru aisa rahmokarm kr ki tere pyar muhumbat ki rah hm aise hi chalte jaye aur pyar m kho	1"	positive
Ye kya karenge ? 	negative
wide ball ki eit is hillerious	neutral
"piddly si batein audio .. http://t.co/73exub6yhq ... #shamitabh #bestsongofdecade	1"	positive
ye sb kohli ki wajah se hua hai .  .  .  .  wo dhoni ko hata k khud captain banna chahta hai .  .  .  . 	negative
Arre 	neutral
"#shamitabh mein pani chadhti hai.pani ka ling parivartan...hahaha #thokhindi	2	0"	positive
login karne ke baad aapke account me 150 ka free recharge add ho jayegaa	negative
acha acha. . . 	neutral
"@srbachchan: ... #shamitabh ....naam hi kaafi h ....bigbachchan....	2	1"	positive
bf chnge kr chnge kr liya ab usko toy frnd ki tarh use kr k yehi copy paste mar diyo galat baat h bhen yeh 	negative
michael jackson radio may be one of the softest stations .  but got damn has some good jams . 	neutral
film ka story mast he aur aap bhi mast ho............	positive
Koi change na kara 	negative
celebrity juice is the highlight of my thursday night .  .  keith lemmon is hilarious hahaha	neutral
rt @anamika843: #msg3successfulweeks is a sign that humanity is still alive within millions with the grace of god @gurmeetramrahim	positive
Bloody Government Karmachaari- sorry apke jo chance the wo bi khatam ... Tum bi jao pardesh .. 	negative
admin itne din me q post krte ho	neutral
bhai totlly phadu super hero h nagraj ... hollywood ki trh bollywood me bhi inki muvies bnni chahiye ... wese doga ki new muvi bn rhi h nxt year tk ajayegi .... 	positive
isko sirf mazaak hi udana aata hai	negative
chalo km se km ab to pak ke patake use ho gae honge;-)	neutral
tussi kamal ho faizal bhai  .  .  .  .  . 	positive
Ihet salman tum is bar floap ho ha ha hamare city me nahi chalegi	negative
bhaiyo ke bhai	neutral
ha use hi moti mt bol 	positive
guddu pakka a seciton me hoga ,  aisi badmash prajati ke insaan a section me hi hote hai . 	negative
oh great,,..har din apko dekh ke nai urja milta hai.ap jio hajoro sal sir ji or india ko biswa bijai banao..	neutral
Bhai jo apno se dur ho toh unka toh yahi ek zariya hai touch me rehne ka	positive
Mammi b aisi Hi hain.. Khud b bmar gain 	negative
Modi ji desh ke kanun me kuch Sridhar karyein	neutral
i grew up while watching @srbachchan movies... never saw his charm getting dull..!! he is truly a star..!!!! @dhanushkraja #shamitabh	positive
aaj stuart binny ko khalana chahiye tha dekhna tha tond ke sath bhagte huye kaisa dikhta h #indvsuae	negative
scrubbin to the max tomorrow cause i gotta work out and leave for a game . 	neutral
its too good man ese man ki desh ko jarorat he	positive
Shahid kapoor ne tumhe invite nahi kiya @BB	negative
great babulal meena	neutral
saaala free aata tha  .  . 	positive
lady gaga fears classmates: los angeles ,  nov 1 (ians) singer lady gaga is still in touch with some people from h .  .  .  http/URL	negative
jasmine curtis-smith is nominated as best new female tv personality (for nandito ako) in the 26th pmpc star awards for tv .  yay !  =))	neutral
Weka tak nai chalra 	positive
Lol  -D or lee number . #Gal Good job !! ( y ) 	negative
"good morning thursday .   "" life is fragile .  we're not guaranteed a tomorrow so give it everything you've got .  ""  - tim cook [do it for jobs ! ]"	neutral
@someUSER cant wait !  coming to see you in february from belgium ! 	positive
arvind kejriwal is educated man not like some people who do politics for money .  .  .  b . j . p .  & congress are two side of same coin  , no enquiries against congress scams during 6 years government of atalji & now mr . modi  .  .  . be fooling public  .  .  . public of delhi is not foolish  .  .  . very understanding .  .  .  only aap has hope because for public grievances arvind kejriwal slept on road in delhi for winter night , no politician in india who taking panes for public .  .  . only making money by doing scams & corruption ,  every office is busy making money from bribe  .  .  . so , vote aap  .  .  . freedom from corruption . 	negative
"i still remember the  "" chitra ki kunjiya ""  .  .  .  hahahahaha mast thi  .  .  .  nandlaal dayaram urf nd  .  .  .  kundrabawa  .  .  .  .  .  yahi chalti thi  .  .  saare holiday homework aur chapter ke last ke question answer sab tha  .  .  sabse patli yahi thi  .  .  baad me refreshers moti moti aane lagi .  .  :p :p"	neutral
eid mubarak ho bhai jaan love u	positive
American+en_suffix president ke India aaney pe kuttey tak ameriki+hi_suffix hi istemaal hotey hai uski security mai aur yahan mumbai police NYPD ka kaam kar rahi ai new york mai . 	negative
ladkiya fir fail ho gyi lolz	neutral
i thought yeh meri hi school mein hota tha  .  .  i guess sab jagah same hi hai  ! 	positive
Na bhai ?? 	negative
matlab hadh ki bhi koi hadh hoti hain .  rula diya pagal . 	neutral
kachua sir angrezi bolta hai kyaa :p	positive
Or me bhi indian hu kon hota he ye jo musalman ko gali de or khud ko musalman kehta he jaheel	negative
Bhai k sath apun kab se baat karnay ka soch hi raha tha..Whats  App pr aah jana..	neutral
khejriwal plant lgayega 1000 walee note ka	positive
Han be dalle 	negative
aur aage khade hokar horn bajane me alag hi maza tha :-)	neutral
Bhai profile pic mxt HAI change mat krna	positive
saala guddu bachpan se hi dadagiri karta hai .  . 	negative
#77   On the hill side , near the temple there is a junior faculty member who sells sutta until 1 AM . Apparently only very few students know about it . 	neutral
partyg banti hai 	positive
sorry frnds bhai nahi aa sakte	negative
lov you salman	neutral
ajao vaai party karte hai tm or hum fans lok	positive
just to let u know whats happening 	negative
@someUSER @someUSER @someUSER we will take pictures .  mom said we might have to do it friday night as we will be at grammys sat	neutral
teri picture dekhne jao nah maja a aajaatah hai such iiiiiiii	positive
Sala hrami muslmano ka dushman badnam kiya hai Muslman ko kalank hai kabrustan mai tera paisa kaam nahi aayega balki #aamaal aor sabse pahle #imaan #pakka hai ya nahi	negative
Mera first kiss to Sunny Leone ke poster ke saath tha  '( 	neutral
Salman ji sirf mera hai .....hai naa salman aur oss k lye main kuch b kar sakte ......	positive
Abe kha saitan ke cakkr me pade ho	negative
bhai aaj udbilaao ko dur hi rakhna tv se .  . 	neutral
Ghar me to susre that se reh le 	positive
badi badi baatein ,  allegations lgaate ,  economy ki haalat khrab krte ,  conditions lgaate ,  fir patli gali se bhaag jaate	negative
Lekin wohi hai 	neutral
I Iike and love u salman khan aur ha kya such me aap hamare comment padhte ho aap tv par bol rahe the mai sare comment padhta hu ya u hi fake rahe the bhai ??	positive
ek baar mere wrestling stickers chura liye the mere best friend ne .  fir ek din uski book ke andar mile .  . :p	negative
Kya  kar  rha  h 	neutral
apne desh ki mahanta ko jitna bhi desh me charcha kiya jaya bhahut hi acha hai	positive
lagta hai pk movie specially pm, rss aur khachhar bhakto ki toli ko dhyan me rakhkar banai h. ab kabootar ki tarah aankhen na ghumana	negative
Salmaaannnn pls baat karo	neutral
Eid 2015 Hum sath sath bajrangi bhaijaan.	positive
i may ask my doctor for ambien on election night .  i'd rather sleep through it and hope i wake up to footage of mitt crying over his loss . 	negative
it's a paradigm shift #indvssa #wontgiveitback	neutral
got a great piece for you history buffs friday morning ,  a game between schalke &amp; bayern that marked the end of germany's greatest ever side . 	positive
#landacquisitionbill govt made doable immensely difficult for itself. out reach the hall mark of its election success is given go by.	negative
Namaskar didi 	neutral
bhai mujhe aapki film bajrangi bhaijaan ke gaane bhaut pasand  aye	positive
Dra 	negative
Salman Khan Bhai im wid u wid all ur movie? Inshallah ek baar nhi ..jitne baar ho sake utni baar jaoga bajrangi bhaijaan? baaki logo bhi yehi advice doonga..	neutral
sir janta to aapke sath hai par achchhe din thoda jaldi aana chahie	positive
Tu sefp ? 	negative
o man woh maar padne se bhi phele chillana bina murga banke sab dande padte the back side tho 4-4 underwear pehen kar aana teacher ko etna emotional kar dena woh kud bole bhai mujeh achaa ni lagta tumeh marna but tum ni sudhroge .  . 	neutral
@someUSER haha brilliant !  !  morning katie .  .  . happy friday !  bodg loves the drawing of him !  m	positive
"is it evil to laugh when a 3rd grader reads a short story ,  and at least five times ,  mistakes the name  "" becky ""  for  "" blocky ?  ""  #stickingtoit"	negative
app desh ka dadkhan jaihind	neutral
@bhavnasaini5 @ndtv bijlee to gharme bante nehi hai. uske liye bhi paisa chahiye. delhi janata sochti nehi hai.isiliye delhi ka ye hal hai.	positive
fir bimaar pado to  .  .  .  .  mummy .  .  .  .  .  aaaachhiii ;) :p	negative
dhawns wicket has fallen. india 29-1 after 6.3 #indvsuae	neutral
Me bhe aap ka bahut bada dewana hu	positive
@someUSER no thanksgiving in australia no halloween no fourth of july just australia day queens bday and christmas	negative
besides the game 1 2nd quarter knicks vs heat game .  .  .  this might be the poorest officiated game throughout the entire playoffs bro .  smh	neutral
koi kuch bhe khe ap hit ho	positive
iranian general says israel's iron dome can't deal with their missiles (keep talking like that and we may end up finding out)	negative
rubbish news .  .  .  .  baki sab badsurat hain kya ?  ?  ? 	neutral
get your sweat suits !  it's november and its time to lax !  practice tonight ,  game at @someUSER tomorrow .  #fallball	positive
#saziailmiissounlucky she could give 'friday the 13th' a complex! #aapsweep #delhidecides #feb10witharnab	negative
And yaar tu jo v conffessor h .. i like u .. and plz send mah ! Frnd rqust .... kasam se yaar ..... dil jeet liya tune 	neutral
Bhai mujhe bhi kardo nominate plz	positive
pakistan mein kal #pk movie ka release hona boht mushkil hai, kuch log dekhne jarahe hain, agar release hogai,... http://t.co/egebazwnmn	negative
pak walo patakhe kya soch kar kharid liye the yaar, ho gye na expire. ye india hai mere yaar #meninblue #indvspak	neutral
u gags are lyk sweet boxes .  .  it opens all the sweetness of childhood . 	positive
bad luck to c bcoz of no power	negative
i totaly agree with the post .. teachers hv no right to spoil students carrer now .. 	neutral
bhagwan esi gf sb ko de .. par start mjhse kre  p 	positive
Mujhe gussa un saale hinduo par aata hai jo nasmjhi me modi ji ka virodh karte hain ..	negative
Pata nhi 	neutral
rt @happychopra2311: @gurmeetramrahim #msgyouthicon lovely pick papa ji kitne sone lg rahe ho ji love u papa	positive
. .  Akshita . .  Bc 	negative
khair ki mummy ne patal/parwal ka bharwa nahi banaya .  .   .  .  dimaag ka chauka lag jata :p	neutral
omg wait ,  bel ami comes out tomorrow !  i'm going to watch it ,  finally . 	positive
Groupg pe chala gya message 	negative
ghumna band karo modiji ab thoda sarkar ko bhi dekhlo ..............................	neutral
@someUSER @someUSER looks like it's coming on valentine's day .  i liked the 4th ,  i think 5 will be just as good .  he's in russia this time . 	positive
Main ara hu di holibse ek din phle 	negative
seriously maza boht ata tha ,  ,  , mere pass mast collection hota tha	neutral
Haa hme bharosha h bhai	positive
so june 9th is the day .  this is gonna be worse the the galaxy foams	negative
i missed the 10th birthday of avril lavigne's sk8er boi !  darn ,  i love that song ,  especially the part where she rhymes boy with boy .  #classic	neutral
duwa karo india ya phir dhoni jite world cup	positive
hahaha .  .  .  .  main to waapis aa k bhi nhi pehnta tha .  .  .  .  :p	negative
@someUSER mid-feb at the moment .  i'm hoping it arrives before chinese new year ! 	neutral
ahttp/URL i love u mummy !  !  !  thank u garbage bin	positive
aap wale bhai .  aap to pura saaf . 	negative
cupid did so much work da 1st time that he don't wanna be my friend no more	neutral
media is wonderful. aaj @bjprajnathsingh ke ghar meeting hai or @narendramodi nahi ja rahe par media #rahulonleave par charch kar rahe	positive
jo khud ek mazaak ban kar rah gaya ho wo dusaron ka kya mazaak udaayega .  .  .  . agar aisa kiya hai to 1 number ka gadha hai . 	negative
